period,time,call_type,committing,disadvantaged,decision,comments,stint,game_id,game_details,game_date,scrape_time,away_score,away_team,home_score,home_team
Q4,00:46.7,Foul: Shooting,Draymond Green,Fred VanVleet,CNC,Green (GSW) is retreating his arms into a vertical position when he makes marginal contact with VanVleet's (TOR) non-shooting arm.,40.8163261% Complete    01:06.2       To       00:45.8,gameId=0022000148,Raptors(105) @ Warriors(106),"January 10, 2021",2021-01-11T20:07:48Z,105,Raptors,106,Warriors
Q4,00:33.9,Turnover: Lost Ball Out of Bounds,Stephen Curry,Fred VanVleet,CC,"Curry (GSW) loses the ball out of bounds.  After communicating with the Replay Center, the ruling on the floor of Warriors possession is confirmed.",22.44898% Complete    00:45.8       To       00:34.4,gameId=0022000148,Raptors(105) @ Warriors(106),"January 10, 2021",2021-01-11T20:07:48Z,105,Raptors,106,Warriors
Q4,00:21.7,Foul: Offensive,Norman Powell,Andrew Wiggins,CNC,Powell (TOR) establishes himself in a legal picking position in Wiggins' (GSW) path and he absorbs the contact.,63.2653046% Complete    00:34.4       To       00:03.3,gameId=0022000148,Raptors(105) @ Warriors(106),"January 10, 2021",2021-01-11T20:07:48Z,105,Raptors,106,Warriors
Q4,00:16.8,Foul: Shooting,Stephen Curry,Pascal Siakam,CNC,Curry (GSW) maintains a legal guarding position during Siakam's (TOR) drive to the basket and he makes clean contact with the ball.,63.2653046% Complete    00:34.4       To       00:03.3,gameId=0022000148,Raptors(105) @ Warriors(106),"January 10, 2021",2021-01-11T20:07:48Z,105,Raptors,106,Warriors
Q4,00:08.0,Stoppage: Out-of-Bounds,Raptors,Warriors,CNC,"After communicating with the Replay Center, the ruling on the floor of Warriors possession is confirmed.",63.2653046% Complete    00:34.4       To       00:03.3,gameId=0022000148,Raptors(105) @ Warriors(106),"January 10, 2021",2021-01-11T20:07:48Z,105,Raptors,106,Warriors
Q4,00:07.7,Foul: Personal,Pascal Siakam,Draymond Green,CNC,Siakam (TOR) briefly places an arm at Green's (GSW) side but does not affect his FOM.,63.2653046% Complete    00:34.4       To       00:03.3,gameId=0022000148,Raptors(105) @ Warriors(106),"January 10, 2021",2021-01-11T20:07:48Z,105,Raptors,106,Warriors
Q4,00:03.3,Foul: Personal,Kyle Lowry,Damion Lee,CC,"Lowry (TOR) reaches in and makes contact to Lee's (GSW) arm before the start of his upward shooting motion.  After communicating with the Replay Center, a common foul is ruled.",-2.04081631% Complete    00:03.3       To       00:04.3,gameId=0022000148,Raptors(105) @ Warriors(106),"January 10, 2021",2021-01-11T20:07:48Z,105,Raptors,106,Warriors
Q4,00:00.4,Foul: Shooting,Andrew Wiggins,Pascal Siakam,CNC,"Wiggins (GSW) makes incidental ""high-five"" contact with Siakam (TOR) after the release that does not affect his jump shot attempt.",8.163265% Complete    00:04.3       To       00:00.0,gameId=0022000148,Raptors(105) @ Warriors(106),"January 10, 2021",2021-01-11T20:07:48Z,105,Raptors,106,Warriors
Q4,01:51.8,Foul: Offensive,Jonas Valanciunas,Damyean Dotson,CNC,Valanciunas (MEM) firms up in his screening position in Dotson's (CLE) path and does not deliver the contact.,46.9387741% Complete    02:05.6       To       01:42.2,gameId=0022000150,Grizzlies(101) @ Cavaliers(91),"January 11, 2021",2021-01-12T19:38:02Z,101,Grizzlies,91,Cavaliers
Q4,01:49.7,Foul: Offensive,Jonas Valanciunas,Isaac Okoro,CNC,Valanciunas (MEM) establishes himself in a screening position in Okoro's (CLE) path and does not deliver the contact.,46.9387741% Complete    02:05.6       To       01:42.2,gameId=0022000150,Grizzlies(101) @ Cavaliers(91),"January 11, 2021",2021-01-12T19:38:02Z,101,Grizzlies,91,Cavaliers
Q4,01:47.8,Foul: Offensive,Jonas Valanciunas,Andre Drummond,CNC,Valanciunas (MEM) and Drummond (CLE) engage and disengage with one another in the lane.,46.9387741% Complete    02:05.6       To       01:42.2,gameId=0022000150,Grizzlies(101) @ Cavaliers(91),"January 11, 2021",2021-01-12T19:38:02Z,101,Grizzlies,91,Cavaliers
Q4,01:44.3,Foul: Loose Ball,Jonas Valanciunas,Andre Drummond,CNC,Valanciunas (MEM) makes clean contact with the ball and it becomes dislodged prior to incidental contact taking place with Drummond (CLE) during rebounding.,46.9387741% Complete    02:05.6       To       01:42.2,gameId=0022000150,Grizzlies(101) @ Cavaliers(91),"January 11, 2021",2021-01-12T19:38:02Z,101,Grizzlies,91,Cavaliers
Q4,01:29.7,Foul: Shooting,Jonas Valanciunas,Andre Drummond,INC,Valanciunas (MEM) moves laterally and delivers contact to Drummond's (CLE) side that affects his driving shot attempt.,26.5306129% Complete    01:42.2       To       01:28.8,gameId=0022000150,Grizzlies(101) @ Cavaliers(91),"January 11, 2021",2021-01-12T19:38:02Z,101,Grizzlies,91,Cavaliers
Q4,01:15.6,Foul: Shooting,Andre Drummond,Tyus Jones,CC,Drummond (CLE) swipes down and makes contact across Jones' (MEM) left arm during the driving shot attempt.,26.5306129% Complete    01:28.8       To       01:15.0,gameId=0022000150,Grizzlies(101) @ Cavaliers(91),"January 11, 2021",2021-01-12T19:38:02Z,101,Grizzlies,91,Cavaliers
Q4,01:11.0,Foul: Personal,Tyus Jones,Andre Drummond,CNC,Jones (MEM) swipes forward and makes a slight brush with Drummond's (CLE) right wrist at the end of the drive.,32.65306% Complete    01:15.0       To       00:58.5,gameId=0022000150,Grizzlies(101) @ Cavaliers(91),"January 11, 2021",2021-01-12T19:38:02Z,101,Grizzlies,91,Cavaliers
Q4,01:11.0,Foul: Personal,Jonas Valanciunas,Andre Drummond,CNC,"Valanciunas (MEM) is in a legal guarding position when marginal body contact occurs with Drummond (CLE) in the lane, which Valanciunas absorbs.",32.65306% Complete    01:15.0       To       00:58.5,gameId=0022000150,Grizzlies(101) @ Cavaliers(91),"January 11, 2021",2021-01-12T19:38:02Z,101,Grizzlies,91,Cavaliers
Q4,01:08.0,Violation: Kicked Ball,Jonas Valanciunas,Cavaliers,CC,"Valanciunas (MEM) uses his leg to dislodge the ball from Drummond (CLE).  Following the whistle, Valanciunas (MEM) inadvertently makes contact with Drummond.",32.65306% Complete    01:15.0       To       00:58.5,gameId=0022000150,Grizzlies(101) @ Cavaliers(91),"January 11, 2021",2021-01-12T19:38:02Z,101,Grizzlies,91,Cavaliers
Q4,01:04.0,Foul: Personal,Dillon Brooks,Cedi Osman,CNC,Brooks (MEM) and Osman (CLE) engage and disengage with one another off-ball.,32.65306% Complete    01:15.0       To       00:58.5,gameId=0022000150,Grizzlies(101) @ Cavaliers(91),"January 11, 2021",2021-01-12T19:38:02Z,101,Grizzlies,91,Cavaliers
Q4,01:00.0,Foul: Personal,Kyle Anderson,Andre Drummond,CNC,Anderson (MEM) reaches in and makes clean contact with the ball as Drummond (CLE) dribbles near the free throw line.,32.65306% Complete    01:15.0       To       00:58.5,gameId=0022000150,Grizzlies(101) @ Cavaliers(91),"January 11, 2021",2021-01-12T19:38:02Z,101,Grizzlies,91,Cavaliers
Q4,00:58.5,Turnover:  Out of Bounds - Bad Pass Turn,Andre Drummond,Jonas Valanciunas,CC,Drummond (CLE) touches the ball last before it goes out of bounds.,32.65306% Complete    01:15.0       To       00:58.5,gameId=0022000150,Grizzlies(101) @ Cavaliers(91),"January 11, 2021",2021-01-12T19:38:02Z,101,Grizzlies,91,Cavaliers
Q4,00:53.9,Turnover: Traveling,Kyle Anderson,Cavaliers,INC,Anderson (MEM) slides his pivot foot at the start of his dribble.,44.89796% Complete    00:58.5       To       00:36.1,gameId=0022000150,Grizzlies(101) @ Cavaliers(91),"January 11, 2021",2021-01-12T19:38:02Z,101,Grizzlies,91,Cavaliers
Q4,00:52.3,Foul: Personal,Larry Nance Jr.,Kyle Anderson,CNC,Nance Jr. (CLE) makes marginal contact with Anderson's (MEM) side as Anderson starts his dribble.,44.89796% Complete    00:58.5       To       00:36.1,gameId=0022000150,Grizzlies(101) @ Cavaliers(91),"January 11, 2021",2021-01-12T19:38:02Z,101,Grizzlies,91,Cavaliers
Q4,00:48.6,Foul: Personal,Damyean Dotson,Tyus Jones,CNC,Dotson (CLE) has his hand rested on Jones' (MEM) front and marginal contact occurs as Jones passes the ball.,44.89796% Complete    00:58.5       To       00:36.1,gameId=0022000150,Grizzlies(101) @ Cavaliers(91),"January 11, 2021",2021-01-12T19:38:02Z,101,Grizzlies,91,Cavaliers
Q4,00:37.9,Foul: Shooting,Damyean Dotson,Dillon Brooks,CNC,Dotson (CLE) jumps to the side of Brooks (MEM) and would have avoid making contact with him if Brooks hadn't extended his left foot to the side.,44.89796% Complete    00:58.5       To       00:36.1,gameId=0022000150,Grizzlies(101) @ Cavaliers(91),"January 11, 2021",2021-01-12T19:38:02Z,101,Grizzlies,91,Cavaliers
Q4,00:31.1,Foul: Shooting,Jonas Valanciunas,Andre Drummond,CC,Valanciunas (MEM) delivers body contact to Drummond (CLE) after his gather.,10.2040815% Complete    00:36.1       To       00:31.0,gameId=0022000150,Grizzlies(101) @ Cavaliers(91),"January 11, 2021",2021-01-12T19:38:02Z,101,Grizzlies,91,Cavaliers
Q4,00:31.0,Foul: Loose Ball,Cedi Osman,Kyle Anderson,CNC,"As Osman (CLE) returns to the floor during the rebound, his left arm extends outward to brace for contact and some occurs with Anderson's (MEM) head/neck area. Contact to an opponent?s head/face can be deemed marginal when the result of a natural basketball move, provided the contact is not disproportionate or uncontrolled.",10.2040815% Complete    00:36.1       To       00:31.0,gameId=0022000150,Grizzlies(101) @ Cavaliers(91),"January 11, 2021",2021-01-12T19:38:02Z,101,Grizzlies,91,Cavaliers
Q4,00:26.1,Foul: Personal,Andre Drummond,Dillon Brooks,IC,Drummond (CLE) reaches in and makes clean contact with the ball before incidental contact occurs with Brooks (MEM).,8.163265% Complete    00:31.0       To       00:26.1,gameId=0022000150,Grizzlies(101) @ Cavaliers(91),"January 11, 2021",2021-01-12T19:38:02Z,101,Grizzlies,91,Cavaliers
Q4,00:19.6,Foul: Loose Ball,Larry Nance Jr.,Dillon Brooks,CNC,Nance Jr. (CLE) and Brooks (MEM) engage and disengage with one another during rebounding.,12.2448978% Complete    00:26.1       To       00:19.6,gameId=0022000150,Grizzlies(101) @ Cavaliers(91),"January 11, 2021",2021-01-12T19:38:02Z,101,Grizzlies,91,Cavaliers
Q4,01:39,Foul: Personal,Gary Trent Jr.,Fred VanVleet,CNC,Trent Jr. (POR) makes marginal contact with a bent forearm to VanVleet's (TOR) side and slides it off defending his drive to the basket.,38.77551% Complete    01:48.5       To       01:29.5,gameId=0022000155,Raptors(111) @ Trail Blazers(112),"January 11, 2021",2021-01-12T19:38:24Z,111,Raptors,112,Trail Blazers
Q4,01:33.9,Foul: Personal,Carmelo Anthony,Fred VanVleet,CNC,Anthony (POR) hedges the pick and makes marginal contact to VanVleet (TOR) as he absorbs the contact.,38.77551% Complete    01:48.5       To       01:29.5,gameId=0022000155,Raptors(111) @ Trail Blazers(112),"January 11, 2021",2021-01-12T19:38:24Z,111,Raptors,112,Trail Blazers
Q4,01:31.1,Foul: Defense 3 Second,Damian Lillard,Raptors,CNC,Lillard (POR) is in the paint for less than three seconds when the shot is imminent.,38.77551% Complete    01:48.5       To       01:29.5,gameId=0022000155,Raptors(111) @ Trail Blazers(112),"January 11, 2021",2021-01-12T19:38:24Z,111,Raptors,112,Trail Blazers
Q4,01:31.1,Foul: Shooting,Chris Boucher,Gary Trent Jr.,INC,Trent Jr. (POR) makes lower body contact with Boucher (TOR) that affects his jump shot attempt.,38.77551% Complete    01:48.5       To       01:29.5,gameId=0022000155,Raptors(111) @ Trail Blazers(112),"January 11, 2021",2021-01-12T19:38:24Z,111,Raptors,112,Trail Blazers
Q4,01:29.5,Foul: Personal,Pascal Siakam,Damian Lillard,CNC,Siakam (TOR) makes marginal contact as he moves alongside of Lillard's (POR) drive to the basket and he does not cause him to lose control of the ball.,38.77551% Complete    01:29.5       To       01:09.6,gameId=0022000155,Raptors(111) @ Trail Blazers(112),"January 11, 2021",2021-01-12T19:38:24Z,111,Raptors,112,Trail Blazers
Q4,01:10.1,Turnover: Lost Ball Out of Bounds,Damian Lillard,OG Anunoby,CC,Lillard (POR) is the last person to touch the ball before it goes out of bounds.,38.77551% Complete    01:29.5       To       01:09.6,gameId=0022000155,Raptors(111) @ Trail Blazers(112),"January 11, 2021",2021-01-12T19:38:24Z,111,Raptors,112,Trail Blazers
Q4,01:04.5,Foul: Personal,Robert Covington,Pascal Siakam,CNC,Covington (POR) makes contact with the ball and dislodges the ball at the end of Siakam's (TOR) drive. Any ensuing contact is deemed incidental.,30.6122456% Complete    01:09.6       To       00:53.9,gameId=0022000155,Raptors(111) @ Trail Blazers(112),"January 11, 2021",2021-01-12T19:38:24Z,111,Raptors,112,Trail Blazers
Q4,01:00.0,Foul: Offensive,Kyle Lowry,CJ McCollum,CNC,Lowry (TOR) establishes himself in a screening position in McCollum's (POR) path and absorbs the contact.,30.6122456% Complete    01:09.6       To       00:53.9,gameId=0022000155,Raptors(111) @ Trail Blazers(112),"January 11, 2021",2021-01-12T19:38:24Z,111,Raptors,112,Trail Blazers
Q4,00:55,Foul: Personal,Gary Trent Jr.,Kyle Lowry,CNC,Trent Jr. (POR) and Lowry (TOR) engage and disengage with one another off ball.,30.6122456% Complete    01:09.6       To       00:53.9,gameId=0022000155,Raptors(111) @ Trail Blazers(112),"January 11, 2021",2021-01-12T19:38:24Z,111,Raptors,112,Trail Blazers
Q4,00:53.9,Foul: Personal,Fred VanVleet,Damian Lillard,CNC,VanVleet (TOR) makes marginal contact to Lillard (POR) defending his drive to the basket.,30.6122456% Complete    00:53.9       To       00:38.9,gameId=0022000155,Raptors(111) @ Trail Blazers(112),"January 11, 2021",2021-01-12T19:38:24Z,111,Raptors,112,Trail Blazers
Q4,00:23.6,Foul: Offensive,Kyle Lowry,Damian Lillard,INC,Lowry (TOR) goes through Lillard (POR) at the end of his drive as he makes the pass and the contact dislodges him from his legally obtained position.,38.77551% Complete    00:38.9       To       00:19.0,gameId=0022000155,Raptors(111) @ Trail Blazers(112),"January 11, 2021",2021-01-12T19:38:24Z,111,Raptors,112,Trail Blazers
Q4,00:02.6,Foul: Shooting,Robert Covington,Pascal Siakam,CNC,Covington (POR) makes marginal contact with Siakam's (TOR) non-shooting arm as he retreats his arm to a vertical position and the contact does not affect his shot attempt.,18.3673477% Complete    00:09.6       To       00:00.0,gameId=0022000155,Raptors(111) @ Trail Blazers(112),"January 11, 2021",2021-01-12T19:38:24Z,111,Raptors,112,Trail Blazers
Q4,00:00.0,Foul: Loose Ball,Gary Trent Jr.,Pascal Siakam,CNC,Trent Jr. (POR) makes marginal contact to Siakam (TOR) as they engage for the loose ball.,18.3673477% Complete    00:09.6       To       00:00.0,gameId=0022000155,Raptors(111) @ Trail Blazers(112),"January 11, 2021",2021-01-12T19:38:24Z,111,Raptors,112,Trail Blazers
Q4,01:59.3,Foul: Shooting,Domantas Sabonis,Harrison Barnes,INC,Sabonis (IND) does not maintain verticality as he makes contact  to Barnes' (SAC) head that affects his driving shot attempt.,34.69388% Complete    02:16.3       To       01:58.8,gameId=0022000156,Pacers(122) @ Kings(127),"January 11, 2021",2021-01-12T19:38:43Z,122,Pacers,127,Kings
Q4,01:53.0,Foul: Shooting,Buddy Hield,Victor Oladipo,CNC,Hield (SAC) makes marginal contact to Oladipo's arm and does not affect his driving shot attempt.,12.2448978% Complete    01:58.8       To       01:52.2,gameId=0022000156,Pacers(122) @ Kings(127),"January 11, 2021",2021-01-12T19:38:43Z,122,Pacers,127,Kings
Q4,01:45.8,Foul: Shooting,Domantas Sabonis,Harrison Barnes,CC,Sabonis (IND) makes contact with Barnes' (SAC) arm that affects his driving shot attempt.,12.2448978% Complete    01:52.2       To       01:45.7,gameId=0022000156,Pacers(122) @ Kings(127),"January 11, 2021",2021-01-12T19:38:43Z,122,Pacers,127,Kings
Q4,01:39.0,Foul: Personal,Buddy Hield,Victor Oladipo,CNC,Hield (SAC) cleanly dislodges the ball from Oladipo (IND) at the end of his drive.,38.77551% Complete    01:45.7       To       01:26.0,gameId=0022000156,Pacers(122) @ Kings(127),"January 11, 2021",2021-01-12T19:38:43Z,122,Pacers,127,Kings
Q4,01:34.2,Foul: Offensive,Victor Oladipo,Richaun Holmes,CNC,Oladipo (IND) gives Holmes (SAC) room to avoid the contact as he establishes himself in a screening position.,38.77551% Complete    01:45.7       To       01:26.0,gameId=0022000156,Pacers(122) @ Kings(127),"January 11, 2021",2021-01-12T19:38:43Z,122,Pacers,127,Kings
Q4,01:26.4,Instant Replay: Overturn Ruling,Richaun Holmes,Pacers,CNC,"After communicating with the Replay Center, the ruling on the floor of defensive goaltending on Holmes (SAC) is overturned.",38.77551% Complete    01:45.7       To       01:26.0,gameId=0022000156,Pacers(122) @ Kings(127),"January 11, 2021",2021-01-12T19:38:43Z,122,Pacers,127,Kings
Q4,01:16.7,Foul: Shooting,Domantas Sabonis,De'Aaron Fox,CNC,Sabonis (IND) absorbs the contact from Fox (SAC) and the contact is marginal during his driving shot attempt.,34.69388% Complete    01:26.0       To       01:09.0,gameId=0022000156,Pacers(122) @ Kings(127),"January 11, 2021",2021-01-12T19:38:43Z,122,Pacers,127,Kings
Q4,01:14,Foul: Personal,Malcolm Brogdon,Richaun Holmes,INC,Brogdon (IND) makes contact to Holmes' (SAC) arm that affects his control of the ball after securing the rebound.,34.69388% Complete    01:26.0       To       01:09.0,gameId=0022000156,Pacers(122) @ Kings(127),"January 11, 2021",2021-01-12T19:38:43Z,122,Pacers,127,Kings
Q4,00:57.6,Foul: Offensive,Domantas Sabonis,Harrison Barnes,CNC,Sabonis (IND) engages and disengages with Barnes (SAC) during the pick.,28.5714283% Complete    01:09.0       To       00:54.9,gameId=0022000156,Pacers(122) @ Kings(127),"January 11, 2021",2021-01-12T19:38:43Z,122,Pacers,127,Kings
Q4,00:33.7,Foul: Shooting,Malcolm Brogdon,De'Aaron Fox,CNC,Brogdon (IND) makes marginal contact to Fox's (SAC) body during his shooting motion that does not affect his driving shot attempt.,42.8571434% Complete    00:54.9       To       00:33.4,gameId=0022000156,Pacers(122) @ Kings(127),"January 11, 2021",2021-01-12T19:38:43Z,122,Pacers,127,Kings
Q4,00:32.4,Foul: Offensive,Domantas Sabonis,Harrison Barnes,CNC,Sabonis (IND) establishes himself in a screening position in the path of Barnes (SAC) and absorbs the contact.,6.122449% Complete    00:33.4       To       00:29.7,gameId=0022000156,Pacers(122) @ Kings(127),"January 11, 2021",2021-01-12T19:38:43Z,122,Pacers,127,Kings
Q4,00:28.4,Violation: Kicked Ball,Victor Oladipo,Kings,CC,Oladipo (IND) intentionally lifts his leg and makes contact with the ball.,4.08163261% Complete    00:29.7       To       00:27.2,gameId=0022000156,Pacers(122) @ Kings(127),"January 11, 2021",2021-01-12T19:38:43Z,122,Pacers,127,Kings
Q4,00:27.3,Foul: Personal,Doug McDermott,Richaun Holmes,CC,McDermott (IND) makes contact to Holmes (SAC) arm that affects his FOM.,4.08163261% Complete    00:29.7       To       00:27.2,gameId=0022000156,Pacers(122) @ Kings(127),"January 11, 2021",2021-01-12T19:38:43Z,122,Pacers,127,Kings
Q4,00:19.1,Foul: Loose Ball,Domantas Sabonis,Richaun Holmes,CNC,Sabonis (IND) cleanly dislodges the ball from Holmes (SAC) during the rebound.,16.32653% Complete    00:27.2       To       00:19.1,gameId=0022000156,Pacers(122) @ Kings(127),"January 11, 2021",2021-01-12T19:38:43Z,122,Pacers,127,Kings
Q4,00:17.4,Foul: Personal,Justin Holiday,Tyrese Haliburton,CC,Holiday (IND) commits a take foul on Haliburton (SAC).,2.04081631% Complete    00:19.1       To       00:17.3,gameId=0022000156,Pacers(122) @ Kings(127),"January 11, 2021",2021-01-12T19:38:43Z,122,Pacers,127,Kings
Q4,00:13.8,Foul: Personal,De'Aaron Fox,Malcolm Brogdon,CC,Fox (SAC) commits a take foul on Brogdon (IND).,14.2857141% Complete    00:17.3       To       00:10.3,gameId=0022000156,Pacers(122) @ Kings(127),"January 11, 2021",2021-01-12T19:38:43Z,122,Pacers,127,Kings
Q4,00:12.5,Foul: Personal,Harrison Barnes,Victor Oladipo,INC,Barnes (SAC) makes contact to Oladipo's (IND) arm that affects his jump shot attempt.,14.2857141% Complete    00:17.3       To       00:10.3,gameId=0022000156,Pacers(122) @ Kings(127),"January 11, 2021",2021-01-12T19:38:43Z,122,Pacers,127,Kings
Q4,00:08.8,Foul: Personal,Malcolm Brogdon,Cory Joseph,CC,Brogdon (IND) commits a take foul on Joseph (SAC).,2.04081631% Complete    00:10.3       To       00:08.8,gameId=0022000156,Pacers(122) @ Kings(127),"January 11, 2021",2021-01-12T19:38:43Z,122,Pacers,127,Kings
Q4,01:58.9,Foul: Offensive,Kelly Olynyk,Danny Green,CNC,Olynyk (MIA) establishes himself in a screening position in the path of Green (PHI) and absorbs the contact.,28.5714283% Complete    02:03.7       To       01:49.6,gameId=0022000157,Heat(134) @ 76ers(137),"January 12, 2021",2021-01-13T21:22:41Z,134,Heat,137,76ers
Q4,01:56.5,Foul: Personal,Joel Embiid,Kelly Olynyk,CNC,Embiid (PHI) makes marginal contact with Olynyk (MIA) at the end of his drive and does not dislodge him.,28.5714283% Complete    02:03.7       To       01:49.6,gameId=0022000157,Heat(134) @ 76ers(137),"January 12, 2021",2021-01-13T21:22:41Z,134,Heat,137,76ers
Q4,01:37,Foul: Offensive,Joel Embiid,Duncan Robinson,CNC,Embiid (PHI) is not in the path of Robinson (MIA) when he sets the screen but the contact is marginal.,46.9387741% Complete    01:49.6       To       01:25.9,gameId=0022000157,Heat(134) @ 76ers(137),"January 12, 2021",2021-01-13T21:22:41Z,134,Heat,137,76ers
Q4,01:27,Foul: Personal,Tyler Herro,Danny Green,CNC,Herro (MIA) brushes Green's (PHI) arm prior to the start of his upward shooting motion.,46.9387741% Complete    01:49.6       To       01:25.9,gameId=0022000157,Heat(134) @ 76ers(137),"January 12, 2021",2021-01-13T21:22:41Z,134,Heat,137,76ers
Q4,01:26.9,Foul: Shooting,Tyler Herro,Danny Green,CNC,"During his jump shot attempt, Green (PHI) initiates the contact with Herro (MIA), who is in a legal guarding position.",46.9387741% Complete    01:49.6       To       01:25.9,gameId=0022000157,Heat(134) @ 76ers(137),"January 12, 2021",2021-01-13T21:22:41Z,134,Heat,137,76ers
Q4,01:23.4,Turnover: 24 Second Violation,76ers,Heat,CC,A 24 second violation is correctly called.,46.9387741% Complete    01:49.6       To       01:25.9,gameId=0022000157,Heat(134) @ 76ers(137),"January 12, 2021",2021-01-13T21:22:41Z,134,Heat,137,76ers
Q4,01:17.2,Foul: Shooting,Isaiah Joe,Gabe Vincent,CNC,Joe (PHI) dislodges the ball from Vincent (MIA) during his driving shot attempt. Any arm contact after the dislodge is deemed incidental.,22.44898% Complete    01:25.9       To       01:14.8,gameId=0022000157,Heat(134) @ 76ers(137),"January 12, 2021",2021-01-13T21:22:41Z,134,Heat,137,76ers
Q4,01:16.1,Foul: Shooting,Joel Embiid,Precious Achiuwa,CNC,Embiid (PHI) makes contact to Achiuwa's (MIA) body after the release that does not affect his play at the basket.,22.44898% Complete    01:25.9       To       01:14.8,gameId=0022000157,Heat(134) @ 76ers(137),"January 12, 2021",2021-01-13T21:22:41Z,134,Heat,137,76ers
Q4,01:03.5,Foul: Personal,Precious Achiuwa,Joel Embiid,CNC,Achiuwa (MIA) makes marginal contact with Embiid (PHI) during the start of his drive that does not cause him to lose control of the ball.,26.5306129% Complete    01:14.8       To       01:01.7,gameId=0022000157,Heat(134) @ 76ers(137),"January 12, 2021",2021-01-13T21:22:41Z,134,Heat,137,76ers
Q4,01:00,Foul: Personal,Joel Embiid,Kelly Olynyk,CNC,Embiid (PHI) makes incidental contact to Olynyk's (MIA) body and does not dislodge him.,32.65306% Complete    01:01.7       To       00:45.2,gameId=0022000157,Heat(134) @ 76ers(137),"January 12, 2021",2021-01-13T21:22:41Z,134,Heat,137,76ers
Q4,00:45.6,Foul: Shooting,Danny Green,Precious Achiuwa,CNC,Green (PHI) makes marginal contact with Achiuwa's (MIA) body that does not affect his shot attempt at the rim.,32.65306% Complete    01:01.7       To       00:45.2,gameId=0022000157,Heat(134) @ 76ers(137),"January 12, 2021",2021-01-13T21:22:41Z,134,Heat,137,76ers
Q4,00:40.2,Foul: Personal,Andre Iguodala,Danny Green,CNC,Iguodala (MIA) makes hand on ball contact with Green (PHI) on the perimeter.,14.2857141% Complete    00:45.2       To       00:38.0,gameId=0022000157,Heat(134) @ 76ers(137),"January 12, 2021",2021-01-13T21:22:41Z,134,Heat,137,76ers
Q4,00:38.0,Foul: Personal,Andre Iguodala,Danny Green,CNC,Iguodala (MIA) cleanly dislodges the ball from Green (PHI).,14.2857141% Complete    00:45.2       To       00:38.0,gameId=0022000157,Heat(134) @ 76ers(137),"January 12, 2021",2021-01-13T21:22:41Z,134,Heat,137,76ers
Q4,00:37.1,Foul: Loose Ball,Danny Green,Andre Iguodala,CNC,Green (PHI) makes incidental contact with Iguodala's (MIA) head as he attempts to get to the loose ball.,14.2857141% Complete    00:45.2       To       00:38.0,gameId=0022000157,Heat(134) @ 76ers(137),"January 12, 2021",2021-01-13T21:22:41Z,134,Heat,137,76ers
Q4,00:32.2,Foul: Shooting,Tyrese Maxey,Tyler Herro,CC,Maxey (PHI) makes contact with Herro's (MIA) body that affects his driving shot attempt.,10.2040815% Complete    00:38.0       To       00:32.2,gameId=0022000157,Heat(134) @ 76ers(137),"January 12, 2021",2021-01-13T21:22:41Z,134,Heat,137,76ers
Q4,00:19.6,Foul: Personal,Danny Green,Tyler Herro,CNC,Green (PHI) makes clean contact to the ball while defending Herro (MIA) in the backcourt.,2.04081631% Complete    00:21.5       To       00:19.6,gameId=0022000157,Heat(134) @ 76ers(137),"January 12, 2021",2021-01-13T21:22:41Z,134,Heat,137,76ers
