period,time,call_type,committing,disadvantaged,decision,comments,stint,game_id,game_details,game_date,scrape_time,away_score,away_team,home_score,home_team
Q4,01:14.8,Foul: Offensive,Damian Lillard,Eric Gordon,CNC,Lillard (POR) releases from Gordon (HOU) prior to his gather on the perimeter.,42.8571434% Complete    01:16.2       To       00:54.7,gameId=0022000287,Trail Blazers(101) @ Rockets(104),"January 28, 2021",2021-01-29T21:17:26Z,101,Trail Blazers,104,Rockets
Q4,00:29.4,Foul: Offensive,P.J. Tucker,Gary Trent Jr.,CNC,Tucker (HOU) establishes himself in a screening position in the path of Trent Jr. (POR) and absorbs the contact during the pick.,57.1428566% Complete    00:54.7       To       00:26.2,gameId=0022000287,Trail Blazers(101) @ Rockets(104),"January 28, 2021",2021-01-29T21:17:26Z,101,Trail Blazers,104,Rockets
Q4,00:27.0,Foul: Shooting,Enes Kanter,Victor Oladipo,CNC,Kanter (POR) absorbs the contact to Oladipo's (HOU) body and does not affect his driving shot attempt.,57.1428566% Complete    00:54.7       To       00:26.2,gameId=0022000287,Trail Blazers(101) @ Rockets(104),"January 28, 2021",2021-01-29T21:17:26Z,101,Trail Blazers,104,Rockets
Q4,00:26.2,Foul: Personal,Victor Oladipo,Damian Lillard,CNC,Oladipo (POR) makes marginal contact with Lillard (POR) as Lillard stops short in his path during the inbound.,6.122449% Complete    00:26.2       To       00:22.4,gameId=0022000287,Trail Blazers(101) @ Rockets(104),"January 28, 2021",2021-01-29T21:17:26Z,101,Trail Blazers,104,Rockets
Q4,00:23.7,Foul: Shooting,David Nwaba,Gary Trent Jr.,CNC,Nwaba (HOU) makes marginal contact with Trent Jr.'s (POR) body during his driving shot attempt.,6.122449% Complete    00:26.2       To       00:22.4,gameId=0022000287,Trail Blazers(101) @ Rockets(104),"January 28, 2021",2021-01-29T21:17:26Z,101,Trail Blazers,104,Rockets
Q4,00:22.4,Foul: Loose Ball,Enes Kanter,David Nwaba,CNC,Kanter (POR) deflects the ball from Nwaba (HOU) during the rebound.,6.122449% Complete    00:26.2       To       00:22.4,gameId=0022000287,Trail Blazers(101) @ Rockets(104),"January 28, 2021",2021-01-29T21:17:26Z,101,Trail Blazers,104,Rockets
Q4,00:20.7,Foul: Personal,Enes Kanter,P.J. Tucker,CC,Kanter (POR) commits a take foul on Tucker (HOU).,10.2040815% Complete    00:22.4       To       00:17.3,gameId=0022000287,Trail Blazers(101) @ Rockets(104),"January 28, 2021",2021-01-29T21:17:26Z,101,Trail Blazers,104,Rockets
Q4,00:17.3,Foul: Personal,Carmelo Anthony,Christian Wood,CC,Anthony (POR) commits a take foul on Wood (HOU).,10.2040815% Complete    00:22.4       To       00:17.3,gameId=0022000287,Trail Blazers(101) @ Rockets(104),"January 28, 2021",2021-01-29T21:17:26Z,101,Trail Blazers,104,Rockets
Q4,00:16.8,Foul: Personal,Christian Wood,Damian Lillard,CNC,Wood (HOU) makes marginal contact to Lillard's (POR) body after securing the loose ball.,28.5714283% Complete    00:17.3       To       00:03.0,gameId=0022000287,Trail Blazers(101) @ Rockets(104),"January 28, 2021",2021-01-29T21:17:26Z,101,Trail Blazers,104,Rockets
Q4,00:02.1,Foul: Personal,Nassir Little,Eric Gordon,CC,Little (POR) commits a take foul on Gordon (HOU).,2.04081631% Complete    00:03.0       To       00:02.0,gameId=0022000287,Trail Blazers(101) @ Rockets(104),"January 28, 2021",2021-01-29T21:17:26Z,101,Trail Blazers,104,Rockets
Q4,01:56.1,Foul: Shooting,Terry Rozier,Malcolm Brogdon,CNC,Rozier's (CHA) right arm is extended forward as marginal contact occurs with Brogdon's (IND) front during the driving shot attempt.,24.4897957% Complete    02:07.8       To       01:55.0,gameId=0022000288,Pacers(105) @ Hornets(108),"January 29, 2021",2021-01-31T19:22:51Z,105,Pacers,108,Hornets
Q4,01:47.1,Foul: Shooting,Domantas Sabonis,Cody Zeller,CNC,"Sabonis (IND) turns slightly as he establishes verticality and absorbs the body contact made with Zeller (CHA) during the driving shot attempt. After absorbing the body contact, Sabonis' arm comes down slightly and brushes Zeller's arm.",18.3673477% Complete    01:55.0       To       01:46.0,gameId=0022000288,Pacers(105) @ Hornets(108),"January 29, 2021",2021-01-31T19:22:51Z,105,Pacers,108,Hornets
Q4,01:47.1,Foul: Offensive,Cody Zeller,Domantas Sabonis,CNC,Zeller (CHA) does not unnaturally extend his knee into Sabonis (IND) and the contact that occurs is marginal.,18.3673477% Complete    01:55.0       To       01:46.0,gameId=0022000288,Pacers(105) @ Hornets(108),"January 29, 2021",2021-01-31T19:22:51Z,105,Pacers,108,Hornets
Q4,01:34.9,Foul: Offensive,Myles Turner,Gordon Hayward,CNC,Turner (IND) and Hayward (CHA) engage and disengage with one another off ball.,28.5714283% Complete    01:46.0       To       01:31.9,gameId=0022000288,Pacers(105) @ Hornets(108),"January 29, 2021",2021-01-31T19:22:51Z,105,Pacers,108,Hornets
Q4,01:25.8,Foul: Personal,Domantas Sabonis,Gordon Hayward,CNC,Sabonis (IND) and Hayward (CHA) engage and disengage with one another off ball.,42.8571434% Complete    01:31.9       To       01:10.0,gameId=0022000288,Pacers(105) @ Hornets(108),"January 29, 2021",2021-01-31T19:22:51Z,105,Pacers,108,Hornets
Q4,01:20.8,Foul: Offensive,Cody Zeller,Justin Holiday,CNC,Zeller (CHA) establishes himself in a screening position in Holiday's (IND) path and does not deliver the contact.,42.8571434% Complete    01:31.9       To       01:10.0,gameId=0022000288,Pacers(105) @ Hornets(108),"January 29, 2021",2021-01-31T19:22:51Z,105,Pacers,108,Hornets
Q4,01:16.1,Foul: Shooting,Justin Holiday,Gordon Hayward,CNC,Holiday (IND) brushes Hayward's (CHA) backside and marginal contact occurs after Hayward's gather.,42.8571434% Complete    01:31.9       To       01:10.0,gameId=0022000288,Pacers(105) @ Hornets(108),"January 29, 2021",2021-01-31T19:22:51Z,105,Pacers,108,Hornets
Q4,01:16.1,Foul: Offensive,Cody Zeller,Myles Turner,CNC,Zeller (CHA) extends slightly as he attains rebounding position and marginal body contact takes place with Turner (IND) when the shot attempt occurs.,42.8571434% Complete    01:31.9       To       01:10.0,gameId=0022000288,Pacers(105) @ Hornets(108),"January 29, 2021",2021-01-31T19:22:51Z,105,Pacers,108,Hornets
Q4,01:13.8,Foul: Loose Ball,Gordon Hayward,Myles Turner,CNC,"Hayward's (CHA) arm continues to move backward after back-tapping the ball and some contact occurs with Turner's (IND) head/neck area. Contact to an opponent's head/face can be deemed marginal when the result of a natural basketball move, provided the contact is not disproportionate or uncontrolled.",42.8571434% Complete    01:31.9       To       01:10.0,gameId=0022000288,Pacers(105) @ Hornets(108),"January 29, 2021",2021-01-31T19:22:51Z,105,Pacers,108,Hornets
Q4,01:00.2,Foul: Shooting,Cody Zeller,Jeremy Lamb,CNC,Zeller's (CHA) left arm is extended forward when marginal contact occurs with Lamb's (IND) front after his gather. Zeller cleanly blocks the driving shot attempt thereafter.,20.4081631% Complete    01:10.0       To       00:59.4,gameId=0022000288,Pacers(105) @ Hornets(108),"January 29, 2021",2021-01-31T19:22:51Z,105,Pacers,108,Hornets
Q4,00:45.5,Foul: Personal,Cody Zeller,Domantas Sabonis,CNC,Zeller (CHA) and Sabonis (IND) engage and disengage with one another along the perimeter.,22.44898% Complete    00:52.6       To       00:41.6,gameId=0022000288,Pacers(105) @ Hornets(108),"January 29, 2021",2021-01-31T19:22:51Z,105,Pacers,108,Hornets
Q4,00:34.0,Turnover: 8 Second Violation,Devonte' Graham,Pacers,CNC,Graham (CHA) brings the ball across half-court prior to eight full seconds elapsing.,42.8571434% Complete    00:41.6       To       00:20.4,gameId=0022000288,Pacers(105) @ Hornets(108),"January 29, 2021",2021-01-31T19:22:51Z,105,Pacers,108,Hornets
Q4,00:24.2,Foul: Offensive,Gordon Hayward,Malcolm Brogdon,CNC,Hayward (CHA) establishes himself in a screening position in Brogdon's (IND) path and does not deliver the contact.,42.8571434% Complete    00:41.6       To       00:20.4,gameId=0022000288,Pacers(105) @ Hornets(108),"January 29, 2021",2021-01-31T19:22:51Z,105,Pacers,108,Hornets
Q4,00:21.4,Foul: Personal,Jeremy Lamb,Gordon Hayward,CNC,Lamb (IND) jumps alongside Hayward's (CHA) path and brushes his backside as marginal contact occurs at the end of the drive.,42.8571434% Complete    00:41.6       To       00:20.4,gameId=0022000288,Pacers(105) @ Hornets(108),"January 29, 2021",2021-01-31T19:22:51Z,105,Pacers,108,Hornets
Q4,00:21.3,Foul: Personal,Myles Turner,Gordon Hayward,CNC,"Turner (IND) is jumping slightly toward Hayward (CHA) with his hand extended when marginal contact occurs, and collapses his arm upon impact while absorbing the additional body contact.",42.8571434% Complete    00:41.6       To       00:20.4,gameId=0022000288,Pacers(105) @ Hornets(108),"January 29, 2021",2021-01-31T19:22:51Z,105,Pacers,108,Hornets
Q4,00:20.1,Turnover:  Out of Bounds - Bad Pass Turn,Gordon Hayward,Domantas Sabonis,CC,"After communicating with the Replay Center, it was determined Hayward (CHA) touched the ball last before it went out of bounds.",42.8571434% Complete    00:41.6       To       00:20.4,gameId=0022000288,Pacers(105) @ Hornets(108),"January 29, 2021",2021-01-31T19:22:51Z,105,Pacers,108,Hornets
Q4,00:15.1,Foul: Offensive,Myles Turner,Gordon Hayward,CNC,Turner (IND) establishes himself in a screening position in Hayward's (CHA) path and does not deliver the contact.,36.7346954% Complete    00:20.4       To       00:02.0,gameId=0022000288,Pacers(105) @ Hornets(108),"January 29, 2021",2021-01-31T19:22:51Z,105,Pacers,108,Hornets
Q4,00:12.8,Foul: Personal,Gordon Hayward,Domantas Sabonis,CNC,Hayward (CHA) reflexively places his arm to Sabonis' (IND) front before sliding it off.,36.7346954% Complete    00:20.4       To       00:02.0,gameId=0022000288,Pacers(105) @ Hornets(108),"January 29, 2021",2021-01-31T19:22:51Z,105,Pacers,108,Hornets
Q4,00:12.8,Foul: Offensive,Domantas Sabonis,Gordon Hayward,CNC,Sabonis (IND) firms up in his screening position in Hayward's (CHA) path and absorbs the contact.,36.7346954% Complete    00:20.4       To       00:02.0,gameId=0022000288,Pacers(105) @ Hornets(108),"January 29, 2021",2021-01-31T19:22:51Z,105,Pacers,108,Hornets
Q4,00:08.6,Foul: Personal,Cody Zeller,Justin Holiday,CC,Zeller (CHA) delivers body contact to Holiday (IND) that dislodges him from position.,36.7346954% Complete    00:20.4       To       00:02.0,gameId=0022000288,Pacers(105) @ Hornets(108),"January 29, 2021",2021-01-31T19:22:51Z,105,Pacers,108,Hornets
Q4,00:08.6,Foul: Offensive,Myles Turner,P.J. Washington,CNC,Turner (IND) and Washington (CHA) engage and disengage with one another during the inbound.,36.7346954% Complete    00:20.4       To       00:02.0,gameId=0022000288,Pacers(105) @ Hornets(108),"January 29, 2021",2021-01-31T19:22:51Z,105,Pacers,108,Hornets
Q4,00:06.8,Foul: Shooting,Terry Rozier,Malcolm Brogdon,CNC,Rozier (CHA) is jumping away from Brogdon (IND) and would avoid Brogdon's right foot if Brogdon didn't extend it forward to initiate the marginal contact.,36.7346954% Complete    00:20.4       To       00:02.0,gameId=0022000288,Pacers(105) @ Hornets(108),"January 29, 2021",2021-01-31T19:22:51Z,105,Pacers,108,Hornets
Q4,00:04.3,Foul: Loose Ball,Cody Zeller,Myles Turner,INC,Zeller (CHA) grabs and holds Turner's (IND) left arm and affects his ability to get to the rebound.,36.7346954% Complete    00:20.4       To       00:02.0,gameId=0022000288,Pacers(105) @ Hornets(108),"January 29, 2021",2021-01-31T19:22:51Z,105,Pacers,108,Hornets
Q4,00:04.1,Foul: Loose Ball,Cody Zeller,Domantas Sabonis,CNC,Zeller (CHA) makes clean contact with the ball and dislodges it from Sabonis (IND) before incidental contact occurs.,36.7346954% Complete    00:20.4       To       00:02.0,gameId=0022000288,Pacers(105) @ Hornets(108),"January 29, 2021",2021-01-31T19:22:51Z,105,Pacers,108,Hornets
Q4,00:03.0,Foul: Loose Ball,Terry Rozier,Domantas Sabonis,CNC,"Rozier (CHA) and Sabonis (IND) make incidental contact with one another going for the loose ball. After communicating with the Replay Center, the ruling on the floor of CHA ball is confirmed.",36.7346954% Complete    00:20.4       To       00:02.0,gameId=0022000288,Pacers(105) @ Hornets(108),"January 29, 2021",2021-01-31T19:22:51Z,105,Pacers,108,Hornets
Q4,00:02.1,Foul: Offensive,Gordon Hayward,Malcolm Brogdon,CNC,Hayward (CHA) and Brogdon (IND) engage and disengage with one another during the inbound.,4.08163261% Complete    00:02.0       To       00:00.0,gameId=0022000288,Pacers(105) @ Hornets(108),"January 29, 2021",2021-01-31T19:22:51Z,105,Pacers,108,Hornets
Q4,00:00.9,Foul: Personal,Malcolm Brogdon,Gordon Hayward,CC,Brogdon (IND) commits the take foul on Hayward (CHA).,4.08163261% Complete    00:02.0       To       00:00.0,gameId=0022000288,Pacers(105) @ Hornets(108),"January 29, 2021",2021-01-31T19:22:51Z,105,Pacers,108,Hornets
Q4,01:43.3,Foul: Personal,Pascal Siakam,Hassan Whiteside,CC,Siakam (TOR) makes contact to Whiteside's (SAC) body that dislodges him from his legally obtained position.,36.7346954% Complete    01:50.3       To       01:32.0,gameId=0022000292,Kings(126) @ Raptors(124),"January 29, 2021",2021-01-31T19:23:13Z,126,Kings,124,Raptors
Q4,01:34.0,Foul: Defense 3 Second,Pascal Siakam,Kings,CNC,Siakam (TOR) is in the paint for less than three seconds when he is imminently actively guarding an opponent.,36.7346954% Complete    01:50.3       To       01:32.0,gameId=0022000292,Kings(126) @ Raptors(124),"January 29, 2021",2021-01-31T19:23:13Z,126,Kings,124,Raptors
Q4,01:32.1,Foul: Shooting,Yuta Watanabe,Hassan Whiteside,CC,Watanabe (TOR) makes contact with Whiteside's (SAC) arm during his shooting motion that affects his shot near the rim. The play was reviewed for a Flagrant Foul and it was deemed that there was no unnecessary contact.,36.7346954% Complete    01:50.3       To       01:32.0,gameId=0022000292,Kings(126) @ Raptors(124),"January 29, 2021",2021-01-31T19:23:13Z,126,Kings,124,Raptors
Q4,01:32.0,Foul: Loose Ball,De'Aaron Fox,DeAndre' Bembry,CNC,Bembry (TOR) makes incidental foot to foot contact with Fox (SAC) as he back pedals and the contact causes him to lose his balance.,36.7346954% Complete    01:50.3       To       01:32.0,gameId=0022000292,Kings(126) @ Raptors(124),"January 29, 2021",2021-01-31T19:23:13Z,126,Kings,124,Raptors
Q4,01:32.0,Foul: Loose Ball,Pascal Siakam,Harrison Barnes,CNC,"During the rebound, Siakam (TOR) and Barnes (SAC) engage and disengage and the contact is marginal.",36.7346954% Complete    01:50.3       To       01:32.0,gameId=0022000292,Kings(126) @ Raptors(124),"January 29, 2021",2021-01-31T19:23:13Z,126,Kings,124,Raptors
Q4,01:09.5,Foul: Shooting,Hassan Whiteside,Yuta Watanabe,CNC,Whiteside (SAC) legally contests Watanabe's (TOR) shot and marginal contact occurs after the release that does not affect his ability to follow-through naturally during the driving shot attempt.,46.9387741% Complete    01:32.0       To       01:08.7,gameId=0022000292,Kings(126) @ Raptors(124),"January 29, 2021",2021-01-31T19:23:13Z,126,Kings,124,Raptors
Q4,00:53.8,Foul: Offensive,Harrison Barnes,Yuta Watanabe,CNC,Watanabe (TOR) maintains a legal guarding position on Barnes' (SAC) drive and after the pass he makes incidental foot to foot contact with his teammate Siakam (TOR).,48.97959% Complete    01:08.7       To       00:44.5,gameId=0022000292,Kings(126) @ Raptors(124),"January 29, 2021",2021-01-31T19:23:13Z,126,Kings,124,Raptors
Q4,00:49.8,Foul: Shooting,Yuta Watanabe,Hassan Whiteside,CNC,Watanabe (TOR) maintains a legal guarding position during the driving shot attempt by Whiteside (SAC) and makes clean ball contact on his dislodge attempt.,48.97959% Complete    01:08.7       To       00:44.5,gameId=0022000292,Kings(126) @ Raptors(124),"January 29, 2021",2021-01-31T19:23:13Z,126,Kings,124,Raptors
Q4,00:49.0,Foul: Loose Ball,Fred VanVleet,Hassan Whiteside,CNC,"During the rebound, VanVleet (TOR) makes clean ball contact as he tries to dislodge it from Whiteside (SAC).",48.97959% Complete    01:08.7       To       00:44.5,gameId=0022000292,Kings(126) @ Raptors(124),"January 29, 2021",2021-01-31T19:23:13Z,126,Kings,124,Raptors
Q4,00:37.9,Foul: Loose Ball,De'Aaron Fox,Pascal Siakam,CC,Fox (SAC) extends his arms and delivers contact that dislodges Siakam (TOR) from his position during the rebound.,12.2448978% Complete    00:44.5       To       00:37.9,gameId=0022000292,Kings(126) @ Raptors(124),"January 29, 2021",2021-01-31T19:23:13Z,126,Kings,124,Raptors
Q4,00:37.9,Turnover: Traveling,De'Aaron Fox,Raptors,CNC,Fox (SAC) fumbles the ball as he receives the pass and then legally starts his dribble.,38.77551% Complete    00:37.9       To       00:18.2,gameId=0022000292,Kings(126) @ Raptors(124),"January 29, 2021",2021-01-31T19:23:13Z,126,Kings,124,Raptors
Q4,00:22,Foul: Personal,DeAndre' Bembry,De'Aaron Fox,CNC,"At the end of the drive, Bembry (TOR) maintains a legal guarding position on Fox (SAC) and makes clean ball contact to temporarily dislodge it.",38.77551% Complete    00:37.9       To       00:18.2,gameId=0022000292,Kings(126) @ Raptors(124),"January 29, 2021",2021-01-31T19:23:13Z,126,Kings,124,Raptors
Q4,00:18.3,Foul: Shooting,DeAndre' Bembry,De'Aaron Fox,CC,Bembry (TOR) makes contact with Fox's (SAC) arm during his shooting motion that affects his shot near the rim.,38.77551% Complete    00:37.9       To       00:18.2,gameId=0022000292,Kings(126) @ Raptors(124),"January 29, 2021",2021-01-31T19:23:13Z,126,Kings,124,Raptors
Q4,00:13,Foul: Offensive,Pascal Siakam,Harrison Barnes,CNC,"During the drive, Siakam (TOR) has an arm extended and marginal contact occurs with Barnes (SAC) when he disengages.",16.32653% Complete    00:18.2       To       00:09.3,gameId=0022000292,Kings(126) @ Raptors(124),"January 29, 2021",2021-01-31T19:23:13Z,126,Kings,124,Raptors
Q4,00:12.9,Foul: Personal,Cory Joseph,Kyle Lowry,CNC,"During the screen, Joseph (SAC) and Lowry (TOR) engage and disengage and the contact is marginal.",16.32653% Complete    00:18.2       To       00:09.3,gameId=0022000292,Kings(126) @ Raptors(124),"January 29, 2021",2021-01-31T19:23:13Z,126,Kings,124,Raptors
Q4,00:08.5,Foul: Personal,Yuta Watanabe,Harrison Barnes,CC,Watanabe (TOR) commits a take foul on Barnes (SAC).,2.04081631% Complete    00:09.3       To       00:07.5,gameId=0022000292,Kings(126) @ Raptors(124),"January 29, 2021",2021-01-31T19:23:13Z,126,Kings,124,Raptors
Q4,00:07.6,Foul: Personal,Harrison Barnes,Pascal Siakam,CNC,Barnes (SAC) and Siakam (TOR) engage and disengage off ball in the post and Barnes' hand gets caught in his jersey.  The contact does not affect his FOM or ability to maintain his post position.,4.08163261% Complete    00:07.5       To       00:05.0,gameId=0022000292,Kings(126) @ Raptors(124),"January 29, 2021",2021-01-31T19:23:13Z,126,Kings,124,Raptors
Q4,00:04.0,Foul: Technical,Kyle Lowry,Kings,CC,All Technical Fouls are reviewed by League Operations.,2.04081631% Complete    00:05.0       To       00:04.0,gameId=0022000292,Kings(126) @ Raptors(124),"January 29, 2021",2021-01-31T19:23:13Z,126,Kings,124,Raptors
Q4,00:04.0,Foul: Personal,DeAndre' Bembry,De'Aaron Fox,CC,Bembry (TOR) commits a take foul on Fox (SAC).,2.04081631% Complete    00:05.0       To       00:04.0,gameId=0022000292,Kings(126) @ Raptors(124),"January 29, 2021",2021-01-31T19:23:13Z,126,Kings,124,Raptors
Q4,01:50.4,Foul: Offensive,Damian Lillard,Garrett Temple,CNC,Lillard (POR) and Temple (CHI) briefly engage and disengage off ball.,34.69388% Complete    02:00.0       To       01:42.2,gameId=0022000298,Trail Blazers(123) @ Bulls(122),"January 30, 2021",2021-02-01T00:40:25Z,123,Trail Blazers,122,Bulls
Q4,01:48,Foul: Offensive,Enes Kanter,Garrett Temple,CNC,Kanter (POR) is already in Temple's (CHI) path when contact occurs and he does not deliver contact.,34.69388% Complete    02:00.0       To       01:42.2,gameId=0022000298,Trail Blazers(123) @ Bulls(122),"January 30, 2021",2021-02-01T00:40:25Z,123,Trail Blazers,122,Bulls
Q4,01:48,Foul: Personal,Garrett Temple,Enes Kanter,CNC,Temple (CHI) places his hand momentarily on Kanter's (POR) hip before correcting.,34.69388% Complete    02:00.0       To       01:42.2,gameId=0022000298,Trail Blazers(123) @ Bulls(122),"January 30, 2021",2021-02-01T00:40:25Z,123,Trail Blazers,122,Bulls
Q4,01:43.7,Foul: Loose Ball,Coby White,Enes Kanter,CNC,White (CHI) and Kanter (POR) make incidental contact with one another during rebounding.,34.69388% Complete    02:00.0       To       01:42.2,gameId=0022000298,Trail Blazers(123) @ Bulls(122),"January 30, 2021",2021-02-01T00:40:25Z,123,Trail Blazers,122,Bulls
Q4,01:42.2,Foul: Shooting,Lauri Markkanen,Enes Kanter,CNC,Markkanen (CHI) legally contests Kanter's (POR) shot near the rim.,34.69388% Complete    02:00.0       To       01:42.2,gameId=0022000298,Trail Blazers(123) @ Bulls(122),"January 30, 2021",2021-02-01T00:40:25Z,123,Trail Blazers,122,Bulls
Q4,01:42.2,Violation: Defensive Goaltending,Lauri Markkanen,Trail Blazers,INC,Markkanen (CHI) makes contact with the ball after the ball has made contact with the backboard.,34.69388% Complete    02:00.0       To       01:42.2,gameId=0022000298,Trail Blazers(123) @ Bulls(122),"January 30, 2021",2021-02-01T00:40:25Z,123,Trail Blazers,122,Bulls
Q4,01:35.7,Foul: Offensive,Thaddeus Young,Robert Covington,CNC,Young (CHI) is already in Covington's (POR) path when contact occurs and he does not deliver contact.,18.3673477% Complete    01:42.2       To       01:32.8,gameId=0022000298,Trail Blazers(123) @ Bulls(122),"January 30, 2021",2021-02-01T00:40:25Z,123,Trail Blazers,122,Bulls
Q4,01:26.1,Foul: Offensive,Enes Kanter,Garrett Temple,CNC,Kanter (POR) is already in Temple's (CHI) path when contact occurs and he does not deliver contact.,16.32653% Complete    01:32.8       To       01:24.0,gameId=0022000298,Trail Blazers(123) @ Bulls(122),"January 30, 2021",2021-02-01T00:40:25Z,123,Trail Blazers,122,Bulls
Q4,01:24,Foul: Personal,Thaddeus Young,Damian Lillard,CNC,Young (CHI) moves slightly into LIllard's (POR) body during his drive and contact is marginal.,16.32653% Complete    01:32.8       To       01:24.0,gameId=0022000298,Trail Blazers(123) @ Bulls(122),"January 30, 2021",2021-02-01T00:40:25Z,123,Trail Blazers,122,Bulls
Q4,01:11,Foul: Personal,Enes Kanter,Thaddeus Young,CNC,Kanter (POR) and Young (CHI) engage and then immediately disengage off ball.,51.02041% Complete    01:24.0       To       00:58.8,gameId=0022000298,Trail Blazers(123) @ Bulls(122),"January 30, 2021",2021-02-01T00:40:25Z,123,Trail Blazers,122,Bulls
Q4,00:59.6,Foul: Shooting,Enes Kanter,Zach LaVine,CNC,Kanter (POR) legally contests LaVine's (CHI) driving shot attempt.,51.02041% Complete    01:24.0       To       00:58.8,gameId=0022000298,Trail Blazers(123) @ Bulls(122),"January 30, 2021",2021-02-01T00:40:25Z,123,Trail Blazers,122,Bulls
Q4,00:54.7,Foul: Personal,Lauri Markkanen,Damian Lillard,CNC,Markkanen (CHI) is moving alongside Lillard's (POR) path and maintains a legal guarding position as he defends the drive.,16.32653% Complete    00:58.8       To       00:50.8,gameId=0022000298,Trail Blazers(123) @ Bulls(122),"January 30, 2021",2021-02-01T00:40:25Z,123,Trail Blazers,122,Bulls
Q4,00:53.0,Foul: Shooting,Zach LaVine,Damian Lillard,CNC,LaVine (CHI) legally contests Lillard's (POR) driving shot attempt.,16.32653% Complete    00:58.8       To       00:50.8,gameId=0022000298,Trail Blazers(123) @ Bulls(122),"January 30, 2021",2021-02-01T00:40:25Z,123,Trail Blazers,122,Bulls
Q4,00:16.9,Foul: Personal,Rodney Hood,Thaddeus Young,CC,Hood (POR) commits a take foul on Young (CHI).,12.2448978% Complete    00:18.2       To       00:11.5,gameId=0022000298,Trail Blazers(123) @ Bulls(122),"January 30, 2021",2021-02-01T00:40:25Z,123,Trail Blazers,122,Bulls
Q4,00:15.5,Foul: Personal,Gary Trent Jr.,Coby White,CNC,Trent Jr. (POR) and White (CHI) make incidental contact with one another on the perimeter.,12.2448978% Complete    00:18.2       To       00:11.5,gameId=0022000298,Trail Blazers(123) @ Bulls(122),"January 30, 2021",2021-02-01T00:40:25Z,123,Trail Blazers,122,Bulls
Q4,00:11.5,Foul: Personal,Rodney Hood,Coby White,CC,Hood (POR) commits a take foul on White (CHI).,12.2448978% Complete    00:18.2       To       00:11.5,gameId=0022000298,Trail Blazers(123) @ Bulls(122),"January 30, 2021",2021-02-01T00:40:25Z,123,Trail Blazers,122,Bulls
Q4,00:09.9,Foul: Shooting,Coby White,Damian Lillard,CNC,White (CHI) legally contests Lillard's (POR) jump shot attempt.,6.122449% Complete    00:11.5       To       00:08.2,gameId=0022000298,Trail Blazers(123) @ Bulls(122),"January 30, 2021",2021-02-01T00:40:25Z,123,Trail Blazers,122,Bulls
Q4,00:06.9,Foul: Personal,Gary Trent Jr.,Zach LaVine,CNC,"Trent Jr. (POR) cleanly ties up LaVine (CHI), and a jump ball is correctly called.",4.08163261% Complete    00:08.2       To       00:05.6,gameId=0022000298,Trail Blazers(123) @ Bulls(122),"January 30, 2021",2021-02-01T00:40:25Z,123,Trail Blazers,122,Bulls
Q4,00:04.3,Foul: Personal,Garrett Temple,Robert Covington,CNC,Temple (CHI) cleanly dislodges the ball from Covington (POR).,10.2040815% Complete    00:05.6       To       00:00.0,gameId=0022000298,Trail Blazers(123) @ Bulls(122),"January 30, 2021",2021-02-01T00:40:25Z,123,Trail Blazers,122,Bulls
