period,time,call_type,committing,disadvantaged,decision,comments,stint,game_id,game_details,game_date,scrape_time,away_score,away_team,home_score,home_team
Q4,01:10.0,Foul: Personal,Bogdan Bogdanovic,Dante Exum,CNC,Bogdanovic (ATL) and Exum (CLE) engage and disengage with one another off-ball.,38.77551% Complete    01:23.3       To       01:03.8,gameId=0022000083,Cavaliers(96) @ Hawks(91),"January 02, 2021",2021-01-04T17:09:56Z,96,Cavaliers,91,Hawks
Q4,01:03.8,Turnover: 3 Second Violation,Andre Drummond,De'Andre Hunter,CC,Drummond (CLE) is in the lane for longer than three seconds.,38.77551% Complete    01:23.3       To       01:03.8,gameId=0022000083,Cavaliers(96) @ Hawks(91),"January 02, 2021",2021-01-04T17:09:56Z,96,Cavaliers,91,Hawks
Q4,00:56.0,Foul: Personal,Collin Sexton,De'Andre Hunter,CNC,Sexton (CLE) and Hunter (ATL) engage and disengage with one another off-ball.,30.6122456% Complete    01:03.8       To       00:48.4,gameId=0022000083,Cavaliers(96) @ Hawks(91),"January 02, 2021",2021-01-04T17:09:56Z,96,Cavaliers,91,Hawks
Q4,00:34.7,Foul: Personal,John Collins,Andre Drummond,CNC,Collins (ATL) is jumping slightly toward Drummond (CLE) when marginal body contact occurs as Drummond is passing the ball while airborne.,42.8571434% Complete    00:48.4       To       00:27.2,gameId=0022000083,Cavaliers(96) @ Hawks(91),"January 02, 2021",2021-01-04T17:09:56Z,96,Cavaliers,91,Hawks
Q4,00:27.2,Foul: Offensive,John Collins,Dante Exum,CNC,"Collins (ATL) re-establishes slightly in Exum's (CLE) path after initial contact takes place during the screen, and the contact is marginal.",8.163265% Complete    00:27.2       To       00:22.3,gameId=0022000083,Cavaliers(96) @ Hawks(91),"January 02, 2021",2021-01-04T17:09:56Z,96,Cavaliers,91,Hawks
Q4,00:27.2,Foul: Personal,Dante Exum,Trae Young,CNC,Exum (CLE) rests his hand on Young's (ATL) side and marginal contact occurs as Young drives into the lane.,8.163265% Complete    00:27.2       To       00:22.3,gameId=0022000083,Cavaliers(96) @ Hawks(91),"January 02, 2021",2021-01-04T17:09:56Z,96,Cavaliers,91,Hawks
Q4,00:27.2,Foul: Away from Play,Collin Sexton,Cam Reddish,CNC,Sexton (CLE) and Reddish (ATL) engage and disengage with one another during the inbound.,8.163265% Complete    00:27.2       To       00:22.3,gameId=0022000083,Cavaliers(96) @ Hawks(91),"January 02, 2021",2021-01-04T17:09:56Z,96,Cavaliers,91,Hawks
Q4,00:27.2,Foul: Personal,Dante Exum,Trae Young,CNC,Exum (CLE) brushes Young's (ATL) backside as he receives the pass and marginal body contact occurs.,8.163265% Complete    00:27.2       To       00:22.3,gameId=0022000083,Cavaliers(96) @ Hawks(91),"January 02, 2021",2021-01-04T17:09:56Z,96,Cavaliers,91,Hawks
Q4,00:23.6,Foul: Shooting,Dante Exum,John Collins,CNC,Exum (CLE) legally contests Collins' (ATL) dunk attempt.,8.163265% Complete    00:27.2       To       00:22.3,gameId=0022000083,Cavaliers(96) @ Hawks(91),"January 02, 2021",2021-01-04T17:09:56Z,96,Cavaliers,91,Hawks
Q4,00:21.5,Foul: Personal,Trae Young,Andre Drummond,CC,Young (ATL) commits the take foul on Drummond (CLE).,8.163265% Complete    00:22.3       To       00:18.3,gameId=0022000083,Cavaliers(96) @ Hawks(91),"January 02, 2021",2021-01-04T17:09:56Z,96,Cavaliers,91,Hawks
Q4,00:18.3,Foul: Personal,De'Andre Hunter,Darius Garland,CC,Hunter (ATL) commits the take foul on Garland (CLE).,8.163265% Complete    00:22.3       To       00:18.3,gameId=0022000083,Cavaliers(96) @ Hawks(91),"January 02, 2021",2021-01-04T17:09:56Z,96,Cavaliers,91,Hawks
Q4,00:10.0,Foul: Loose Ball,John Collins,Andre Drummond,CNC,Collins (ATL) makes incidental contact with Drummond's (CLE) backside as they each attempt to fight for the rebound.,16.32653% Complete    00:18.3       To       00:10.0,gameId=0022000083,Cavaliers(96) @ Hawks(91),"January 02, 2021",2021-01-04T17:09:56Z,96,Cavaliers,91,Hawks
Q4,00:08.0,Foul: Personal,Cam Reddish,Collin Sexton,CC,Reddish (ATL) commits the take foul on Sexton (CLE).,4.08163261% Complete    00:10.0       To       00:08.0,gameId=0022000083,Cavaliers(96) @ Hawks(91),"January 02, 2021",2021-01-04T17:09:56Z,96,Cavaliers,91,Hawks
Q4,00:02.8,Foul: Personal,Trae Young,Collin Sexton,CC,Young (ATL) commits the take foul on Sexton (CLE).,4.08163261% Complete    00:04.8       To       00:02.7,gameId=0022000083,Cavaliers(96) @ Hawks(91),"January 02, 2021",2021-01-04T17:09:56Z,96,Cavaliers,91,Hawks
Q4,01:57.1,Foul: Offensive,OG Anunoby,Eric Bledsoe,CNC,Anunoaby (TOR) is already in Bledsoe's (TOR) path and releases away from the contact.,24.4897957% Complete    02:04.5       To       01:52.5,gameId=0022000084,Raptors(116) @ Pelicans(120),"January 02, 2021",2021-01-04T17:10:19Z,116,Raptors,120,Pelicans
Q4,01:54,Foul: Offensive,Fred VanVleet,Eric Bledsoe,CNC,VanVleet (TOR) is bracing for the contact from Bledsoe (NOP) and he releases away from the contact.,24.4897957% Complete    02:04.5       To       01:52.5,gameId=0022000084,Raptors(116) @ Pelicans(120),"January 02, 2021",2021-01-04T17:10:19Z,116,Raptors,120,Pelicans
Q4,01:48.3,Foul: Shooting,Kyle Lowry,Eric Bledsoe,INC,"Lowry (TOR) does not maintain verticality as he turns his body and makes contact with Bledsoe's (NOP) lower body, which affects the driving shot attempt.",10.2040815% Complete    01:52.5       To       01:46.8,gameId=0022000084,Raptors(116) @ Pelicans(120),"January 02, 2021",2021-01-04T17:10:19Z,116,Raptors,120,Pelicans
Q4,01:47.6,Foul: Loose Ball,Lonzo Ball,Norman Powell,CNC,Ball (NOP) and Powell (TOR) make incidental contact with one another during rebounding.,10.2040815% Complete    01:52.5       To       01:46.8,gameId=0022000084,Raptors(116) @ Pelicans(120),"January 02, 2021",2021-01-04T17:10:19Z,116,Raptors,120,Pelicans
Q4,01:46.8,Turnover:  Out of Bounds - Bad Pass Turn,Steven Adams,OG Anunoby,CC,Possession is correctly awarded to Toronto.,10.2040815% Complete    01:52.5       To       01:46.8,gameId=0022000084,Raptors(116) @ Pelicans(120),"January 02, 2021",2021-01-04T17:10:19Z,116,Raptors,120,Pelicans
Q4,01:38,Foul: Offensive,Stan Van Gundy,Eric Bledsoe,CNC,VanVleet (TOR) and Bledsoe (NOP) briefly engage and disengage off ball.,48.97959% Complete    01:46.8       To       01:22.1,gameId=0022000084,Raptors(116) @ Pelicans(120),"January 02, 2021",2021-01-04T17:10:19Z,116,Raptors,120,Pelicans
Q4,01:33.8,Foul: Offensive,OG Anunoby,Eric Bledsoe,CNC,Anunoby (TOR) is already in Bledsoe's (NOP) path when contact occurs and he does not deliver contact.,48.97959% Complete    01:46.8       To       01:22.1,gameId=0022000084,Raptors(116) @ Pelicans(120),"January 02, 2021",2021-01-04T17:10:19Z,116,Raptors,120,Pelicans
Q4,01:33.8,Foul: Personal,Eric Bledsoe,Fred VanVleet,CNC,Bledsoe (NOP) places his hand momentarily on VanVleet's (TOR) hip before correcting.,48.97959% Complete    01:46.8       To       01:22.1,gameId=0022000084,Raptors(116) @ Pelicans(120),"January 02, 2021",2021-01-04T17:10:19Z,116,Raptors,120,Pelicans
Q4,01:31,Foul: Personal,Eric Bledsoe,Chris Boucher,CNC,Bledsoe (NOP) makes hand-on-ball contact to briefly dislodge the ball from Boucher (TOR) on the perimeter.,48.97959% Complete    01:46.8       To       01:22.1,gameId=0022000084,Raptors(116) @ Pelicans(120),"January 02, 2021",2021-01-04T17:10:19Z,116,Raptors,120,Pelicans
Q4,01:24.5,Foul: Shooting,Brandon Ingram,Norman Powell,CNC,Ingram (NOP) is moving alongside Powell's (TOR) path and cleanly blocks his shot attempt.,48.97959% Complete    01:46.8       To       01:22.1,gameId=0022000084,Raptors(116) @ Pelicans(120),"January 02, 2021",2021-01-04T17:10:19Z,116,Raptors,120,Pelicans
Q4,01:22.1,Turnover: 24 Second Violation,Raptors,Pelicans,CC,Correctly called 24 second violation.,48.97959% Complete    01:46.8       To       01:22.1,gameId=0022000084,Raptors(116) @ Pelicans(120),"January 02, 2021",2021-01-04T17:10:19Z,116,Raptors,120,Pelicans
Q4,01:16.5,Foul: Personal,Fred VanVleet,Brandon Ingram,CNC,VanVleet (TOR) is moving alongside Ingram's (NOP) path and makes incidental contact with Ingram as the two fight over the screen.,28.5714283% Complete    01:22.1       To       01:08.0,gameId=0022000084,Raptors(116) @ Pelicans(120),"January 02, 2021",2021-01-04T17:10:19Z,116,Raptors,120,Pelicans
Q4,01:08.0,Foul: Shooting,Chris Boucher,Brandon Ingram,CC,"Boucher (TOR) brings his arm down and makes contact with Ingram's (NOP) arm, which affects his driving shot attempt.",28.5714283% Complete    01:22.1       To       01:08.0,gameId=0022000084,Raptors(116) @ Pelicans(120),"January 02, 2021",2021-01-04T17:10:19Z,116,Raptors,120,Pelicans
Q4,01:05.3,Foul: Offensive,OG Anunoby,Lonzo Ball,CNC,Anunoby (TOR) is already in Ball's (NOP) path and is firming up when contact occurs.,12.2448978% Complete    01:08.0       To       01:01.5,gameId=0022000084,Raptors(116) @ Pelicans(120),"January 02, 2021",2021-01-04T17:10:19Z,116,Raptors,120,Pelicans
Q4,01:03.8,Foul: Personal,Eric Bledsoe,OG Anunoby,CNC,Bledsoe (NOP) and Anunoby (TOR) make incidental contact with one another off ball.,12.2448978% Complete    01:08.0       To       01:01.5,gameId=0022000084,Raptors(116) @ Pelicans(120),"January 02, 2021",2021-01-04T17:10:19Z,116,Raptors,120,Pelicans
Q4,01:01.5,Turnover:  Out of Bounds - Bad Pass Turn,OG Anunoby,Eric Bledsoe,CC,Possession is correctly awarded to New Orleans.,12.2448978% Complete    01:08.0       To       01:01.5,gameId=0022000084,Raptors(116) @ Pelicans(120),"January 02, 2021",2021-01-04T17:10:19Z,116,Raptors,120,Pelicans
Q4,00:53.7,Foul: Offensive,Steven Adams,Fred VanVleet,INC,Adams (NOP) extends into VanVleet's (TOR) path and delivers leg contact during the pick.,40.8163261% Complete    01:01.5       To       00:41.5,gameId=0022000084,Raptors(116) @ Pelicans(120),"January 02, 2021",2021-01-04T17:10:19Z,116,Raptors,120,Pelicans
Q4,00:34.5,Foul: Shooting,Lonzo Ball,OG Anunoby,CC,Ball (NOP) does not establish a legal guarding position outside the RA prior to contact with Anunoby (TOR).,14.2857141% Complete    00:41.5       To       00:33.7,gameId=0022000084,Raptors(116) @ Pelicans(120),"January 02, 2021",2021-01-04T17:10:19Z,116,Raptors,120,Pelicans
Q4,00:33.7,Foul: Loose Ball,Josh Hart,Norman Powell,CNC,Hart (NOP) and Powell (TOR) make incidental contact with one another during rebounding.,14.2857141% Complete    00:41.5       To       00:33.7,gameId=0022000084,Raptors(116) @ Pelicans(120),"January 02, 2021",2021-01-04T17:10:19Z,116,Raptors,120,Pelicans
Q4,00:12.4,Foul: Shooting,Norman Powell,Brandon Ingram,CC,Powell (TOR) makes contact with Ingram's (NOP) arm that causes Ingram to lose control of the ball after his gather.,42.8571434% Complete    00:33.7       To       00:12.3,gameId=0022000084,Raptors(116) @ Pelicans(120),"January 02, 2021",2021-01-04T17:10:19Z,116,Raptors,120,Pelicans
Q4,00:10.5,Foul: Offensive,Chris Boucher,Eric Bledsoe,CNC,Boucher (TOR) is already in Bledsoe's (NOP) path when contact occurs and he does not deliver contact.,10.2040815% Complete    00:12.3       To       00:06.5,gameId=0022000084,Raptors(116) @ Pelicans(120),"January 02, 2021",2021-01-04T17:10:19Z,116,Raptors,120,Pelicans
Q4,00:09.5,Foul: Personal,Steven Adams,Fred VanVleet,CNC,Adams (NOP) is moving alongside VanVleet's (TOR) path as he defends the drive to the basket.,10.2040815% Complete    00:12.3       To       00:06.5,gameId=0022000084,Raptors(116) @ Pelicans(120),"January 02, 2021",2021-01-04T17:10:19Z,116,Raptors,120,Pelicans
Q4,00:08.4,Foul: Shooting,Josh Hart,Fred VanVleet,CNC,Hart (NOP) legally contests VanVleet's (TOR) driving shot attempt.,10.2040815% Complete    00:12.3       To       00:06.5,gameId=0022000084,Raptors(116) @ Pelicans(120),"January 02, 2021",2021-01-04T17:10:19Z,116,Raptors,120,Pelicans
Q4,00:04.2,Foul: Personal,Norman Powell,Eric Bledsoe,CNC,Powell (TOR) makes marginal contact with Bledsoe (NOP) as he releases the pass.,8.163265% Complete    00:06.5       To       00:02.5,gameId=0022000084,Raptors(116) @ Pelicans(120),"January 02, 2021",2021-01-04T17:10:19Z,116,Raptors,120,Pelicans
Q4,00:02.6,Foul: Personal,OG Anunoby,Brandon Ingram,CC,Anunoby (TOR) commits a take foul on Ingram (NOP).,8.163265% Complete    00:06.5       To       00:02.5,gameId=0022000084,Raptors(116) @ Pelicans(120),"January 02, 2021",2021-01-04T17:10:19Z,116,Raptors,120,Pelicans
Q4,01:56.5,Foul: Shooting,Mason Plumlee,Daniel Theis,CC,Plumlee (DET) is drawn into the air by the pump fake from Theis (BOS) and on his way down he makes contact to Theis' (BOS) body during his shooting motion.,59.1836739% Complete    02:15.3       To       01:46.2,gameId=0022000085,Celtics(122) @ Pistons(120),"January 03, 2021",2021-01-04T18:57:31Z,122,Celtics,120,Pistons
Q4,01:54,Foul: Personal,Svi Mykhailiuk,Jaylen Brown,CNC,"Mykhailiuk (DET) makes marginal contact to Brown's (BOS) body at the start of the drive, before he cleanly dislodges the ball out of bounds.",59.1836739% Complete    02:15.3       To       01:46.2,gameId=0022000085,Celtics(122) @ Pistons(120),"January 03, 2021",2021-01-04T18:57:31Z,122,Celtics,120,Pistons
Q4,01:46.1,Foul: Personal,Marcus Smart,Derrick Rose,CNC,Smart (BOS) briefly places his forearm to the front of Rose (DET) during the drive up the court. The contact is marginal.,22.44898% Complete    01:46.2       To       01:35.2,gameId=0022000085,Celtics(122) @ Pistons(120),"January 03, 2021",2021-01-04T18:57:31Z,122,Celtics,120,Pistons
Q4,01:38.8,Turnover: Traveling,Jerami Grant,Celtics,INC,Grant (DET) ends his dribble and hops consecutively on the same foot after his gather.,22.44898% Complete    01:46.2       To       01:35.2,gameId=0022000085,Celtics(122) @ Pistons(120),"January 03, 2021",2021-01-04T18:57:31Z,122,Celtics,120,Pistons
Q4,01:27.8,Foul: Offensive,Tristan Thompson,Svi Mykhailiuk,CC,"Thompson (BOS) does not establish himself in the path of Mykhailiuk (DET) while setting the screen, and delivers contact to his back while he is trying to defend around the screen.",14.2857141% Complete    01:35.2       To       01:27.7,gameId=0022000085,Celtics(122) @ Pistons(120),"January 03, 2021",2021-01-04T18:57:31Z,122,Celtics,120,Pistons
Q4,01:16.9,Foul: Shooting,Tristan Thompson,Blake Griffin,CC,Thompson (BOS) makes contact to Griffin's (DET) arm during his shooting motion that disrupts his layup attempt.,20.4081631% Complete    01:27.7       To       01:16.9,gameId=0022000085,Celtics(122) @ Pistons(120),"January 03, 2021",2021-01-04T18:57:31Z,122,Celtics,120,Pistons
Q4,01:06.7,Foul: Offensive,Jayson Tatum,Jerami Grant,CNC,Tatum (BOS) releases and does not extend his off arm elbow to wrist into Grant's body at the end of his drive to the basket.,30.6122456% Complete    01:16.9       To       01:01.8,gameId=0022000085,Celtics(122) @ Pistons(120),"January 03, 2021",2021-01-04T18:57:31Z,122,Celtics,120,Pistons
Q4,00:42.2,Foul: Shooting,Daniel Theis,Mason Plumlee,CC,"Theis (BOS) makes contact to Plumlee's (DET) arm as he gathers and enters his shooting motion, during the driving shot attempt.",38.77551% Complete    01:01.8       To       00:42.2,gameId=0022000085,Celtics(122) @ Pistons(120),"January 03, 2021",2021-01-04T18:57:31Z,122,Celtics,120,Pistons
Q4,00:29.5,Foul: Shooting,Jayson Tatum,Derrick Rose,CNC,Tatum (BOS) makes marginal contact to Rose's (DET) body as he gathers and enters  shooting motion. Rose is able to move through the contact and it does not disrupt his ability to attempt the layup.,24.4897957% Complete    00:34.0       To       00:22.0,gameId=0022000085,Celtics(122) @ Pistons(120),"January 03, 2021",2021-01-04T18:57:31Z,122,Celtics,120,Pistons
Q4,00:25.4,Foul: Personal,Semi Ojeleye,Blake Griffin,CNC,Oljeleye (BOS) goes to but not through the screen set by Griffin (DET). Griffin's reaction is not consistent with the level of contact.,24.4897957% Complete    00:34.0       To       00:22.0,gameId=0022000085,Celtics(122) @ Pistons(120),"January 03, 2021",2021-01-04T18:57:31Z,122,Celtics,120,Pistons
Q4,00:22.0,Foul: Personal,Semi Ojeleye,Jerami Grant,CC,Ojeleye (BOS) makes contact to Grant's (DET) body on the drive that disrupts his SQBR.,24.4897957% Complete    00:34.0       To       00:22.0,gameId=0022000085,Celtics(122) @ Pistons(120),"January 03, 2021",2021-01-04T18:57:31Z,122,Celtics,120,Pistons
Q4,00:01.5,Foul: Shooting,Jayson Tatum,Blake Griffin,CNC,Tatum (BOS) maintains a legal guarding position during the jump shot attempt by Griffin (DET) and cleanly dislodges the ball.,4.08163261% Complete    00:02.9       To       00:00.0,gameId=0022000085,Celtics(122) @ Pistons(120),"January 03, 2021",2021-01-04T18:57:31Z,122,Celtics,120,Pistons
Q4,01:56.4,Foul: Personal,Thomas Bryant,Kevin Durant,CC,Bryant (WAS) grabs Durant's (BKN) arm during his drive to the basket.,30.6122456% Complete    02:11.0       To       01:56.0,gameId=0022000086,Wizards(123) @ Nets(122),"January 03, 2021",2021-01-04T18:57:52Z,123,Wizards,122,Nets
Q4,01:39.5,Foul: Personal,Joe Harris,Rui Hachimura,CC,"Harris (BKN) clamps Hachimura's (WAS) arm while he is receiving the pass in the post, disrupting his ability to catch the ball cleanly.",34.69388% Complete    01:56.0       To       01:39.0,gameId=0022000086,Wizards(123) @ Nets(122),"January 03, 2021",2021-01-04T18:57:52Z,123,Wizards,122,Nets
Q4,01:31.0,Foul: Offensive,Jeff Green,Rui Hachimura,CNC,Green (BKN) firms up in a screening position in the path of Hachimura (WAS) and absorbs the contact.,36.7346954% Complete    01:39.0       To       01:21.0,gameId=0022000086,Wizards(123) @ Nets(122),"January 03, 2021",2021-01-04T18:57:52Z,123,Wizards,122,Nets
Q4,01:29.7,Foul: Personal,Rui Hachimura,Kevin Durant,CNC,Hachimura (WAS) briefly engages and then disengages in marginal arm contact with Durant (BKN) as he is receiving the pass.,36.7346954% Complete    01:39.0       To       01:21.0,gameId=0022000086,Wizards(123) @ Nets(122),"January 03, 2021",2021-01-04T18:57:52Z,123,Wizards,122,Nets
Q4,01:26.5,Foul: Offensive,Jeff Green,Rui Hachimura,CNC,Green (BKN) firms up in a screening position in the path of Hachimura (WAS) and absorbs the contact.,36.7346954% Complete    01:39.0       To       01:21.0,gameId=0022000086,Wizards(123) @ Nets(122),"January 03, 2021",2021-01-04T18:57:52Z,123,Wizards,122,Nets
Q4,01:21.0,Foul: Shooting,Bradley Beal,Kevin Durant,CC,Beal (WAS) does not get up to ball height and makes contact to Durant's (BKN) arm as he is in his shooting motion and releases the ball on his jump shot.,36.7346954% Complete    01:39.0       To       01:21.0,gameId=0022000086,Wizards(123) @ Nets(122),"January 03, 2021",2021-01-04T18:57:52Z,123,Wizards,122,Nets
Q4,01:12.5,Foul: Offensive,Thomas Bryant,Kyrie Irving,CNC,Bryant (WAS) establishes himself in a screening position in the path of Irving (BKN) firms up and absorbs the contact.,20.4081631% Complete    01:21.0       To       01:10.1,gameId=0022000086,Wizards(123) @ Nets(122),"January 03, 2021",2021-01-04T18:57:52Z,123,Wizards,122,Nets
Q4,01:11.0,Foul: Shooting,Jeff Green,Bradley Beal,CNC,Green (BKN) makes marginal contact to Beal's (WAS) arm during his shooting motion that does not disrupt his layup attempt.,20.4081631% Complete    01:21.0       To       01:10.1,gameId=0022000086,Wizards(123) @ Nets(122),"January 03, 2021",2021-01-04T18:57:52Z,123,Wizards,122,Nets
Q4,01:06,Foul: Personal,Bradley Beal,Timothe Luwawu-Cabarrot,CNC,"Beal (WAS) makes marginal contact to Luwawu-Cabarrot's (BKN) body, but does not disrupt his ability to make the pass.",30.6122456% Complete    01:10.1       To       00:54.2,gameId=0022000086,Wizards(123) @ Nets(122),"January 03, 2021",2021-01-04T18:57:52Z,123,Wizards,122,Nets
Q4,01:00.7,Foul: Offensive,Kyrie Irving,Rui Hachimura,CNC,Irving (BKN) firms up in a screening position in the path of Hachimura (WAS) and absorbs the contact.,30.6122456% Complete    01:10.1       To       00:54.2,gameId=0022000086,Wizards(123) @ Nets(122),"January 03, 2021",2021-01-04T18:57:52Z,123,Wizards,122,Nets
Q4,00:15.2,Foul: Shooting,Timothe Luwawu-Cabarrot,Thomas Bryant,CNC,Luwawu-Cabarrot (BKN) makes marginal contact to Bryant's (WAS) arm during his shooting motion that does not disrupt the dunk attempt.,26.5306129% Complete    00:28.2       To       00:14.8,gameId=0022000086,Wizards(123) @ Nets(122),"January 03, 2021",2021-01-04T18:57:52Z,123,Wizards,122,Nets
Q4,01:37.5,Foul: Shooting,Paul George,Deandre Ayton,CC,George (LAC) makes contact to Ayton's (PHX) arm during his shot attempt near the rim.,36.7346954% Complete    01:56.3       To       01:37.5,gameId=0022000091,Clippers(112) @ Suns(107),"January 03, 2021",2021-01-04T18:58:12Z,112,Clippers,107,Suns
Q4,01:22.8,Foul: Shooting,Jae Crowder,Kawhi Leonard,CNC,Crowder (PHX) maintains a legal guarding position during Leonard's (LAC) jump shot attempt.,32.65306% Complete    01:37.5       To       01:21.2,gameId=0022000091,Clippers(112) @ Suns(107),"January 03, 2021",2021-01-04T18:58:12Z,112,Clippers,107,Suns
Q4,01:10.8,Foul: Shooting,Serge Ibaka,Chris Paul,CNC,"Ibaka (LAC) makes incidental ""high-five"" contact with Paul (PHX) after the release of his jump shot attempt.",24.4897957% Complete    01:21.2       To       01:08.9,gameId=0022000091,Clippers(112) @ Suns(107),"January 03, 2021",2021-01-04T18:58:12Z,112,Clippers,107,Suns
Q4,00:36.9,Foul: Offensive,Deandre Ayton,Paul George,CNC,Ayton (PHX) establishes himself in a legal screening position in George's (LAC) path.,36.7346954% Complete    00:50.0       To       00:31.7,gameId=0022000091,Clippers(112) @ Suns(107),"January 03, 2021",2021-01-04T18:58:12Z,112,Clippers,107,Suns
Q4,00:14,Foul: Offensive,Paul George,Devin Booker,CNC,"Following the pass, George's (LAC) momentum carries him to but not through Booker (PHX) when the marginal contact occurs. Paul does not dislodge Booker.",38.77551% Complete    00:31.7       To       00:11.8,gameId=0022000091,Clippers(112) @ Suns(107),"January 03, 2021",2021-01-04T18:58:12Z,112,Clippers,107,Suns
Q4,00:06.5,Foul: Personal,Jae Crowder,Patrick Beverley,CC,Crowder (PHX) commits a take foul on Beverley (LAC).,2.04081631% Complete    00:08.3       To       00:06.5,gameId=0022000091,Clippers(112) @ Suns(107),"January 03, 2021",2021-01-04T18:58:12Z,112,Clippers,107,Suns
Q4,00:01.3,Foul: Shooting,Paul George,Mikal Bridges,CC,George (LAC) makes contact to Bridges' (PHX) arm and the contact affects his jump shot attempt.,10.2040815% Complete    00:06.5       To       00:01.2,gameId=0022000091,Clippers(112) @ Suns(107),"January 03, 2021",2021-01-04T18:58:12Z,112,Clippers,107,Suns
Q4,01:54.8,Foul: Shooting,Julius Randle,Trae Young,CNC,Randle (NYK) is moving alongside Young's (ATL) path and maintains a legal guarding position as he defends the driving shot attempt.,34.69388% Complete    02:06.7       To       01:49.4,gameId=0022000095,Knicks(113) @ Hawks(108),"January 04, 2021",2021-01-05T20:52:40Z,113,Knicks,108,Hawks
Q4,01:50.9,Foul: Shooting,Mitchell Robinson,John Collins,INC,Robinson (NYK) does not maintain verticality and makes contact with Collins' (ATL) arm that affects his shot near the rim.,34.69388% Complete    02:06.7       To       01:49.4,gameId=0022000095,Knicks(113) @ Hawks(108),"January 04, 2021",2021-01-05T20:52:40Z,113,Knicks,108,Hawks
Q4,01:47.5,Foul: Personal,John Collins,Julius Randle,CC,Collins (ATL) makes contact with Randle's (NYK) arm after Randle has secured the ball.,4.08163261% Complete    01:49.4       To       01:47.0,gameId=0022000095,Knicks(113) @ Hawks(108),"January 04, 2021",2021-01-05T20:52:40Z,113,Knicks,108,Hawks
Q4,01:41.9,Foul: Shooting,Austin Rivers,De'Andre Hunter,CNC,Rivers (NYK) legally contests Hunter's (ATL) jump shot attempt.,12.2448978% Complete    01:47.0       To       01:40.4,gameId=0022000095,Knicks(113) @ Hawks(108),"January 04, 2021",2021-01-05T20:52:40Z,113,Knicks,108,Hawks
Q4,01:29.6,Foul: Offensive,Mitchell Robinson,Kevin Huerter,CNC,Robinson (NYK) is already in Huerter's (ATL) path when contact occurs and he does not deliver contact.,30.6122456% Complete    01:40.4       To       01:25.4,gameId=0022000095,Knicks(113) @ Hawks(108),"January 04, 2021",2021-01-05T20:52:40Z,113,Knicks,108,Hawks
Q4,01:22.9,Foul: Offensive,Trae Young,Austin Rivers,CC,Young (ATL) extends his arm into Rivers' (NYK) body and dislodges Rivers from his legally obtained defensive position.,4.08163261% Complete    01:25.4       To       01:22.8,gameId=0022000095,Knicks(113) @ Hawks(108),"January 04, 2021",2021-01-05T20:52:40Z,113,Knicks,108,Hawks
Q4,01:09,Foul: Personal,De'Andre Hunter,Mitchell Robinson,CNC,Hunter (ATL) momentarily rests his hand on the hip of Robinson (NYK) off ball.,73.46939% Complete    01:22.8       To       00:46.4,gameId=0022000095,Knicks(113) @ Hawks(108),"January 04, 2021",2021-01-05T20:52:40Z,113,Knicks,108,Hawks
Q4,01:07,Foul: Personal,John Collins,Julius Randle,CNC,Collins (ATL) is moving alongside Randle's (NYK) path to the basket and maintains a legal guarding position.,73.46939% Complete    01:22.8       To       00:46.4,gameId=0022000095,Knicks(113) @ Hawks(108),"January 04, 2021",2021-01-05T20:52:40Z,113,Knicks,108,Hawks
Q4,01:03,Foul: Loose Ball,Julius Randle,John Collins,CNC,Randle (NYK) makes marginal contact to Collins (ATL) arm as they reach for the rebound.,73.46939% Complete    01:22.8       To       00:46.4,gameId=0022000095,Knicks(113) @ Hawks(108),"January 04, 2021",2021-01-05T20:52:40Z,113,Knicks,108,Hawks
