period,time,call_type,committing,disadvantaged,decision,comments,stint,game_id,game_details,game_date,scrape_time,away_score,away_team,home_score,home_team
Q4,00:26.6,Foul: Offensive,Chris Paul,Ja Morant,CC,Morant (MEM) establishes a legal guarding position when Paul (PHX) extends his forearm into Morant's front during the drive.,8.163265% Complete    00:30.8       To       00:26.6,gameId=0022000208,Suns(104) @ Grizzlies(108),"January 18, 2021",2021-01-19T20:13:34Z,104,Suns,108,Grizzlies
Q4,00:17.4,Foul: Personal,Devin Booker,Grayson Allen,CC,Booker (PHX) commits a take foul on Allen (MEM).,18.3673477% Complete    00:26.6       To       00:17.3,gameId=0022000208,Suns(104) @ Grizzlies(108),"January 18, 2021",2021-01-19T20:13:34Z,104,Suns,108,Grizzlies
Q4,00:13.3,Turnover: 3 Second Violation,Deandre Ayton,Grizzlies,CNC,Ayton (PHX) could be deemed to be in the lane for less than three seconds when the shot is imminent.,10.2040815% Complete    00:17.3       To       00:11.6,gameId=0022000208,Suns(104) @ Grizzlies(108),"January 18, 2021",2021-01-19T20:13:34Z,104,Suns,108,Grizzlies
Q4,00:10.0,Foul: Personal,Mikal Bridges,Ja Morant,CNC,Bridges (PHX) makes marginal contact with Morant (MEM) attempting to take a foul.,6.122449% Complete    00:11.6       To       00:08.3,gameId=0022000208,Suns(104) @ Grizzlies(108),"January 18, 2021",2021-01-19T20:13:34Z,104,Suns,108,Grizzlies
Q4,00:08.4,Foul: Personal,Chris Paul,Grayson Allen,CC,Paul (PHX) commits a take foul on Allen (MEM).,6.122449% Complete    00:11.6       To       00:08.3,gameId=0022000208,Suns(104) @ Grizzlies(108),"January 18, 2021",2021-01-19T20:13:34Z,104,Suns,108,Grizzlies
Q4,00:03.3,Foul: Shooting,Kyle Anderson,Mikal Bridges,CC,Anderson (MEM) makes contact to Bridges' (PHX) arm that affects his put back shot attempt near the rim.,10.2040815% Complete    00:08.3       To       00:03.2,gameId=0022000208,Suns(104) @ Grizzlies(108),"January 18, 2021",2021-01-19T20:13:34Z,104,Suns,108,Grizzlies
Q4,00:01.5,Foul: Personal,Devin Booker,Xavier Tillman,CC,Booker (PHX) commits a take foul on Tillman (MEM).,2.04081631% Complete    00:03.2       To       00:01.5,gameId=0022000208,Suns(104) @ Grizzlies(108),"January 18, 2021",2021-01-19T20:13:34Z,104,Suns,108,Grizzlies
Q4,01:58,Foul: Personal,Pat Connaughton,James Harden,CNC,Connaughton (MIL) is moving alongside Harden's (BKN) path and maintains a legal guarding position as he defends the drive.,28.5714283% Complete    02:10.1       To       01:55.6,gameId=0022000209,Bucks(123) @ Nets(125),"January 18, 2021",2021-01-19T20:13:56Z,123,Bucks,125,Nets
Q4,01:47.0,Foul: Personal,Jeff Green,Brook Lopez,CNC,Green (BKN) places his hand momentarily on Lopez's (MIL) hip before correcting.,20.4081631% Complete    01:55.6       To       01:44.8,gameId=0022000209,Bucks(123) @ Nets(125),"January 18, 2021",2021-01-19T20:13:56Z,123,Bucks,125,Nets
Q4,01:47.0,Foul: Offensive,Brook Lopez,Kevin Durant,CNC,Lopez (MIL) is already in Durant's (BKN) path and he absorbs the contact.,20.4081631% Complete    01:55.6       To       01:44.8,gameId=0022000209,Bucks(123) @ Nets(125),"January 18, 2021",2021-01-19T20:13:56Z,123,Bucks,125,Nets
Q4,01:45.6,Foul: Shooting,Jeff Green,Khris Middleton,CNC,Green (BKN) makes marginal contact with Middleton (MIL) as he cuts back towards the basket.,20.4081631% Complete    01:55.6       To       01:44.8,gameId=0022000209,Bucks(123) @ Nets(125),"January 18, 2021",2021-01-19T20:13:56Z,123,Bucks,125,Nets
Q4,01:37.7,Foul: Offensive,Joe Harris,Khris Middleton,CNC,Harris (BKN) is already in Middleton's (MIL) path when contact occurs and he does not deliver contact.,24.4897957% Complete    01:44.8       To       01:32.0,gameId=0022000209,Bucks(123) @ Nets(125),"January 18, 2021",2021-01-19T20:13:56Z,123,Bucks,125,Nets
Q4,01:32.8,Foul: Personal,Khris Middleton,Kevin Durant,CC,Middleton (MIL) moves laterally into Durant's (BKN) path and affects his SQBR.,24.4897957% Complete    01:44.8       To       01:32.0,gameId=0022000209,Bucks(123) @ Nets(125),"January 18, 2021",2021-01-19T20:13:56Z,123,Bucks,125,Nets
Q4,01:25,Foul: Personal,Kevin Durant,Khris Middleton,CNC,Durant (BKN) places his hand momentarily on Middleton's (MIL) hip before immediately removing his hand.,28.5714283% Complete    01:32.0       To       01:17.5,gameId=0022000209,Bucks(123) @ Nets(125),"January 18, 2021",2021-01-19T20:13:56Z,123,Bucks,125,Nets
Q4,01:20.7,Foul: Offensive,Giannis Antetokounmpo,Kevin Durant,CNC,Antetokounmpo (MIL) is already in Durant's (BKN) path when contact occurs and he does not deliver contact.,28.5714283% Complete    01:32.0       To       01:17.5,gameId=0022000209,Bucks(123) @ Nets(125),"January 18, 2021",2021-01-19T20:13:56Z,123,Bucks,125,Nets
Q4,01:18,Foul: Personal,Jeff Green,Jrue Holiday,CNC,Green (BKN) makes incidental contact with Holiday (MIL) as Holiday receives the pass.,28.5714283% Complete    01:32.0       To       01:17.5,gameId=0022000209,Bucks(123) @ Nets(125),"January 18, 2021",2021-01-19T20:13:56Z,123,Bucks,125,Nets
Q4,01:12,Foul: Offensive,Joe Harris,Jrue Holiday,CNC,Harris (BKN) is already in Holiday's (MIL) path when contact occurs and he does not deliver contact.,24.4897957% Complete    01:17.5       To       01:05.5,gameId=0022000209,Bucks(123) @ Nets(125),"January 18, 2021",2021-01-19T20:13:56Z,123,Bucks,125,Nets
Q4,01:07.1,Foul: Shooting,Jrue Holiday,Joe Harris,CNC,"Holiday (MIL) legally contests Harris' (BKN) jump shot attempt.  Any ""high-five"" contact after the release is considered incidental.",24.4897957% Complete    01:17.5       To       01:05.5,gameId=0022000209,Bucks(123) @ Nets(125),"January 18, 2021",2021-01-19T20:13:56Z,123,Bucks,125,Nets
Q4,00:57.8,Foul: Offensive,Giannis Antetokounmpo,Kevin Durant,CNC,Antetokounmpo (MIL) is already in Durant's (BKN) path when contact occurs and he does not deliver contact.,20.4081631% Complete    01:05.5       To       00:55.4,gameId=0022000209,Bucks(123) @ Nets(125),"January 18, 2021",2021-01-19T20:13:56Z,123,Bucks,125,Nets
Q4,00:56.5,Foul: Shooting,DeAndre Jordan,Khris Middleton,CNC,Jordan (BKN) legally contests Middleton's (MIL) jump shot attempt.,20.4081631% Complete    01:05.5       To       00:55.4,gameId=0022000209,Bucks(123) @ Nets(125),"January 18, 2021",2021-01-19T20:13:56Z,123,Bucks,125,Nets
Q4,00:46.0,Foul: Offensive,Joe Harris,Khris Middleton,CNC,Harris (BKN) is already in Middleton's (MIL) path when contact occurs and he does not deliver contact.,38.77551% Complete    00:55.4       To       00:36.3,gameId=0022000209,Bucks(123) @ Nets(125),"January 18, 2021",2021-01-19T20:13:56Z,123,Bucks,125,Nets
Q4,00:44.5,Foul: Offensive,Kevin Durant,Donte DiVincenzo,CNC,Durant (BKN) is bracing for the contact from DiVincenzo (MIL) and releases away from the contact.,38.77551% Complete    00:55.4       To       00:36.3,gameId=0022000209,Bucks(123) @ Nets(125),"January 18, 2021",2021-01-19T20:13:56Z,123,Bucks,125,Nets
Q4,00:43.9,Foul: Offensive,DeAndre Jordan,Jrue Holiday,CNC,Jordan (BKN) is already in Holiday's (MIL) path when contact occurs and he does not deliver contact.,38.77551% Complete    00:55.4       To       00:36.3,gameId=0022000209,Bucks(123) @ Nets(125),"January 18, 2021",2021-01-19T20:13:56Z,123,Bucks,125,Nets
Q4,00:39.9,Foul: Loose Ball,Brook Lopez,DeAndre Jordan,CNC,Lopez (MIL) and Jordan (BKN) briefly engage and disengage during rebounding.,38.77551% Complete    00:55.4       To       00:36.3,gameId=0022000209,Bucks(123) @ Nets(125),"January 18, 2021",2021-01-19T20:13:56Z,123,Bucks,125,Nets
Q4,00:30.4,Foul: Shooting,Kevin Durant,Khris Middleton,CNC,Durant (BKN) legally contests Middleton's (MIL) jump shot attempt.,14.2857141% Complete    00:36.3       To       00:28.5,gameId=0022000209,Bucks(123) @ Nets(125),"January 18, 2021",2021-01-19T20:13:56Z,123,Bucks,125,Nets
Q4,00:28.5,Foul: Loose Ball,Jeff Green,Brook Lopez,CNC,Green (BKN) and Lopez (MIL) briefly engage and disengage during rebounding.,14.2857141% Complete    00:36.3       To       00:28.5,gameId=0022000209,Bucks(123) @ Nets(125),"January 18, 2021",2021-01-19T20:13:56Z,123,Bucks,125,Nets
Q4,00:07.0,Foul: Shooting,Khris Middleton,Kevin Durant,CNC,Durant (BKN) loses control of the ball on his own and not as a result of any contact from Middleton (MIL).,42.8571434% Complete    00:28.5       To       00:07.0,gameId=0022000209,Bucks(123) @ Nets(125),"January 18, 2021",2021-01-19T20:13:56Z,123,Bucks,125,Nets
Q4,00:03.8,Stoppage: TimeOut,Bucks,Nets,NA,"Durant (BKN) loses the ball and it is recovered by Lopez (MIL) at 6.5. Middleton (MIL) requests a timeout, which is granted by the officials at 4.8 seconds, but the clock continues to run to 3.5. The clock is incorrectly reset to 3.8 and not 4.8. Instant replay could not be used in this situation to determine the precise time of the timeout being granted because there is no replay trigger for a clock malfunction that doesn?t end in the expiration of the clock.",42.8571434% Complete    00:28.5       To       00:07.0,gameId=0022000209,Bucks(123) @ Nets(125),"January 18, 2021",2021-01-19T20:13:56Z,123,Bucks,125,Nets
Q4,00:03.8,Foul: Personal,Kevin Durant,Khris Middleton,CNC,Durant (BKN) places his hand momentarily on Middleton's (MIL) side before immediately removing his hand.,12.2448978% Complete    00:07.0       To       00:00.3,gameId=0022000209,Bucks(123) @ Nets(125),"January 18, 2021",2021-01-19T20:13:56Z,123,Bucks,125,Nets
Q4,00:03.8,Foul: Offensive,Brook Lopez,Kevin Durant,CNC,Lopez (MIL) is already in Durant's (BKN) path when contact occurs and he does not deliver contact.,12.2448978% Complete    00:07.0       To       00:00.3,gameId=0022000209,Bucks(123) @ Nets(125),"January 18, 2021",2021-01-19T20:13:56Z,123,Bucks,125,Nets
Q4,00:02.2,Foul: Shooting,Bruce Brown,Khris Middleton,CNC,"Brown (BKN) legally contests Middleton's (MIL) jump shot attempt.  Any ""high-five"" contact after the release is considered incidental.",12.2448978% Complete    00:07.0       To       00:00.3,gameId=0022000209,Bucks(123) @ Nets(125),"January 18, 2021",2021-01-19T20:13:56Z,123,Bucks,125,Nets
Q4,01:59.0,Turnover: Traveling,Eric Gordon,Bulls,INC,Gordon (HOU) ends his dribble and hops consecutively on the same foot after his gather.,20.4081631% Complete    02:01.1       To       01:50.7,gameId=0022000211,Rockets(120) @ Bulls(125),"January 18, 2021",2021-01-19T20:14:15Z,120,Rockets,125,Bulls
Q4,01:39.9,Foul: Shooting,Christian Wood,Zach LaVine,CNC,Wood (HOU) makes marginal contact to LaVine's (CHI) front during his shooting motion and does not affect his driving shot attempt.,22.44898% Complete    01:50.7       To       01:39.1,gameId=0022000211,Rockets(120) @ Bulls(125),"January 18, 2021",2021-01-19T20:14:15Z,120,Rockets,125,Bulls
Q4,01:39.1,Foul: Personal,Zach LaVine,Victor Oladipo,CNC,LaVine (CHI) cleanly dislodges the ball from Oladipo (HOU) at the end of his drive. Any arm contact after the dislodge is deemed incidental.,24.4897957% Complete    01:39.1       To       01:27.0,gameId=0022000211,Rockets(120) @ Bulls(125),"January 18, 2021",2021-01-19T20:14:15Z,120,Rockets,125,Bulls
Q4,01:28,Turnover: Out of Bounds,Victor Oladipo,NA,CNC,"LaVine (CHI) makes contact with the ball, which then goes off of Oladipo's (HOU) hand and out of bounds.",24.4897957% Complete    01:39.1       To       01:27.0,gameId=0022000211,Rockets(120) @ Bulls(125),"January 18, 2021",2021-01-19T20:14:15Z,120,Rockets,125,Bulls
Q4,01:27.0,Foul: Offensive,Zach LaVine,Christian Wood,CNC,LaVine (CHI) releases from Wood (HOU) at the end of his drive.,24.4897957% Complete    01:27.0       To       01:14.5,gameId=0022000211,Rockets(120) @ Bulls(125),"January 18, 2021",2021-01-19T20:14:15Z,120,Rockets,125,Bulls
Q4,01:03.7,Foul: Shooting,Lauri Markkanen,Christian Wood,CC,Markkanen (CHI) does not maintain verticality as he swipes down and makes contact with Wood's (HOU) arm that affects his driving shot attempt.,22.44898% Complete    01:14.5       To       01:03.0,gameId=0022000211,Rockets(120) @ Bulls(125),"January 18, 2021",2021-01-19T20:14:15Z,120,Rockets,125,Bulls
Q4,00:39.5,Foul: Offensive,Christian Wood,Thaddeus Young,CNC,Wood (HOU) makes marginal contact with Young (CHI) as he attempts to roll towards the basket during the pick.,22.44898% Complete    00:46.9       To       00:35.0,gameId=0022000211,Rockets(120) @ Bulls(125),"January 18, 2021",2021-01-19T20:14:15Z,120,Rockets,125,Bulls
Q4,00:37.8,Foul: Offensive,P.J. Tucker,Zach LaVine,CNC,Tucker (HOU) establishes himself in a screening position in the path of LaVine (CHI) and absorbs the contact.,22.44898% Complete    00:46.9       To       00:35.0,gameId=0022000211,Rockets(120) @ Bulls(125),"January 18, 2021",2021-01-19T20:14:15Z,120,Rockets,125,Bulls
Q4,00:35.0,Foul: Loose Ball,Jae'Sean Tate,Lauri Markkanen,CNC,Tate (HOU) makes incidental contact to Markkanen's (CHI) arm during the rebound.,22.44898% Complete    00:46.9       To       00:35.0,gameId=0022000211,Rockets(120) @ Bulls(125),"January 18, 2021",2021-01-19T20:14:15Z,120,Rockets,125,Bulls
Q4,00:25.4,Foul: Personal,Victor Oladipo,Coby White,CC,Oladipo (HOU) commits a take foul on White (CHI).,24.4897957% Complete    00:35.0       To       00:23.0,gameId=0022000211,Rockets(120) @ Bulls(125),"January 18, 2021",2021-01-19T20:14:15Z,120,Rockets,125,Bulls
Q4,00:23.0,Foul: Personal,P.J. Tucker,Garrett Temple,CC,Tucker (HOU) makes contact to Temple's (CHI) arm that affects his SQBR.,24.4897957% Complete    00:35.0       To       00:23.0,gameId=0022000211,Rockets(120) @ Bulls(125),"January 18, 2021",2021-01-19T20:14:15Z,120,Rockets,125,Bulls
Q4,00:23.0,Foul: Offensive,Christian Wood,Zach LaVine,CNC,Wood (HOU) establishes himself in a screening position in the path of LaVine (CHI) and absorbs the contact.,6.122449% Complete    00:23.0       To       00:19.6,gameId=0022000211,Rockets(120) @ Bulls(125),"January 18, 2021",2021-01-19T20:14:15Z,120,Rockets,125,Bulls
Q4,00:23.0,Foul: Personal,Garrett Temple,Eric Gordon,CNC,"Temple (CHI) slightly extends his leg into Gordon's (HOU) path at the start of his drive, but the contact is marginal.",6.122449% Complete    00:23.0       To       00:19.6,gameId=0022000211,Rockets(120) @ Bulls(125),"January 18, 2021",2021-01-19T20:14:15Z,120,Rockets,125,Bulls
Q4,00:19.6,Foul: Personal,Eric Gordon,Garrett Temple,CNC,Gordon (HOU) briefly places two hands to Temple's (CHI) front off-ball and does not affect his FOM.,8.163265% Complete    00:19.6       To       00:15.5,gameId=0022000211,Rockets(120) @ Bulls(125),"January 18, 2021",2021-01-19T20:14:15Z,120,Rockets,125,Bulls
Q4,00:15.5,Foul: Personal,Victor Oladipo,Lauri Markkanen,CC,Oladipo (HOU) commits a take foul on Markkanen (CHI).,8.163265% Complete    00:19.6       To       00:15.5,gameId=0022000211,Rockets(120) @ Bulls(125),"January 18, 2021",2021-01-19T20:14:15Z,120,Rockets,125,Bulls
Q4,00:08.2,Foul: Offensive,Coby White,Victor Oladipo,CNC,White (CHI) makes incidental contact with Oladipo (HOU) as both players come together prior to the inbounds pass.,2.04081631% Complete    00:08.8       To       00:07.0,gameId=0022000211,Rockets(120) @ Bulls(125),"January 18, 2021",2021-01-19T20:14:15Z,120,Rockets,125,Bulls
Q4,00:07.1,Foul: Personal,Jae'Sean Tate,Zach LaVine,CC,Tate (HOU) commits a take foul on LaVine (CHI).,2.04081631% Complete    00:08.8       To       00:07.0,gameId=0022000211,Rockets(120) @ Bulls(125),"January 18, 2021",2021-01-19T20:14:15Z,120,Rockets,125,Bulls
Q4,00:03.0,Foul: Shooting,Zach LaVine,Eric Gordon,CNC,LaVine (CHI) makes marginal contact to Gordon's (HOU) body during his shooting motion and does not affect his driving shot attempt.,8.163265% Complete    00:07.0       To       00:02.2,gameId=0022000211,Rockets(120) @ Bulls(125),"January 18, 2021",2021-01-19T20:14:15Z,120,Rockets,125,Bulls
Q4,01:51.5,Turnover: Traveling,LeBron James,Draymond Green,CC,James (LAL) splits his feet at the start of his dribble.,34.69388% Complete    02:08.6       To       01:51.5,gameId=0022000212,Warriors(115) @ Lakers(113),"January 18, 2021",2021-01-19T20:14:35Z,115,Warriors,113,Lakers
Q4,01:44.8,Foul: Offensive,Draymond Green,Dennis Schroder,CNC,Green (GSW) sets the screen in Schroder's (LAL) path and gives him room to avoid the contact.,24.4897957% Complete    01:51.5       To       01:39.5,gameId=0022000212,Warriors(115) @ Lakers(113),"January 18, 2021",2021-01-19T20:14:35Z,115,Warriors,113,Lakers
Q4,01:42.3,Turnover: Traveling,Draymond Green,Lakers,INC,Green (GSW) slides his pivot foot after gathering his dribble.,24.4897957% Complete    01:51.5       To       01:39.5,gameId=0022000212,Warriors(115) @ Lakers(113),"January 18, 2021",2021-01-19T20:14:35Z,115,Warriors,113,Lakers
Q4,01:37.0,Foul: Offensive,Dennis Schroder,Draymond Green,CNC,Schroder (LAL) sets the screen on Green (GSW) and gives him room to avoid the contact.,28.5714283% Complete    01:39.5       To       01:25.1,gameId=0022000212,Warriors(115) @ Lakers(113),"January 18, 2021",2021-01-19T20:14:35Z,115,Warriors,113,Lakers
Q4,01:34,Foul: Personal,Kelly Oubre Jr.,Anthony Davis,CNC,Oubre Jr. (GSW) cleanly dislodges the ball from Davis (LAL).,28.5714283% Complete    01:39.5       To       01:25.1,gameId=0022000212,Warriors(115) @ Lakers(113),"January 18, 2021",2021-01-19T20:14:35Z,115,Warriors,113,Lakers
Q4,01:28.9,Foul: Offensive,Anthony Davis,Andrew Wiggins,CNC,Davis (LAL) sets the screen on Wiggins (GSW) and does not deliver contact.,28.5714283% Complete    01:39.5       To       01:25.1,gameId=0022000212,Warriors(115) @ Lakers(113),"January 18, 2021",2021-01-19T20:14:35Z,115,Warriors,113,Lakers
Q4,01:12.3,Violation: Kicked Ball,Dennis Schroder,Warriors,CC,Schroder (LAL) extends his foot and intentionally kicks the ball.,36.7346954% Complete    01:25.1       To       01:07.0,gameId=0022000212,Warriors(115) @ Lakers(113),"January 18, 2021",2021-01-19T20:14:35Z,115,Warriors,113,Lakers
Q4,01:11,Foul: Offensive,Draymond Green,Dennis Schroder,CNC,Green (GSW) establishes his position in Schroder's (LAL) path while setting the screen and gives him room to avoid the contact.,36.7346954% Complete    01:25.1       To       01:07.0,gameId=0022000212,Warriors(115) @ Lakers(113),"January 18, 2021",2021-01-19T20:14:35Z,115,Warriors,113,Lakers
Q4,00:58.7,Foul: Personal,Andrew Wiggins,LeBron James,CNC,Wiggins (GSW) maintains a legal guarding position on James (LAL).,30.6122456% Complete    01:07.0       To       00:51.2,gameId=0022000212,Warriors(115) @ Lakers(113),"January 18, 2021",2021-01-19T20:14:35Z,115,Warriors,113,Lakers
Q4,00:51.3,Foul: Personal,Andrew Wiggins,LeBron James,IC,Wiggins (GSW) makes marginal contact with James (LAL) as he defends him in the post.,30.6122456% Complete    01:07.0       To       00:51.2,gameId=0022000212,Warriors(115) @ Lakers(113),"January 18, 2021",2021-01-19T20:14:35Z,115,Warriors,113,Lakers
Q4,00:38.6,Foul: Shooting,Dennis Schroder,Stephen Curry,CNC,Schroder (LAL) jumps to the side of Currry (GSW) to contest the shot attempt and would avoid contact if Curry does not extend his lower body into him.,28.5714283% Complete    00:51.2       To       00:36.5,gameId=0022000212,Warriors(115) @ Lakers(113),"January 18, 2021",2021-01-19T20:14:35Z,115,Warriors,113,Lakers
Q4,00:30.2,Foul: Personal,Stephen Curry,Dennis Schroder,CC,Curry (GSW) moves laterally into Schroder's (LAL) path and initiates contact that affects his SQBR.,12.2448978% Complete    00:36.5       To       00:30.2,gameId=0022000212,Warriors(115) @ Lakers(113),"January 18, 2021",2021-01-19T20:14:35Z,115,Warriors,113,Lakers
Q4,00:15.1,Foul: Shooting,Dennis Schroder,Stephen Curry,CNC,Schroder (LAL) maintains a legal guarding position during the driving shot attempt by Curry (GSW).,32.65306% Complete    00:30.2       To       00:13.8,gameId=0022000212,Warriors(115) @ Lakers(113),"January 18, 2021",2021-01-19T20:14:35Z,115,Warriors,113,Lakers
Q4,00:06.0,Foul: Offensive,Anthony Davis,Damion Lee,CNC,Davis (LAL) and Lee (GSW) briefly engage and separate off ball.,26.5306129% Complete    00:13.8       To       00:00.0,gameId=0022000212,Warriors(115) @ Lakers(113),"January 18, 2021",2021-01-19T20:14:35Z,115,Warriors,113,Lakers
Q4,00:04.5,Foul: Personal,Kelly Oubre Jr.,Dennis Schroder,CNC,Oubre Jr. (GSW) maintains a legal guarding position on Schroder (LAL).,26.5306129% Complete    00:13.8       To       00:00.0,gameId=0022000212,Warriors(115) @ Lakers(113),"January 18, 2021",2021-01-19T20:14:35Z,115,Warriors,113,Lakers
Q4,00:00.9,Foul: Personal,Draymond Green,LeBron James,CNC,Green (GSW) makes marginal contact with James (LAL) before the shot attempt.,26.5306129% Complete    00:13.8       To       00:00.0,gameId=0022000212,Warriors(115) @ Lakers(113),"January 18, 2021",2021-01-19T20:14:35Z,115,Warriors,113,Lakers
Q4,01:58.4,Turnover: Traveling,Isaac Okoro,James Harden,CC,"As a stationary player, Okoro (CLE) receives the pass and establishes his left foot as his pivot, which he lifts and re-plants as he starts his dribble.",36.7346954% Complete    02:17.1       To       01:58.4,gameId=0022000216,Nets(135) @ Cavaliers(147),"January 20, 2021",2021-01-21T19:46:35Z,135,Nets,147,Cavaliers
Q4,01:53.0,Foul: Offensive,Joe Harris,Larry Nance Jr.,CNC,Harris (BKN) firms up in his screening position in Nance Jr.'s (CLE) path and absorbs the contact.,18.3673477% Complete    01:58.4       To       01:49.0,gameId=0022000216,Nets(135) @ Cavaliers(147),"January 20, 2021",2021-01-21T19:46:35Z,135,Nets,147,Cavaliers
Q4,01:49.1,Foul: Shooting,Isaac Okoro,James Harden,CC,Okoro (CLE) initiates contact across Harden's (BKN) right arm after his gather.,18.3673477% Complete    01:58.4       To       01:49.0,gameId=0022000216,Nets(135) @ Cavaliers(147),"January 20, 2021",2021-01-21T19:46:35Z,135,Nets,147,Cavaliers
Q4,01:40.9,Foul: Personal,Jeff Green,Larry Nance Jr.,CNC,Green (BKN) and Nance Jr. (CLE) engage and disengage with one another as they move toward the elbow.,26.5306129% Complete    01:49.0       To       01:35.1,gameId=0022000216,Nets(135) @ Cavaliers(147),"January 20, 2021",2021-01-21T19:46:35Z,135,Nets,147,Cavaliers
Q4,01:35.2,Foul: Personal,Joe Harris,Larry Nance Jr.,CC,Harris (BKN) initiates contact with Nance Jr.'s (CLE) front that affects his FOM off ball.,26.5306129% Complete    01:49.0       To       01:35.1,gameId=0022000216,Nets(135) @ Cavaliers(147),"January 20, 2021",2021-01-21T19:46:35Z,135,Nets,147,Cavaliers
Q4,01:26.6,Foul: Offensive,Kyrie Irving,Collin Sexton,CNC,"Irving (BKN) and Sexton (CLE) engage with one another as the screen approaches and as they begin to disengage, Irving makes some contact with Sexton's face. Contact to an opponent's head/face can be deemed marginal when the result of a natural basketball move, provided the contact is not disproportionate or uncontrolled.",48.97959% Complete    01:35.1       To       01:10.7,gameId=0022000216,Nets(135) @ Cavaliers(147),"January 20, 2021",2021-01-21T19:46:35Z,135,Nets,147,Cavaliers
Q4,01:15.5,Turnover: Discontinue Dribble,Joe Harris,Cavaliers,INC,Harris (BKN) pins the ball against his side and resumes his dribble thereafter.,48.97959% Complete    01:35.1       To       01:10.7,gameId=0022000216,Nets(135) @ Cavaliers(147),"January 20, 2021",2021-01-21T19:46:35Z,135,Nets,147,Cavaliers
Q4,01:14.4,Foul: Personal,Cedi Osman,Joe Harris,CNC,Osman (CLE) maintains legal guarding position as contact occurs with Harris (BKN) at the end of the drive.,48.97959% Complete    01:35.1       To       01:10.7,gameId=0022000216,Nets(135) @ Cavaliers(147),"January 20, 2021",2021-01-21T19:46:35Z,135,Nets,147,Cavaliers
Q4,01:13.9,Foul: Shooting,Cedi Osman,Joe Harris,CNC,Osman (CLE) brushes Harris' (BKN) right shoulder as he starts his upward shooting motion and marginal contact occurs.,48.97959% Complete    01:35.1       To       01:10.7,gameId=0022000216,Nets(135) @ Cavaliers(147),"January 20, 2021",2021-01-21T19:46:35Z,135,Nets,147,Cavaliers
Q4,01:07.2,Foul: Offensive,Jarrett Allen,Jeff Green,CNC,Allen (CLE) and Green (BKN) engage and disengage with one another along the perimeter.,40.8163261% Complete    01:10.7       To       00:49.8,gameId=0022000216,Nets(135) @ Cavaliers(147),"January 20, 2021",2021-01-21T19:46:35Z,135,Nets,147,Cavaliers
Q4,00:38.3,Foul: Personal,Larry Nance Jr.,Kevin Durant,CNC,Nance Jr. (CLE) and Durant (BKN) engage and disengage with one another off ball.,42.8571434% Complete    00:49.8       To       00:27.9,gameId=0022000216,Nets(135) @ Cavaliers(147),"January 20, 2021",2021-01-21T19:46:35Z,135,Nets,147,Cavaliers
Q4,00:09.3,Foul: Personal,Kyrie Irving,Collin Sexton,CNC,Irving's (BKN) right hand is extended forward and marginal contact occurs with Sexton's (CLE) left arm prior to Sexton losing control of the ball on his own.,38.77551% Complete    00:27.9       To       00:08.8,gameId=0022000216,Nets(135) @ Cavaliers(147),"January 20, 2021",2021-01-21T19:46:35Z,135,Nets,147,Cavaliers
