period,time,call_type,committing,disadvantaged,decision,comments,stint,game_id,game_details,game_date,scrape_time,away_score,away_team,home_score,home_team
Q4,01:00.8,Foul: Loose Ball,Mitchell Robinson,De'Andre Hunter,CNC,Robinson (NYK) and Hunter (ATL)  make incidental contact with one another during rebounding.,73.46939% Complete    01:22.8       To       00:46.4,gameId=0022000095,Knicks(113) @ Hawks(108),"January 04, 2021",2021-01-05T20:52:40Z,113,Knicks,108,Hawks
Q4,00:50.8,Foul: Personal,Trae Young,Austin Rivers,CNC,Young (ATL) makes marginal contact to Rivers' (NYK) side during his drive to the basket.,73.46939% Complete    01:22.8       To       00:46.4,gameId=0022000095,Knicks(113) @ Hawks(108),"January 04, 2021",2021-01-05T20:52:40Z,113,Knicks,108,Hawks
Q4,00:48.7,Foul: Offensive,Austin Rivers,Trae Young,CNC,"As Rivers (NYK) is starting his natural upward shooting motion, he makes some contact with the head/neck area of Young (ATL).   Contact to an opponent?s head/face can be deemed marginal when the result of a natural basketball move, provided the contact is not disproportionate or uncontrolled.",73.46939% Complete    01:22.8       To       00:46.4,gameId=0022000095,Knicks(113) @ Hawks(108),"January 04, 2021",2021-01-05T20:52:40Z,113,Knicks,108,Hawks
Q4,00:48.7,Foul: Shooting,Trae Young,Austin Rivers,CNC,Young (ATL) is moving alongside Rivers' (NYK) path to the basket and maintains a legal guarding position as he defends the shot.,73.46939% Complete    01:22.8       To       00:46.4,gameId=0022000095,Knicks(113) @ Hawks(108),"January 04, 2021",2021-01-05T20:52:40Z,113,Knicks,108,Hawks
Q4,00:42.4,Foul: Personal,Austin Rivers,Trae Young,CC,Rivers (NYK) turns into Young's (ATL) body and delivers contact that affects his SQBR.,24.4897957% Complete    00:46.4       To       00:33.5,gameId=0022000095,Knicks(113) @ Hawks(108),"January 04, 2021",2021-01-05T20:52:40Z,113,Knicks,108,Hawks
Q4,00:40.8,Foul: Personal,Julius Randle,De'Andre Hunter,CNC,Randle (NYK) is moving alongside Hunter's (ATL) path and maintains a legal guarding position as he defends the drive.,24.4897957% Complete    00:46.4       To       00:33.5,gameId=0022000095,Knicks(113) @ Hawks(108),"January 04, 2021",2021-01-05T20:52:40Z,113,Knicks,108,Hawks
Q4,00:25.8,Foul: Personal,John Collins,Julius Randle,CNC,Collins (ATL) cleanly deflects the ball away from Randle (NYK).,14.2857141% Complete    00:33.5       To       00:25.8,gameId=0022000095,Knicks(113) @ Hawks(108),"January 04, 2021",2021-01-05T20:52:40Z,113,Knicks,108,Hawks
Q4,00:20.3,Foul: Personal,John Collins,Reggie Bullock,CNC,Collins (ATL) makes contact with the ball and with the part of Bullock's (NYK) hand that is on the ball.,8.163265% Complete    00:22.2       To       00:17.5,gameId=0022000095,Knicks(113) @ Hawks(108),"January 04, 2021",2021-01-05T20:52:40Z,113,Knicks,108,Hawks
Q4,00:17.5,Turnover:  Out of Bounds - Bad Pass Turn,Reggie Bullock,John Collins,CC,Possession is correctly awarded to ATL.,8.163265% Complete    00:22.2       To       00:17.5,gameId=0022000095,Knicks(113) @ Hawks(108),"January 04, 2021",2021-01-05T20:52:40Z,113,Knicks,108,Hawks
Q4,00:15.9,Turnover: Palming,Kevin Huerter,Knicks,CNC,Huerter (ATL) does not place part of his hand under the ball when dribbling,10.2040815% Complete    00:17.5       To       00:11.8,gameId=0022000095,Knicks(113) @ Hawks(108),"January 04, 2021",2021-01-05T20:52:40Z,113,Knicks,108,Hawks
Q4,00:15.8,Foul: Offensive,John Collins,Mitchell Robinson,CNC,Collins (ATL) is already in Robinson's (NYK) path when contact occurs and he does not deliver contact.,10.2040815% Complete    00:17.5       To       00:11.8,gameId=0022000095,Knicks(113) @ Hawks(108),"January 04, 2021",2021-01-05T20:52:40Z,113,Knicks,108,Hawks
Q4,00:13.6,Foul: Shooting,RJ Barrett,Cam Reddish,CNC,Barrett (NYK) legally contests Reddish's (ATL) jump shot attempt.,10.2040815% Complete    00:17.5       To       00:11.8,gameId=0022000095,Knicks(113) @ Hawks(108),"January 04, 2021",2021-01-05T20:52:40Z,113,Knicks,108,Hawks
Q4,00:10.1,Foul: Personal,Kevin Huerter,Reggie Bullock,CC,Huerter (ATL) commits a take foul on Bullock (NYK).,2.04081631% Complete    00:11.8       To       00:10.1,gameId=0022000095,Knicks(113) @ Hawks(108),"January 04, 2021",2021-01-05T20:52:40Z,113,Knicks,108,Hawks
Q4,00:08.9,Foul: Offensive,John Collins,Reggie Bullock,CNC,Collins (ATL) is already in Bullock's (NYK) path when contact occurs and he does not deliver contact.,18.3673477% Complete    00:10.1       To       00:00.4,gameId=0022000095,Knicks(113) @ Hawks(108),"January 04, 2021",2021-01-05T20:52:40Z,113,Knicks,108,Hawks
Q4,01:52,Foul: Shooting,Victor Oladipo,Brandon Ingram,CNC,Oladipo (IND) maintains a legal guarding position during the jump shot attempt by Ingram (NOP).,51.02041% Complete    02:12.2       To       01:47.1,gameId=0022000100,Pacers(118) @ Pelicans(116),"January 04, 2021",2021-01-05T20:53:00Z,118,Pacers,116,Pelicans
Q4,01:39.5,Foul: Shooting,Brandon Ingram,Malcolm Brogdon,CNC,Ingram (NOP) makes marginal contact to Brogdon's (IND) body during his drive to the basket and shot attempt.,16.32653% Complete    01:47.1       To       01:38.5,gameId=0022000100,Pacers(118) @ Pelicans(116),"January 04, 2021",2021-01-05T20:53:00Z,118,Pacers,116,Pelicans
Q4,01:26.5,Foul: Offensive,Steven Adams,Malcolm Brogdon,CNC,Adams (NOP) establishes himself in a screening position in the path of Brogdon (IND) when he firms up and absorbs the contact.,30.6122456% Complete    01:38.5       To       01:23.5,gameId=0022000100,Pacers(118) @ Pelicans(116),"January 04, 2021",2021-01-05T20:53:00Z,118,Pacers,116,Pelicans
Q4,01:22,Foul: Loose Ball,Victor Oladipo,Zion Williamson,CNC,Oladipo (IND) makes incidental contact with Williamson (NOP) during the rebound.,14.2857141% Complete    01:23.5       To       01:16.1,gameId=0022000100,Pacers(118) @ Pelicans(116),"January 04, 2021",2021-01-05T20:53:00Z,118,Pacers,116,Pelicans
Q4,01:01.3,Foul: Shooting,Myles Turner,Zion Williamson,INC,Turner (IND) makes contact to Williamson's (NOP) arm/elbow during his shooting motion that disrupts his drive to the basket and shot attempt.,30.6122456% Complete    01:16.1       To       01:00.2,gameId=0022000100,Pacers(118) @ Pelicans(116),"January 04, 2021",2021-01-05T20:53:00Z,118,Pacers,116,Pelicans
Q4,00:30.3,Foul: Personal,Justin Holiday,Brandon Ingram,CNC,Holiday (IND) places a hand/arm to the front of Ingram (NOP) during the drive but the contact marginal.,48.97959% Complete    00:50.7       To       00:26.6,gameId=0022000100,Pacers(118) @ Pelicans(116),"January 04, 2021",2021-01-05T20:53:00Z,118,Pacers,116,Pelicans
Q4,00:30,Foul: Loose Ball,Steven Adams,Myles Turner,CNC,Adams (NOP) makes marginal contact with Turner (IND) as they position themselves for the rebound.,48.97959% Complete    00:50.7       To       00:26.6,gameId=0022000100,Pacers(118) @ Pelicans(116),"January 04, 2021",2021-01-05T20:53:00Z,118,Pacers,116,Pelicans
Q4,00:18.7,Foul: Personal,Doug McDermott,JJ Redick,CNC,McDermott (IND) closes out and makes some contact with Redick's (NOP) body as he attempts to dribble out of the corner.,10.2040815% Complete    00:19.6       To       00:13.9,gameId=0022000100,Pacers(118) @ Pelicans(116),"January 04, 2021",2021-01-05T20:53:00Z,118,Pacers,116,Pelicans
Q4,00:11.2,Foul: Personal,Victor Oladipo,Lonzo Ball,CNC,Oladipo (IND) maintains a legal guarding position on Ball (NOP) and cleanly steals the ball.,14.2857141% Complete    00:13.9       To       00:06.9,gameId=0022000100,Pacers(118) @ Pelicans(116),"January 04, 2021",2021-01-05T20:53:00Z,118,Pacers,116,Pelicans
Q4,00:00.7,Foul: Personal,Josh Hart,Doug McDermott,CNC,Turner (IND) trips McDermott (IND) during the screen.,2.04081631% Complete    00:01.3       To       00:00.0,gameId=0022000100,Pacers(118) @ Pelicans(116),"January 04, 2021",2021-01-05T20:53:00Z,118,Pacers,116,Pelicans
Q5,01:50.0,Foul: Offensive,Myles Turner,Lonzo Ball,CNC,Turner (IND) establishes himself in a screening position in the path of Ball (NOP) when he firms up and absorbs the contact.,36.7346954% Complete    02:04.3       To       01:46.3,gameId=0022000100,Pacers(118) @ Pelicans(116),"January 04, 2021",2021-01-05T20:53:00Z,118,Pacers,116,Pelicans
Q5,01:14.5,Foul: Offensive,Victor Oladipo,Eric Bledsoe,CNC,Oladipo (IND) goes to not through Bledsoe (NOP) on the perimeter.,32.65306% Complete    01:23.0       To       01:06.6,gameId=0022000100,Pacers(118) @ Pelicans(116),"January 04, 2021",2021-01-05T20:53:00Z,118,Pacers,116,Pelicans
Q5,01:02.6,Foul: Shooting,Myles Turner,Zion Williamson,CC,Turner (IND) makes contact to Williamson's (NOP) lower body during his driving shot attempt.,34.69388% Complete    01:06.6       To       00:48.8,gameId=0022000100,Pacers(118) @ Pelicans(116),"January 04, 2021",2021-01-05T20:53:00Z,118,Pacers,116,Pelicans
Q5,00:52.0,Foul: Shooting,JaKarr Sampson,Brandon Ingram,CNC,Sampson (IND) jumps vertically and maintains a legal vertical position while contesting the driving shot attempt by Ingram (NOP).,34.69388% Complete    01:06.6       To       00:48.8,gameId=0022000100,Pacers(118) @ Pelicans(116),"January 04, 2021",2021-01-05T20:53:00Z,118,Pacers,116,Pelicans
Q5,00:50.4,Foul: Loose Ball,JaKarr Sampson,Steven Adams,INC,Sampson (IND) pulls Adams' (NOP) hand off ball during the rebound.,34.69388% Complete    01:06.6       To       00:48.8,gameId=0022000100,Pacers(118) @ Pelicans(116),"January 04, 2021",2021-01-05T20:53:00Z,118,Pacers,116,Pelicans
Q5,00:48.8,Foul: Personal,Steven Adams,Victor Oladipo,CNC,Adams (NOP) establishes position and cleanly deflects the ball as Oladipo (IND) attempts to split the defenders. Oladipo and Adams make incidental knee to knee contact on the sequence.,38.77551% Complete    00:48.8       To       00:29.2,gameId=0022000100,Pacers(118) @ Pelicans(116),"January 04, 2021",2021-01-05T20:53:00Z,118,Pacers,116,Pelicans
Q5,00:31.1,Foul: Offensive,JaKarr Sampson,Lonzo Ball,CNC,Sampson (IND) establishes himself in a screening position in the path of Ball (NOP) when he firms up and absorbs the contact.,38.77551% Complete    00:48.8       To       00:29.2,gameId=0022000100,Pacers(118) @ Pelicans(116),"January 04, 2021",2021-01-05T20:53:00Z,118,Pacers,116,Pelicans
Q5,00:28.7,Foul: Personal,Doug McDermott,Lonzo Ball,CNC,McDermott (IND) makes brief contact to Ball's (NOP) body while defending in transition.,6.122449% Complete    00:29.2       To       00:25.5,gameId=0022000100,Pacers(118) @ Pelicans(116),"January 04, 2021",2021-01-05T20:53:00Z,118,Pacers,116,Pelicans
Q4,01:54,Foul: Loose Ball,Anthony Davis,Jonas Valanciunas,CNC,Davis (LAL) and Valanciunas (MEM) make incidental contact with each other going for the loose ball.,32.65306% Complete    02:10.1       To       01:53.2,gameId=0022000103,Lakers(94) @ Grizzlies(92),"January 05, 2021",2021-01-07T21:30:27Z,94,Lakers,92,Grizzlies
Q4,00:51.3,Turnover: 3 Second Violation,Jonas Valanciunas,Lakers,CNC,Valancuinas (MEM) is in the paint for less than three seconds prior to exiting.,26.5306129% Complete    01:04.4       To       00:50.5,gameId=0022000103,Lakers(94) @ Grizzlies(92),"January 05, 2021",2021-01-07T21:30:27Z,94,Lakers,92,Grizzlies
Q4,00:51.3,Foul: Shooting,LeBron James,Brandon Clarke,CNC,James (LAL) makes contact with the ball during Clarke's (MEM) shot attempt near the rim.,26.5306129% Complete    01:04.4       To       00:50.5,gameId=0022000103,Lakers(94) @ Grizzlies(92),"January 05, 2021",2021-01-07T21:30:27Z,94,Lakers,92,Grizzlies
Q4,00:40.1,Foul: Shooting,De'Anthony Melton,Anthony Davis,CC,Melton (MEM) makes contact to Davis' (LAL) arm and the contact affects his driving shot attempt.,20.4081631% Complete    00:50.5       To       00:40.0,gameId=0022000103,Lakers(94) @ Grizzlies(92),"January 05, 2021",2021-01-07T21:30:27Z,94,Lakers,92,Grizzlies
Q4,00:35.6,Foul: Shooting,Kyle Kuzma,Dillon Brooks,CNC,Kuzma (LAL) maintains a legal guarding position during Brooks' (MEM) jump shot attempt.,12.2448978% Complete    00:40.0       To       00:33.2,gameId=0022000103,Lakers(94) @ Grizzlies(92),"January 05, 2021",2021-01-07T21:30:27Z,94,Lakers,92,Grizzlies
Q4,00:31.1,Foul: Personal,Desmond Bane,LeBron James,CC,Bane (MEM) commits a take foul on James (LAL).,4.08163261% Complete    00:33.2       To       00:31.1,gameId=0022000103,Lakers(94) @ Grizzlies(92),"January 05, 2021",2021-01-07T21:30:27Z,94,Lakers,92,Grizzlies
Q4,00:16.1,Foul: Shooting,Kyle Kuzma,Tyus Jones,CC,Kuzma (LAL) makes contact to Jones' (MEM) arm and the contact affects his driving shot attempt.,4.08163261% Complete    00:18.8       To       00:16.0,gameId=0022000103,Lakers(94) @ Grizzlies(92),"January 05, 2021",2021-01-07T21:30:27Z,94,Lakers,92,Grizzlies
Q4,00:13.3,Foul: Personal,Brandon Clarke,LeBron James,CNC,Clarke (MEM) makes incidental hand on ball contact with James (LAL) as he dislodges the ball.,4.08163261% Complete    00:16.0       To       00:13.3,gameId=0022000103,Lakers(94) @ Grizzlies(92),"January 05, 2021",2021-01-07T21:30:27Z,94,Lakers,92,Grizzlies
Q4,00:01.0,Foul: Offensive,Wesley Matthews,De'Anthony Melton,CNC,Melton (MEM) jumps backwards into Matthews (LAL) to go for the steal and the contact is incidental.  Matthews does not dislodge Melton from his position.,2.04081631% Complete    00:01.2       To       00:00.0,gameId=0022000103,Lakers(94) @ Grizzlies(92),"January 05, 2021",2021-01-07T21:30:27Z,94,Lakers,92,Grizzlies
Q4,01:57.2,Foul: Personal,Patrick Beverley,Dejounte Murray,CC,Beverley (LAC) reaches across Murray's (SAS) body and makes contact to his front that affects his SQBR.,40.8163261% Complete    02:05.9       To       01:45.0,gameId=0022000105,Spurs(116) @ Clippers(113),"January 05, 2021",2021-01-07T21:30:48Z,116,Spurs,113,Clippers
Q4,01:54.0,Foul: Offensive,Dejounte Murray,Luke Kennard,CNC,Murray (SAS) releases from Kennard (LAC) at the end of his drive.,40.8163261% Complete    02:05.9       To       01:45.0,gameId=0022000105,Spurs(116) @ Clippers(113),"January 05, 2021",2021-01-07T21:30:48Z,116,Spurs,113,Clippers
Q4,01:36.1,Foul: Offensive,Lou Williams,Keldon Johnson,CNC,Williams (LAC) establishes himself in a screening position in the path of Johnson (SAS) and absorbs the contact.,26.5306129% Complete    01:45.0       To       01:31.5,gameId=0022000105,Spurs(116) @ Clippers(113),"January 05, 2021",2021-01-07T21:30:48Z,116,Spurs,113,Clippers
Q4,01:14,Foul: Personal,Lou Williams,Keldon Johnson,CNC,Williams (LAC) makes clean contact to the ball while defending Johnson (SAS) at the start of his drive.,46.9387741% Complete    01:31.5       To       01:07.9,gameId=0022000105,Spurs(116) @ Clippers(113),"January 05, 2021",2021-01-07T21:30:48Z,116,Spurs,113,Clippers
Q4,01:13,Foul: Personal,Luke Kennard,Keldon Johnson,CNC,Kennard (LAC) makes marginal contact to Johnson's (SAS) leg.,46.9387741% Complete    01:31.5       To       01:07.9,gameId=0022000105,Spurs(116) @ Clippers(113),"January 05, 2021",2021-01-07T21:30:48Z,116,Spurs,113,Clippers
Q4,01:09.8,Foul: Offensive,Dejounte Murray,Lou Williams,CNC,Murray (SAS) extends his leg as part of a natural shooting motion on the jump shot attempt and the contact with Williams (LAC) is marginal.,46.9387741% Complete    01:31.5       To       01:07.9,gameId=0022000105,Spurs(116) @ Clippers(113),"January 05, 2021",2021-01-07T21:30:48Z,116,Spurs,113,Clippers
Q4,01:00.4,Foul: Shooting,Keldon Johnson,Patrick Beverley,CNC,Johnson (SAS) jumps alongside of Beverley (LAC) and absorbs the contact during his driving shot attempt.,16.32653% Complete    01:07.9       To       00:59.6,gameId=0022000105,Spurs(116) @ Clippers(113),"January 05, 2021",2021-01-07T21:30:48Z,116,Spurs,113,Clippers
Q4,00:51.2,Foul: Personal,Nicolas Batum,Dejounte Murray,CNC,Batum (LAC) makes clean contact to the ball while defending Murray (SAS) on the perimeter.,16.32653% Complete    00:59.6       To       00:51.2,gameId=0022000105,Spurs(116) @ Clippers(113),"January 05, 2021",2021-01-07T21:30:48Z,116,Spurs,113,Clippers
Q4,00:47.4,Foul: Shooting,Dejounte Murray,Nicolas Batum,CC,Murray (SAS) makes contact to Batum's (LAC) arm that affects his dunk attempt.,6.122449% Complete    00:51.2       To       00:47.4,gameId=0022000105,Spurs(116) @ Clippers(113),"January 05, 2021",2021-01-07T21:30:48Z,116,Spurs,113,Clippers
Q4,00:39.6,Foul: Personal,Luke Kennard,DeMar DeRozan,CNC,Kennard (LAC) places a hand to the front of DeRozan (SAS) at the start of the drive but the contact marginal.,28.5714283% Complete    00:47.4       To       00:33.4,gameId=0022000105,Spurs(116) @ Clippers(113),"January 05, 2021",2021-01-07T21:30:48Z,116,Spurs,113,Clippers
Q4,00:35.9,Foul: Shooting,Luke Kennard,DeMar DeRozan,CNC,Kennard (LAC) makes marginal contact to DeRozan's (SAS) leg on his follow through after making clean contact to the ball.,28.5714283% Complete    00:47.4       To       00:33.4,gameId=0022000105,Spurs(116) @ Clippers(113),"January 05, 2021",2021-01-07T21:30:48Z,116,Spurs,113,Clippers
Q4,00:34.2,Foul: Shooting,Patrick Beverley,Rudy Gay,CNC,Beverley (LAC) makes incidental contact with Gay's (SAS) arm during the rebound attempt.,28.5714283% Complete    00:47.4       To       00:33.4,gameId=0022000105,Spurs(116) @ Clippers(113),"January 05, 2021",2021-01-07T21:30:48Z,116,Spurs,113,Clippers
Q4,00:32.7,Foul: Personal,Rudy Gay,Luke Kennard,CNC,Gay (SAS) brushes Kennard's (LAC) arm and does not affect his control of the loose ball.,55.10204% Complete    00:33.4       To       00:05.7,gameId=0022000105,Spurs(116) @ Clippers(113),"January 05, 2021",2021-01-07T21:30:48Z,116,Spurs,113,Clippers
Q4,00:17.8,Foul: Shooting,Dejounte Murray,Lou Williams,CNC,Murray (SAS) makes incidental contact to Williams' (LAC) arm after the release that does not affect his jump shot attempt.,55.10204% Complete    00:33.4       To       00:05.7,gameId=0022000105,Spurs(116) @ Clippers(113),"January 05, 2021",2021-01-07T21:30:48Z,116,Spurs,113,Clippers
Q4,00:13.6,Foul: Loose Ball,Patrick Beverley,Rudy Gay,CNC,Beverley (LAC) makes marginal contact with Gay (SAS) as he brushes his arm during the rebound.,55.10204% Complete    00:33.4       To       00:05.7,gameId=0022000105,Spurs(116) @ Clippers(113),"January 05, 2021",2021-01-07T21:30:48Z,116,Spurs,113,Clippers
Q4,00:05.7,Foul: Loose Ball,Patrick Beverley,Patty Mills,CC,"Beverley (LAC) pushes Mills (SAS) in the back and dislodges him from his position.  After communicating with the Replay Center, it is determined that Mills is the free throw shooter.",1% Complete    00:05.7       To       00:05.6,gameId=0022000105,Spurs(116) @ Clippers(113),"January 05, 2021",2021-01-07T21:30:48Z,116,Spurs,113,Clippers
Q4,00:05.7,Foul: Offensive,Kawhi Leonard,DeMar DeRozan,CNC,Leonard (LAC) releases from DeRozan (SAS) during the inbound.,1% Complete    00:05.7       To       00:05.6,gameId=0022000105,Spurs(116) @ Clippers(113),"January 05, 2021",2021-01-07T21:30:48Z,116,Spurs,113,Clippers
Q4,00:02.7,Foul: Offensive,Kawhi Leonard,DeMar DeRozan,CNC,Leonard (LAC) extends his leg as part of a natural shooting motion on the jump shot attempt and the contact with DeRozan (SAS) is marginal.,8.163265% Complete    00:05.6       To       00:00.8,gameId=0022000105,Spurs(116) @ Clippers(113),"January 05, 2021",2021-01-07T21:30:48Z,116,Spurs,113,Clippers
Q4,01:58.2,Foul: Offensive,Jusuf Nurkic,Zach LaVine,CNC,Nurkic (POR) establishes himself in a legal picking position in LaVine's (CHI) path.,57.1428566% Complete    02:09.0       To       01:41.0,gameId=0022000106,Bulls(111) @ Trail Blazers(108),"January 05, 2021",2021-01-07T21:31:11Z,111,Bulls,108,Trail Blazers
Q4,01:56.1,Foul: Personal,Wendell Carter Jr.,Damian Lillard,IC,While the foul call is correct the contact from Carter Jr. (CHI) occurs after Lillard (POR) has gathered the ball and continuation should be granted.,57.1428566% Complete    02:09.0       To       01:41.0,gameId=0022000106,Bulls(111) @ Trail Blazers(108),"January 05, 2021",2021-01-07T21:31:11Z,111,Bulls,108,Trail Blazers
Q4,01:54.5,Foul: Offensive,Jusuf Nurkic,Zach LaVine,CNC,Nurkic (POR) legally firms up in LaVine's (CHI) path and does not deliver any contact during the pick.,57.1428566% Complete    02:09.0       To       01:41.0,gameId=0022000106,Bulls(111) @ Trail Blazers(108),"January 05, 2021",2021-01-07T21:31:11Z,111,Bulls,108,Trail Blazers
Q4,01:41.6,Foul: Shooting,Zach LaVine,Damian Lillard,CC,LaVine (CHI) makes contact to Lillard's (POR) body during his jump shot attempt.,57.1428566% Complete    02:09.0       To       01:41.0,gameId=0022000106,Bulls(111) @ Trail Blazers(108),"January 05, 2021",2021-01-07T21:31:11Z,111,Bulls,108,Trail Blazers
Q4,01:34.2,Foul: Offensive,Otto Porter Jr.,Derrick Jones Jr.,CNC,Porter Jr. (CHI) establishes himself in a legal picking position in Jones Jr.'s (POR) path and does not deliver any contact.,26.5306129% Complete    01:41.0       To       01:27.1,gameId=0022000106,Bulls(111) @ Trail Blazers(108),"January 05, 2021",2021-01-07T21:31:11Z,111,Bulls,108,Trail Blazers
Q4,01:30.9,Foul: Personal,Jusuf Nurkic,Thaddeus Young,CNC,Nurkic (POR) makes marginal contact with Young (CHI) during the drive.,26.5306129% Complete    01:41.0       To       01:27.1,gameId=0022000106,Bulls(111) @ Trail Blazers(108),"January 05, 2021",2021-01-07T21:31:11Z,111,Bulls,108,Trail Blazers
Q4,01:30.1,Foul: Offensive,Thaddeus Young,Jusuf Nurkic,CNC,"After Nurkic (POR) initiates marginal contact with Young (CHI), Young slightly extends his off-arm. The contact is marginal and Nurkic is able to defend the shot attempt at the basket. The reaction is not consistent with the level of contact.",26.5306129% Complete    01:41.0       To       01:27.1,gameId=0022000106,Bulls(111) @ Trail Blazers(108),"January 05, 2021",2021-01-07T21:31:11Z,111,Bulls,108,Trail Blazers
Q4,01:28.0,Foul: Shooting,Jusuf Nurkic,Thaddeus Young,CNC,Nurkic (POR) maintains a legal vertical position as he defends Young's (CHI) driving shot attempt.,26.5306129% Complete    01:41.0       To       01:27.1,gameId=0022000106,Bulls(111) @ Trail Blazers(108),"January 05, 2021",2021-01-07T21:31:11Z,111,Bulls,108,Trail Blazers
Q4,01:17.8,Foul: Shooting,Otto Porter Jr.,Robert Covington,CNC,"Porter Jr. (CHI) makes incidental ""high-five"" contact with Covington (POR) after the release that does not affect his jump shot attempt.",22.44898% Complete    01:27.1       To       01:16.1,gameId=0022000106,Bulls(111) @ Trail Blazers(108),"January 05, 2021",2021-01-07T21:31:11Z,111,Bulls,108,Trail Blazers
Q4,00:49.5,Foul: Loose Ball,Derrick Jones Jr.,Otto Porter Jr.,CNC,Jones Jr. (POR) engages and disengages with Porter Jr. (CHI) during the rebound.,77.55102% Complete    01:16.1       To       00:38.0,gameId=0022000106,Bulls(111) @ Trail Blazers(108),"January 05, 2021",2021-01-07T21:31:11Z,111,Bulls,108,Trail Blazers
Q4,00:46.5,Foul: Personal,Robert Covington,Otto Porter Jr.,CC,Covington (POR) makes contact with Porter Jr.'s (CHI) arm.,77.55102% Complete    01:16.1       To       00:38.0,gameId=0022000106,Bulls(111) @ Trail Blazers(108),"January 05, 2021",2021-01-07T21:31:11Z,111,Bulls,108,Trail Blazers
Q4,00:38.0,Foul: Offensive,Thaddeus Young,Robert Covington,CC,Covington (POR) establishes himself in a legal defensive position outside of the RA and absorbs the contact delivered by Young (CHI) during the play at the basket.,77.55102% Complete    01:16.1       To       00:38.0,gameId=0022000106,Bulls(111) @ Trail Blazers(108),"January 05, 2021",2021-01-07T21:31:11Z,111,Bulls,108,Trail Blazers
Q4,00:30.8,Foul: Personal,Garrett Temple,Damian Lillard,CC,Temple (CHI) makes contact with Lillard (POR) that affects his SQBR during the drive.,14.2857141% Complete    00:38.0       To       00:30.7,gameId=0022000106,Bulls(111) @ Trail Blazers(108),"January 05, 2021",2021-01-07T21:31:11Z,111,Bulls,108,Trail Blazers
Q4,00:25.6,Foul: Personal Block,Derrick Jones Jr.,Zach LaVine,CNC,Jones Jr. (POR) makes incidental foot to foot contact with LaVine (CHI).,40.8163261% Complete    00:30.7       To       00:10.6,gameId=0022000106,Bulls(111) @ Trail Blazers(108),"January 05, 2021",2021-01-07T21:31:11Z,111,Bulls,108,Trail Blazers
Q4,00:22.3,Foul: Personal,Jusuf Nurkic,Zach LaVine,CNC,Nurkic (POR) establishes himself in a legal defensive position and absorbs the contact from LaVine (CHI) on the gather.,40.8163261% Complete    00:30.7       To       00:10.6,gameId=0022000106,Bulls(111) @ Trail Blazers(108),"January 05, 2021",2021-01-07T21:31:11Z,111,Bulls,108,Trail Blazers
Q4,00:13.8,Foul: Offensive,Thaddeus Young,Derrick Jones Jr.,CNC,Young (CHI) establishes himself in a legal picking position in Jones Jr.'s (POR) path.,40.8163261% Complete    00:30.7       To       00:10.6,gameId=0022000106,Bulls(111) @ Trail Blazers(108),"January 05, 2021",2021-01-07T21:31:11Z,111,Bulls,108,Trail Blazers
Q4,00:10.7,Foul: Away from Play,Garrett Temple,Damian Lillard,CNC,Temple (CHI) makes marginal contact with Lillard (POR) as Lillard abruptly stops in Temple's path.,8.163265% Complete    00:10.6       To       00:05.8,gameId=0022000106,Bulls(111) @ Trail Blazers(108),"January 05, 2021",2021-01-07T21:31:11Z,111,Bulls,108,Trail Blazers
