period,time,call_type,committing,disadvantaged,decision,comments,stint,game_id,game_details,game_date,scrape_time
Q4,01:52.6,Foul: Shooting,Chris Paul,Robert Covington,CNC,Paul (OKC) makes marginal contact with Covington (HOU) during his shot attempt.,42.8571434% Complete    02:13.4       To       01:52.1,gameId=0041900177,Thunder(102) @ Rockets(104),"September 02, 2020",2020-09-03T20:27:39Z
Q4,01:52.1,Foul: Loose Ball,Chris Paul,Robert Covington,CNC,Paul (OKC) and Covington (HOU) briefly engage and separate during the rebound.,42.8571434% Complete    02:13.4       To       01:52.1,gameId=0041900177,Thunder(102) @ Rockets(104),"September 02, 2020",2020-09-03T20:27:39Z
Q4,01:11.3,Foul: Offensive,Shai Gilgeous-Alexander,Eric Gordon,CNC,Gilgeous-Alexander (OKC) makes marginal contact with Gordon (HOU) while setting the screen.,53.0612259% Complete    01:25.9       To       00:59.7,gameId=0041900177,Thunder(102) @ Rockets(104),"September 02, 2020",2020-09-03T20:27:39Z
Q4,01:10.2,Foul: Personal,Russell Westbrook,Shai Gilgeous-Alexander,CNC,Westbrook (HOU) makes marginal contact with Gilgeous-Alexander (OKC) at the start of the drive.,53.0612259% Complete    01:25.9       To       00:59.7,gameId=0041900177,Thunder(102) @ Rockets(104),"September 02, 2020",2020-09-03T20:27:39Z
Q4,01:06,Turnover: Traveling,Shai Gilgeous-Alexander,Rockets,CNC,Gilgeous-Alexander (OKC) releases the pass prior to his foot landing on the ground.,53.0612259% Complete    01:25.9       To       00:59.7,gameId=0041900177,Thunder(102) @ Rockets(104),"September 02, 2020",2020-09-03T20:27:39Z
Q4,01:03.5,Turnover: 3 Second Violation,Steven Adams,Rockets,INC,Adams (OKC) is in the lane for longer than three seconds.,53.0612259% Complete    01:25.9       To       00:59.7,gameId=0041900177,Thunder(102) @ Rockets(104),"September 02, 2020",2020-09-03T20:27:39Z
Q4,01:00,Violation: Kicked Ball,P.J. Tucker,Rockets,CNC,"Tucker (HOU) makes contact to the ball with his foot, but does not intentionally kick it.",53.0612259% Complete    01:25.9       To       00:59.7,gameId=0041900177,Thunder(102) @ Rockets(104),"September 02, 2020",2020-09-03T20:27:39Z
Q4,00:59.7,Foul: Loose Ball,Steven Adams,P.J. Tucker,CNC,Adams (OKC) and Tucker (HOU) briefly engage and separate during the rebound.,53.0612259% Complete    01:25.9       To       00:59.7,gameId=0041900177,Thunder(102) @ Rockets(104),"September 02, 2020",2020-09-03T20:27:39Z
Q4,00:55.6,Foul: Offensive,Eric Gordon,Chris Paul,CNC,Gordon (HOU) goes to not through Paul (OKC). Paul's reaction is not consistent with the level of contact.,12.2448978% Complete    00:59.7       To       00:53.4,gameId=0041900177,Thunder(102) @ Rockets(104),"September 02, 2020",2020-09-03T20:27:39Z
Q4,00:53.4,Foul: Personal,Steven Adams,Eric Gordon,CNC,Adams (OKC) maintains a legal guarding position on Gordon (HOU) and cleanly steals the ball.,12.2448978% Complete    00:59.7       To       00:53.4,gameId=0041900177,Thunder(102) @ Rockets(104),"September 02, 2020",2020-09-03T20:27:39Z
Q4,00:48.6,Foul: Offensive,Chris Paul,James Harden,CNC,Paul (OKC) goes to not through Harden (HOU) during his drive. Harden's reaction is not consistent with the level of contact.,18.3673477% Complete    00:53.4       To       00:44.3,gameId=0041900177,Thunder(102) @ Rockets(104),"September 02, 2020",2020-09-03T20:27:39Z
Q4,00:44.3,Foul: Loose Ball,P.J. Tucker,Luguentz Dort,CNC,Tucker (HOU) and Dort (OKC) engage and disengage during the rebound.,18.3673477% Complete    00:53.4       To       00:44.3,gameId=0041900177,Thunder(102) @ Rockets(104),"September 02, 2020",2020-09-03T20:27:39Z
Q4,00:33.3,Foul: Personal,Luguentz Dort,James Harden,CNC,Dort (OKC) maintains a legal guarding position on Harden (HOU) during the drive.,36.7346954% Complete    00:44.3       To       00:25.5,gameId=0041900177,Thunder(102) @ Rockets(104),"September 02, 2020",2020-09-03T20:27:39Z
Q4,00:30,Foul: Offensive,P.J. Tucker,Dennis Schroder,CNC,Tucker (HOU) establishes his position in Schroder's (OKC) path while setting the screen and gives him room to avoid the contact.,36.7346954% Complete    00:44.3       To       00:25.5,gameId=0041900177,Thunder(102) @ Rockets(104),"September 02, 2020",2020-09-03T20:27:39Z
Q4,00:26.5,Foul: Shooting,Dennis Schroder,Russell Westbrook,CNC,Schroder (OKC) rests his hand on Westbrook's (HOU) body and makes marginal contact as he moves along his path to defend the shot attempt.,36.7346954% Complete    00:44.3       To       00:25.5,gameId=0041900177,Thunder(102) @ Rockets(104),"September 02, 2020",2020-09-03T20:27:39Z
Q4,00:06.7,Foul: Personal,Robert Covington,Shai Gilgeous-Alexander,CNC,Covington (HOU) maintains a legal guarding position on Gilgeous-Alexander (OKC).,44.89796% Complete    00:25.5       To       00:02.7,gameId=0041900177,Thunder(102) @ Rockets(104),"September 02, 2020",2020-09-03T20:27:39Z
Q4,00:04.3,Foul: Shooting,James Harden,Luguentz Dort,CNC,"Harden (HOU) cleanly blocks Dort's (OKC) shot attempt, jumping to his side and making clean contact with the ball.",44.89796% Complete    00:25.5       To       00:02.7,gameId=0041900177,Thunder(102) @ Rockets(104),"September 02, 2020",2020-09-03T20:27:39Z
Q4,00:02.9,Turnover:  Out of Bounds - Bad Pass Turn,Luguentz Dort,James Harden,CC,"Referees conduct a replay review following the ball going out of bounds and determine that Dort (OKC) jumped from out of bounds and made contact with the ball, and 1.4 seconds is added to the game clock.",44.89796% Complete    00:25.5       To       00:02.7,gameId=0041900177,Thunder(102) @ Rockets(104),"September 02, 2020",2020-09-03T20:27:39Z
Q4,00:02.7,Foul: Away from Play,Luguentz Dort,James Harden,CNC,Dort (OKC) and Harden (HOU) briefly engage and separate during the inbound.,2.04081631% Complete    00:02.7       To       00:01.1,gameId=0041900177,Thunder(102) @ Rockets(104),"September 02, 2020",2020-09-03T20:27:39Z
Q4,00:02.0,Foul: Personal,Luguentz Dort,James Harden,CC,Dort (OKC) commits a take foul on Harden (HOU).,2.04081631% Complete    00:02.7       To       00:01.1,gameId=0041900177,Thunder(102) @ Rockets(104),"September 02, 2020",2020-09-03T20:27:39Z
Q4,00:01.4,Foul: Personal,Luguentz Dort,Robert Covington,CC,Dort (OKC) commits a take foul on Covington (HOU).,2.04081631% Complete    00:02.7       To       00:01.1,gameId=0041900177,Thunder(102) @ Rockets(104),"September 02, 2020",2020-09-03T20:27:39Z
Q4,00:01.2,Foul: Away from Play,James Harden,Chris Paul,CC,"Before the inbound, Harden (HOU) holds Paul (OKC) and an away from the play foul is called.  During the inbound, Coach Donovan (OKC) attempts to call a timeout but the foul occurs prior to the timeout.",2.04081631% Complete    00:02.7       To       00:01.1,gameId=0041900177,Thunder(102) @ Rockets(104),"September 02, 2020",2020-09-03T20:27:39Z
Q4,00:01.2,Foul: Loose Ball,Steven Adams,P.J. Tucker,CNC,Adams (OKC) and Tucker (HOU) engage and disengage during the rebound.,2.04081631% Complete    00:02.7       To       00:01.1,gameId=0041900177,Thunder(102) @ Rockets(104),"September 02, 2020",2020-09-03T20:27:39Z
Q4,00:01.1,Foul: Personal,Russell Westbrook,Steven Adams,CNC,Westbrook (OKC) deflects the pass away before making incidental contact with Adams (OKC).,2.04081631% Complete    00:01.1       To       00:00.0,gameId=0041900177,Thunder(102) @ Rockets(104),"September 02, 2020",2020-09-03T20:27:39Z
