period,time,call_type,committing,disadvantaged,decision,comments,stint,game_id,game_details,game_date,scrape_time
Q4,01:53.4,Foul: Shooting,Dorian Finney-Smith,Trae Young,CC,Finney-Smith (DAL) jumps towards and makes contact to Young's (ATL) lower body as he is landing on his jumpshot.,38.77551% Complete    02:11.0       To       01:51.5,gameId=0021900837,Mavericks(107) @ Hawks(111),"February 22, 2020",2020-02-24T14:20:00Z
Q4,01:51.5,Foul: Loose Ball,Dewayne Dedmon,Maxi Kleber,CNC,Dedmon (ATL) and Kleber (DAL) engage and separate during the rebound.,38.77551% Complete    02:11.0       To       01:51.5,gameId=0021900837,Mavericks(107) @ Hawks(111),"February 22, 2020",2020-02-24T14:20:00Z
Q4,01:49,Foul: Personal,Dewayne Dedmon,Tim Hardaway Jr.,CNC,"Dedmon's (ATL) hand slides off the ball and brushes Hardaway Jr.'s (DAL) arm, but the contact is marginal and does not affect his ability to maintain control of the ball.",26.5306129% Complete    01:51.5       To       01:38.0,gameId=0021900837,Mavericks(107) @ Hawks(111),"February 22, 2020",2020-02-24T14:20:00Z
Q4,01:40.0,Foul: Shooting,Kevin Huerter,Maxi Kleber,CNC,"Huerter (ATL) makes incidental ""high-five"" contact with Kleber (DAL) after the release that does not affect his ability to follow through naturally on his  jump shot attempt.",26.5306129% Complete    01:51.5       To       01:38.0,gameId=0021900837,Mavericks(107) @ Hawks(111),"February 22, 2020",2020-02-24T14:20:00Z
Q4,01:17.0,Violation: Kicked Ball,Delon Wright,John Collins,CNC,"As Wright (DAL) and Collins (ATL) disengage, Wright extends his leg and it is inconclusive based solely on the video whether Wright extends in an attempt to get around Collins or to intentionally kick the ball, which would be required for a kicked ball violation (not just foot-ball contact).",48.97959% Complete    01:38.0       To       01:13.3,gameId=0021900837,Mavericks(107) @ Hawks(111),"February 22, 2020",2020-02-24T14:20:00Z
Q4,01:17.0,Foul: Loose Ball,John Collins,Delon Wright,CNC,Collins (ATL) and Wright (DAL) engage and disengage during the rebound.,48.97959% Complete    01:38.0       To       01:13.3,gameId=0021900837,Mavericks(107) @ Hawks(111),"February 22, 2020",2020-02-24T14:20:00Z
Q4,01:16.0,Foul: Loose Ball,John Collins,Tim Hardaway Jr.,CNC,Collins (ATL) and Hardaway Jr. (DAL) connect as they attempt to get to the loose ball.,48.97959% Complete    01:38.0       To       01:13.3,gameId=0021900837,Mavericks(107) @ Hawks(111),"February 22, 2020",2020-02-24T14:20:00Z
Q4,01:13.4,Foul: Shooting,Maxi Kleber,John Collins,CC,Kleber (DAL) is jumping A-B when Collins (ATL) is in his upward shooting motion toward the rim.,48.97959% Complete    01:38.0       To       01:13.3,gameId=0021900837,Mavericks(107) @ Hawks(111),"February 22, 2020",2020-02-24T14:20:00Z
Q4,01:13.3,Foul: Personal,John Collins,Seth Curry,CNC,"During the screen, Collins (ATL) and Curry (DAL) engage and disengage.",10.2040815% Complete    01:13.3       To       01:08.1,gameId=0021900837,Mavericks(107) @ Hawks(111),"February 22, 2020",2020-02-24T14:20:00Z
Q4,00:58.3,Foul: Shooting,Dorian Finney-Smith,Trae Young,CNC,Finney-Smith (DAL) maintains a legal guarding position and absorbs the contact during the driving shot attempt by Young (ATL).,20.4081631% Complete    01:08.1       To       00:57.6,gameId=0021900837,Mavericks(107) @ Hawks(111),"February 22, 2020",2020-02-24T14:20:00Z
Q4,00:50.3,Foul: Offensive,Dorian Finney-Smith,Cam Reddish,CNC,Finney-Smith (DAL) establishes himself in a screening position in Reddish's (ATL) path before the contact.,46.9387741% Complete    00:57.6       To       00:34.3,gameId=0021900837,Mavericks(107) @ Hawks(111),"February 22, 2020",2020-02-24T14:20:00Z
Q4,00:41.5,Foul: Personal,Dewayne Dedmon,Tim Hardaway Jr.,CNC,"Dedmon (ATL) maintains a legal position at the start of Hardaway Jr.'s (DAL) drive, and absorbs contact when Hardaway Jr. turns in toward the rim, and then they separate.",46.9387741% Complete    00:57.6       To       00:34.3,gameId=0021900837,Mavericks(107) @ Hawks(111),"February 22, 2020",2020-02-24T14:20:00Z
Q4,00:40.2,Foul: Shooting,Dewayne Dedmon,Tim Hardaway Jr.,CNC,Dedmon (ATL) again maintains a legal guarding position at the end of Hardaway Jr.'s (DAL) drive and absorbs the contact as he turns and drives toward the rim for a shot.,46.9387741% Complete    00:57.6       To       00:34.3,gameId=0021900837,Mavericks(107) @ Hawks(111),"February 22, 2020",2020-02-24T14:20:00Z
Q4,00:39.9,Foul: Loose Ball,John Collins,Dorian Finney-Smith,CNC,Collins (ATL) cleanly dislodges the ball from Finney-Smith (DAL) during the rebound attempt.,46.9387741% Complete    00:57.6       To       00:34.3,gameId=0021900837,Mavericks(107) @ Hawks(111),"February 22, 2020",2020-02-24T14:20:00Z
Q4,00:37.3,Instant Replay: Overturn Ruling,Mavericks,Hawks,,Replay Review determines the on-court ruling was overturned to Mavericks' ball.,46.9387741% Complete    00:57.6       To       00:34.3,gameId=0021900837,Mavericks(107) @ Hawks(111),"February 22, 2020",2020-02-24T14:20:00Z
Q4,00:37.3,Foul: Personal,John Collins,Justin Jackson,CNC,Collins' (ATL) hand slides off Jackson's (DAL) back during the inbound play and the contact does not affect his FOM.,46.9387741% Complete    00:57.6       To       00:34.3,gameId=0021900837,Mavericks(107) @ Hawks(111),"February 22, 2020",2020-02-24T14:20:00Z
Q4,00:37.3,Foul: Personal,Dewayne Dedmon,Justin Jackson,CNC,"During the inbound, Dedmon (ATL) extends his arm slightly as Jackson (DAL) approaches, but does not affect his FOM as he cuts down the lane.",46.9387741% Complete    00:57.6       To       00:34.3,gameId=0021900837,Mavericks(107) @ Hawks(111),"February 22, 2020",2020-02-24T14:20:00Z
Q4,00:37.3,Foul: Offensive,Dorian Finney-Smith,Cam Reddish,CNC,Finney-Smith (DAL) establishes himself in a screening position in Reddish's (ATL) path and gives him room to avoid the contact.,46.9387741% Complete    00:57.6       To       00:34.3,gameId=0021900837,Mavericks(107) @ Hawks(111),"February 22, 2020",2020-02-24T14:20:00Z
Q4,00:34.3,Foul: Loose Ball,Dorian Finney-Smith,Dewayne Dedmon,CNC,Finney-Smith (DAL) makes marginal contact to Dedmon (ATL) that does not affect his ability to maintain control of the ball.,46.9387741% Complete    00:57.6       To       00:34.3,gameId=0021900837,Mavericks(107) @ Hawks(111),"February 22, 2020",2020-02-24T14:20:00Z
Q4,00:10.2,Violation: Defensive Goaltending,Dorian Finney-Smith,Trae Young,,Play under protest by the Mavericks.,53.0612259% Complete    00:34.3       To       00:08.3,gameId=0021900837,Mavericks(107) @ Hawks(111),"February 22, 2020",2020-02-24T14:20:00Z
Q4,00:10.2,Foul: Shooting,Delon Wright,Trae Young,CNC,Wright (DAL) maintains a legal guarding position during the driving shot attempt by Young (ATL).,53.0612259% Complete    00:34.3       To       00:08.3,gameId=0021900837,Mavericks(107) @ Hawks(111),"February 22, 2020",2020-02-24T14:20:00Z
Q4,00:08.4,Foul: Personal,John Collins,Justin Jackson,CNC,Collins (ATL) and Jackson (DAL) engage and separate during the inbound play.,16.32653% Complete    00:08.3       To       00:00.0,gameId=0021900837,Mavericks(107) @ Hawks(111),"February 22, 2020",2020-02-24T14:20:00Z
Q4,00:06,Foul: Offensive,Tim Hardaway Jr.,Kevin Huerter,CNC,Hardaway Jr. (DAL) releases from the contact with Huerter (ATL) as he steps back into his jump shot attempt.,16.32653% Complete    00:08.3       To       00:00.0,gameId=0021900837,Mavericks(107) @ Hawks(111),"February 22, 2020",2020-02-24T14:20:00Z
Q4,00:01.5,Foul: Loose Ball,John Collins,Delon Wright,CNC,Collins (ATL) makes marginal contact with Wright (DAL) under the basket during the long rebound.,16.32653% Complete    00:08.3       To       00:00.0,gameId=0021900837,Mavericks(107) @ Hawks(111),"February 22, 2020",2020-02-24T14:20:00Z
Q4,00:01.5,Foul: Loose Ball,Dorian Finney-Smith,Dewayne Dedmon,CNC,Finney-Smith (DAL) cleanly dislodges the ball from Dedmon (ATL) prior to making incidental contact.,16.32653% Complete    00:08.3       To       00:00.0,gameId=0021900837,Mavericks(107) @ Hawks(111),"February 22, 2020",2020-02-24T14:20:00Z
