period,time,call_type,committing,disadvantaged,decision,comments,stint,game_id,game_details,game_date,scrape_time
Q4,02:00.5,Foul: Offensive,Mike Conley,Garrett Temple,CNC,Conley (UTA) establishes a legal screening position as he firms up and does not deliver contact to Temple (BKN).,20.4081631% Complete    02:06.9       To       01:56.7,gameId=0021900152,Nets(114) @ Jazz(119),"November 12, 2019",2019-11-18T01:30:09Z
Q4,01:58.2,Foul: Shooting,Kyrie Irving,Donovan Mitchell,CNC,Irving (BKN) moves legally alongside of Mitchell's (UTA) path during his driving shot attempt and cleanly dislodges the ball during his upward shooting motion.,20.4081631% Complete    02:06.9       To       01:56.7,gameId=0021900152,Nets(114) @ Jazz(119),"November 12, 2019",2019-11-18T01:30:09Z
Q4,01:56.7,Foul: Personal,Joe Ingles,Kyrie Irving,CNC,Ingles (UTA) makes marginal arm to arm contact allowing Irving (BKN) to play through the contact and continue his drive.,30.6122456% Complete    01:56.7       To       01:41.5,gameId=0021900152,Nets(114) @ Jazz(119),"November 12, 2019",2019-11-18T01:30:09Z
Q4,01:56.6,Violation: Delay of Game,Donovan Mitchell,Nets,CC,Mitchell (UTA) directs the ball after the made basket and Utah is correctly assessed a Delay of Game Violation.,20.4081631% Complete    02:06.9       To       01:56.7,gameId=0021900152,Nets(114) @ Jazz(119),"November 12, 2019",2019-11-18T01:30:09Z
Q4,01:42.0,Foul: Offensive,DeAndre Jordan,Rudy Gobert,CNC,Jordan (UTA) and Gobert (UTA) briefly engage and disengage in the post.,30.6122456% Complete    01:56.7       To       01:41.5,gameId=0021900152,Nets(114) @ Jazz(119),"November 12, 2019",2019-11-18T01:30:09Z
Q4,01:41.6,Foul: Shooting,Joe Ingles,DeAndre Jordan,CNC,Ingles (UTA) cleanly dislodges the ball during Jordan's (BKN) shot at the rim.,30.6122456% Complete    01:56.7       To       01:41.5,gameId=0021900152,Nets(114) @ Jazz(119),"November 12, 2019",2019-11-18T01:30:09Z
Q4,01:41.5,Turnover: Discontinue Dribble,Joe Ingles,Nets,CNC,"As Ingles (UTA) gathers the ball, Jordan (BKN) gets his hand on the ball, cleanly dislodging the ball from Ingles. Ingles then legally re-gathers the ball.",20.4081631% Complete    01:41.5       To       01:31.2,gameId=0021900152,Nets(114) @ Jazz(119),"November 12, 2019",2019-11-18T01:30:09Z
Q4,01:32.1,Foul: Shooting,Taurean Prince,Rudy Gobert,CNC,Prince (BKN) legally contests Gobert's (UTA) shot at the rim as he does not make contact with Gobert's head.,20.4081631% Complete    01:41.5       To       01:31.2,gameId=0021900152,Nets(114) @ Jazz(119),"November 12, 2019",2019-11-18T01:30:09Z
Q4,01:24.1,Foul: Loose Ball,Joe Harris,Joe Ingles,CNC,Harris (BKN) jumps legally up and down attempting to retrieve the rebound as he does not deliver contact to Ingles (UTA).,32.65306% Complete    01:31.2       To       01:15.1,gameId=0021900152,Nets(114) @ Jazz(119),"November 12, 2019",2019-11-18T01:30:09Z
Q4,01:17.0,Foul: Shooting,Rudy Gobert,Kyrie Irving,CNC,Gobert's (UTA) collapses his left forearm against his body while maintaining a vertical arm during Irving's (BKN) driving shot attempt.,32.65306% Complete    01:31.2       To       01:15.1,gameId=0021900152,Nets(114) @ Jazz(119),"November 12, 2019",2019-11-18T01:30:09Z
Q4,01:06.8,Foul: Offensive,Mike Conley,Garrett Temple,CNC,Conley (UTA) is in a legal picking position as he is firmed up and does not deliver contact to Temple (BKN).,36.7346954% Complete    01:15.1       To       00:56.8,gameId=0021900152,Nets(114) @ Jazz(119),"November 12, 2019",2019-11-18T01:30:09Z
Q4,00:59.7,Foul: Shooting,Kyrie Irving,Donovan Mitchell,CNC,"As Mitchell's (UTA) momentum is already taking him in that direction, Irving's (BKN) rested hand makes marginal contact with Mitchell during the driving shot attempt.",36.7346954% Complete    01:15.1       To       00:56.8,gameId=0021900152,Nets(114) @ Jazz(119),"November 12, 2019",2019-11-18T01:30:09Z
Q4,00:58.4,Foul: Shooting,DeAndre Jordan,Rudy Gobert,CNC,Jordan (BKN) maintains a legal guarding position during the play at the basket by Gobert (UTA).,36.7346954% Complete    01:15.1       To       00:56.8,gameId=0021900152,Nets(114) @ Jazz(119),"November 12, 2019",2019-11-18T01:30:09Z
Q4,00:56.0,Foul: Offensive,Kyrie Irving,Joe Ingles,CNC,"Irving (BKN) briefly places his hand to Ingles' (UTA) leg, but immediately disengages sliding his hand off.",34.69388% Complete    00:56.8       To       00:38.9,gameId=0021900152,Nets(114) @ Jazz(119),"November 12, 2019",2019-11-18T01:30:09Z
Q4,00:40.0,Foul: Shooting,Joe Ingles,Kyrie Irving,CNC,Ingles (UTA) moves legally alongside of Irving (BKN) and makes marginal contact with Irving's arm while contesting the driving shot attempt.,34.69388% Complete    00:56.8       To       00:38.9,gameId=0021900152,Nets(114) @ Jazz(119),"November 12, 2019",2019-11-18T01:30:09Z
Q4,00:21.3,Foul: Personal,Kyrie Irving,Mike Conley,CNC,Irving (BKN) makes marginal contact with Conley (UTA) on the perimeter.,44.89796% Complete    00:38.9       To       00:16.3,gameId=0021900152,Nets(114) @ Jazz(119),"November 12, 2019",2019-11-18T01:30:09Z
Q4,00:17.3,Foul: Shooting,Garrett Temple,Mike Conley,CNC,Shooting foul was initially called on Temple (BKN) for illegal contact to Conley (UTA). Replay review pursuant to a coachs challenge was deemed successful as Temple legally gets to the ball on the jump shot attempt by Conley.,44.89796% Complete    00:38.9       To       00:16.3,gameId=0021900152,Nets(114) @ Jazz(119),"November 12, 2019",2019-11-18T01:30:09Z
Q4,00:15.8,Foul: Loose Ball,Donovan Mitchell,Joe Harris,CNC,"As the ball is being tipped to Harris (BKN) after the jump ball, Mitchell (UTA) makes marginal contact to Harris allowing Harris to retrieve the ball.",20.4081631% Complete    00:16.3       To       00:06.0,gameId=0021900152,Nets(114) @ Jazz(119),"November 12, 2019",2019-11-18T01:30:09Z
Q4,00:10.6,Foul: Offensive,DeAndre Jordan,Joe Ingles,CNC,Jordan (BKN) establishes himself in a legal picking position as he firms up and does not extend his leg into Ingles' (UTA) path.,20.4081631% Complete    00:16.3       To       00:06.0,gameId=0021900152,Nets(114) @ Jazz(119),"November 12, 2019",2019-11-18T01:30:09Z
Q4,00:08.6,Foul: Shooting,Joe Ingles,Kyrie Irving,CNC,Ingles (UTA) maintains a legal guarding position during the jump shot attempt by Irving (BKN).,20.4081631% Complete    00:16.3       To       00:06.0,gameId=0021900152,Nets(114) @ Jazz(119),"November 12, 2019",2019-11-18T01:30:09Z
Q4,00:04.4,Foul: Personal,Kyrie Irving,Rudy Gobert,CC,Irving (BKN) makes contact to Gobert's (UTA) arm causing Gobert to lose control of the ball.,10.2040815% Complete    00:06.0       To       00:01.0,gameId=0021900152,Nets(114) @ Jazz(119),"November 12, 2019",2019-11-18T01:30:09Z
Q4,00:03.8,Foul: Personal,Kyrie Irving,Mike Conley,CC,Irving (BKN) commits a take foul on Conley (UTA).,10.2040815% Complete    00:06.0       To       00:01.0,gameId=0021900152,Nets(114) @ Jazz(119),"November 12, 2019",2019-11-18T01:30:09Z
Q4,00:02.4,Foul: Loose Ball,Bojan Bogdanovic,Taurean Prince,CNC,Bogdanovic (UTA) jumps legally up and down and does not apply force with his forearm to Prince's (BKN) back legally tipping the ball out during the rebound.,10.2040815% Complete    00:06.0       To       00:01.0,gameId=0021900152,Nets(114) @ Jazz(119),"November 12, 2019",2019-11-18T01:30:09Z
Q4,00:02.0,Turnover: Backcourt Turnover,Bojan Bogdanovic,Nets,CNC,Mitchell (UTA) legally retrieves the ball in the back court as Bogdanovic (UTA) never gained full possession of the ball in the front court.,10.2040815% Complete    00:06.0       To       00:01.0,gameId=0021900152,Nets(114) @ Jazz(119),"November 12, 2019",2019-11-18T01:30:09Z
Q4,00:01.0,Foul: Personal,Joe Harris,Donovan Mitchell,CC,Harris (BKN) commits a take foul on Mitchell (UTA).,10.2040815% Complete    00:06.0       To       00:01.0,gameId=0021900152,Nets(114) @ Jazz(119),"November 12, 2019",2019-11-18T01:30:09Z
