period,time,call_type,committing,disadvantaged,decision,comments,stint,game_id,game_details,game_date,scrape_time
Q4,01:44.8,Turnover:  Out of Bounds - Bad Pass Turn,Tyrese Haliburton,Hawks,CC,Haliburton's (IND) pass goes out of bounds and is not touched by any player on ATL.,02:05.9       To       01:44.8,gameId=0022300039,Pacers(157) @ Hawks(152),"November 21, 2023",2023-12-01T13:28:02Z
Q4,01:25.1,Foul: Personal,Dejounte Murray,Tyrese Haliburton,CNC,Murray (ATL) reaches in and any contact with Haliburton's (IND) arm is marginal.,01:30.6       To       01:19.2,gameId=0022300039,Pacers(157) @ Hawks(152),"November 21, 2023",2023-12-01T13:28:02Z
Q4,01:19.2,Foul: Personal,Buddy Hield,Dejounte Murray,CNC,Hield (IND) is in a legal guarding position during Murray's (ATL) drive to the basket and makes clean contact with the ball when he reaches in.  Any further contact with Murray is incidental.,01:19.2       To       01:07.0,gameId=0022300039,Pacers(157) @ Hawks(152),"November 21, 2023",2023-12-01T13:28:02Z
Q4,01:07.9,Foul: Shooting,Buddy Hield,Saddiq Bey,CNC,"Hield (IND) jumps vertically and although he lowers his left arm, he absorbs the body contact with Bey (ATL) during the shot attempt.",01:19.2       To       01:07.0,gameId=0022300039,Pacers(157) @ Hawks(152),"November 21, 2023",2023-12-01T13:28:02Z
Q4,00:55.1,Foul: Personal,Bogdan Bogdanovic,Buddy Hield,CNC,Bogdanovic (ATL) briefly places a hand on Hield's (IND) arm as he makes a move on the perimeter and the contact is marginal.,01:07.0       To       00:51.9,gameId=0022300039,Pacers(157) @ Hawks(152),"November 21, 2023",2023-12-01T13:28:02Z
Q4,00:33.2,Foul: Offensive,Dejounte Murray,Obi Toppin,CC,Replay review of the foul called on Murray (ATL) pursuant to a coach's challenge was deemed unsuccessful. Murray (ATL) abnormally extends his right leg during his jump shot attempt and initiates more than marginal contact with Toppin (IND) as he defends the play.,00:51.9       To       00:34.5,gameId=0022300039,Pacers(157) @ Hawks(152),"November 21, 2023",2023-12-01T13:28:02Z
Q4,00:23.1,Foul: Offensive,Tyrese Haliburton,Trae Young,CNC,Haliburton (IND) and Young (ATL) briefly engage and disengage on the perimeter.,00:34.5       To       00:14.3,gameId=0022300039,Pacers(157) @ Hawks(152),"November 21, 2023",2023-12-01T13:28:02Z
Q4,00:14.3,Foul: Personal,Trae Young,Tyrese Haliburton,CNC,"Young (ATL) does not initiate any illegal contact with Haliburton (IND) during his drive to the basket, and he loses control of the ball on his own.",00:34.5       To       00:14.3,gameId=0022300039,Pacers(157) @ Hawks(152),"November 21, 2023",2023-12-01T13:28:02Z
Q4,00:10.4,Foul: Shooting,Aaron Nesmith,Dejounte Murray,CNC,Nesmith (IND) jumps alongside of Murray (ATL) during his driving shot attempt and the body contact after he releases the shot is incidental.,00:14.3       To       00:08.6,gameId=0022300039,Pacers(157) @ Hawks(152),"November 21, 2023",2023-12-01T13:28:02Z
