period,time,call_type,committing,disadvantaged,decision,comments,stint,game_id,game_details,game_date,scrape_time
Q4,01:43.6,Foul: Offensive,Jaxson Hayes,Jamal Murray,CNC,"Hayes (LAL) establishes himself in a screening position in Murray's (DEN) path and absorbs the contact.  As he releases away to roll, he brings his hands towards Murray and marginal contact occurs.",01:56.5       To       01:38.1,gameId=0022300740,Nuggets(114) @ Lakers(106),"February 08, 2024",2024-02-10T04:17:51Z
Q4,01:38.1,Foul: Loose Ball,Nikola Jokic,Jaxson Hayes,CNC,Jokic (DEN) has his forearm extended and incidental contact occurs with Hayes (LAL) as the two players reach for the loose ball.,01:56.5       To       01:38.1,gameId=0022300740,Nuggets(114) @ Lakers(106),"February 08, 2024",2024-02-10T04:17:51Z
Q4,01:31.8,Foul: Personal,Jamal Murray,Anthony Davis,CNC,Davis (LAL) establishes himself in a screening position and incidental contact occurs when Murray (DEN) moves into the screen.,01:32.5       To       01:23.6,gameId=0022300740,Nuggets(114) @ Lakers(106),"February 08, 2024",2024-02-10T04:17:51Z
Q4,01:26.5,Foul: Offensive,Anthony Davis,Jamal Murray,CNC,Davis (LAL) hands the ball off and the resulting contact with Murray (DEN) on the perimeter is marginal.,01:32.5       To       01:23.6,gameId=0022300740,Nuggets(114) @ Lakers(106),"February 08, 2024",2024-02-10T04:17:51Z
Q4,01:00.4,Foul: Shooting,Nikola Jokic,Austin Reaves,CNC,Jokic (DEN) is in a legal guarding position moving alongside of Reaves' (LAL) path to the basket and incidental contact occurs when Reaves steps into Jokic.,01:05.4       To       00:59.0,gameId=0022300740,Nuggets(114) @ Lakers(106),"February 08, 2024",2024-02-10T04:17:51Z
Q4,00:45.7,Foul: Shooting,Peyton Watson,LeBron James,CNC,Watson (DEN) maintains verticality and absorbs the body contact that occurs during James' (LAL) driving shot attempt.,00:52.7       To       00:44.7,gameId=0022300740,Nuggets(114) @ Lakers(106),"February 08, 2024",2024-02-10T04:17:51Z
Q4,00:33.0,Foul: Personal,Anthony Davis,Nikola Jokic,CNC,Davis (LAL) reaches in as Jokic (DEN) briefly loses control of the ball and the contact is marginal.,00:44.7       To       00:20.7,gameId=0022300740,Nuggets(114) @ Lakers(106),"February 08, 2024",2024-02-10T04:17:51Z
Q4,00:20.3,Turnover: 24 Second Violation,Aaron Gordon,Lakers,CC,A 24-second shot clock violation is whistled before Davis (LAL) gains full possession of the ball.,00:44.7       To       00:20.7,gameId=0022300740,Nuggets(114) @ Lakers(106),"February 08, 2024",2024-02-10T04:17:51Z
