period,time,call_type,committing,disadvantaged,decision,comments,stint,game_id,game_details,game_date,scrape_time
Q4,01:43.2,Foul: Loose Ball,Saddiq Bey,Paolo Banchero,CNC,Bey (DET) establishes position in front of Banchero (ORL) and legally boxes out the offensive player during the rebounding opportunity.,36.734695% Complete    02:01.9       To       01:43.2,gameId=0022200003,Magic(109) @ Pistons(113),"October 19, 2022",2022-10-23T19:55:28Z
Q4,01:31.1,Foul: Personal,Paolo Banchero,Bojan Bogdanovic,CNC,Banchero (ORL) momentarily places and removes a resting hand from Bogdanovic's (DET) body as the players move towards the ballhandler.,32.65306% Complete    01:43.2       To       01:26.4,gameId=0022200003,Magic(109) @ Pistons(113),"October 19, 2022",2022-10-23T19:55:28Z
Q4,01:29.1,Foul: Personal,Paolo Banchero,Jaden Ivey,CNC,Banchero (ORL) moves along Ivey's (DET) path as marginal contact occurs on the perimeter.,32.65306% Complete    01:43.2       To       01:26.4,gameId=0022200003,Magic(109) @ Pistons(113),"October 19, 2022",2022-10-23T19:55:28Z
Q4,01:27.0,Foul: Defense 3 Second,Wendell Carter Jr.,Pistons,INC,Carter Jr. (ORL) is in the paint for longer than three seconds without imminently actively guarding an opponent.,32.65306% Complete    01:43.2       To       01:26.4,gameId=0022200003,Magic(109) @ Pistons(113),"October 19, 2022",2022-10-23T19:55:28Z
Q4,01:26.4,Foul: Personal,R.J. Hampton,Jaden Ivey,CNC,Hampton (ORL) lowers his arm down and makes contact with the ball to disrupt Ivey's (DET) live dribble. Any arm contact after the dislodge is considered incidental.,32.65306% Complete    01:43.2       To       01:26.4,gameId=0022200003,Magic(109) @ Pistons(113),"October 19, 2022",2022-10-23T19:55:28Z
Q4,01:22.0,Foul: Shooting,Bojan Bogdanovic,Paolo Banchero,CNC,Bogdanovic (DET) swipes at the ball and his arm passes in front of Banchero (ORL) without making any contact during the latter's layup attempt.,10.204082% Complete    01:26.4       To       01:21.2,gameId=0022200003,Magic(109) @ Pistons(113),"October 19, 2022",2022-10-23T19:55:28Z
Q4,01:12.0,Foul: Personal,Paolo Banchero,Bojan Bogdanovic,CNC,Banchero (ORL) briefly places his left arm on Bogdanovic's (DET) body and removes it as the offensive player proceeds towards a screening position. The contact in the play is marginal.,42.857143% Complete    01:21.2       To       00:59.5,gameId=0022200003,Magic(109) @ Pistons(113),"October 19, 2022",2022-10-23T19:55:28Z
Q4,01:02.6,Foul: Shooting,Paolo Banchero,Bojan Bogdanovic,CNC,Banchero (ORL) legally contests Bogdanovic's (DET) perimeter shot attempt.,42.857143% Complete    01:21.2       To       00:59.5,gameId=0022200003,Magic(109) @ Pistons(113),"October 19, 2022",2022-10-23T19:55:28Z
Q4,00:59.5,Foul: Loose Ball,Wendell Carter Jr.,Isaiah Stewart,CC,Carter Jr. (ORL) reaches his arms out to secure the rebound and his left arm makes contact with Stewart's (DET) right arm prior to any contact with the ball.,42.857143% Complete    01:21.2       To       00:59.5,gameId=0022200003,Magic(109) @ Pistons(113),"October 19, 2022",2022-10-23T19:55:28Z
Q4,00:51.9,Foul: Shooting,Isaiah Stewart,Franz Wagner,CNC,Stewart (DET) legally contests Wagner's (ORL) driving shot attempt.,16.32653% Complete    00:59.5       To       00:50.9,gameId=0022200003,Magic(109) @ Pistons(113),"October 19, 2022",2022-10-23T19:55:28Z
Q4,00:50.9,Foul: Offensive,Cade Cunningham,Franz Wagner,CNC,Wagner (ORL) and Cunningham (DET) engage during the inbounds and the latter's arms come out as he releases away from the defender. The contact on the play is marginal.,22.44898% Complete    00:50.9       To       00:39.8,gameId=0022200003,Magic(109) @ Pistons(113),"October 19, 2022",2022-10-23T19:55:28Z
Q4,00:41.0,Foul: Shooting,Paolo Banchero,Cade Cunningham,CNC,Banchero (ORL) absorbs the contact from Cunningham (DET) as the former retreats during the driving shot attempt.,22.44898% Complete    00:50.9       To       00:39.8,gameId=0022200003,Magic(109) @ Pistons(113),"October 19, 2022",2022-10-23T19:55:28Z
Q4,00:39.8,Foul: Loose Ball,Terrence Ross,Isaiah Stewart,CNC,Ross (ORL) places and removes his hands from Stewart's (DET) body as Stewart launches into the air for the ball. The contact during the loose ball is marginal.,22.44898% Complete    00:50.9       To       00:39.8,gameId=0022200003,Magic(109) @ Pistons(113),"October 19, 2022",2022-10-23T19:55:28Z
Q4,00:35.3,Foul: Shooting,Bojan Bogdanovic,Paolo Banchero,CNC,Bogdanovic (DET) collapses his left forearm as he jumps to defend Banchero's (ORL) driving shot attempt and the contact is marginal.,10.204082% Complete    00:39.8       To       00:34.6,gameId=0022200003,Magic(109) @ Pistons(113),"October 19, 2022",2022-10-23T19:55:28Z
Q4,00:17.4,Foul: Personal,Paolo Banchero,Cade Cunningham,CNC,"Banchero (ORL) moves alongside Cunningham's (DET) path after the pick, and the contact on the play is marginal.",46.938774% Complete    00:34.6       To       00:11.6,gameId=0022200003,Magic(109) @ Pistons(113),"October 19, 2022",2022-10-23T19:55:28Z
Q4,00:17.4,Foul: Offensive,Bojan Bogdanovic,Franz Wagner,CNC,Bogdanovic (DET) and Wagner (ORL) briefly engage and separate as they both retreat from the pick.,46.938774% Complete    00:34.6       To       00:11.6,gameId=0022200003,Magic(109) @ Pistons(113),"October 19, 2022",2022-10-23T19:55:28Z
Q4,00:14.8,Foul: Personal,Franz Wagner,Bojan Bogdanovic,CNC,Wagner (ORL) steps to his right as Bogdanovic (DET) cuts into the lane and incidental foot-to-foot contact occurs as Cunningham releases his pass to the corner.,46.938774% Complete    00:34.6       To       00:11.6,gameId=0022200003,Magic(109) @ Pistons(113),"October 19, 2022",2022-10-23T19:55:28Z
Q4,00:11.6,Foul: Personal,Isaiah Stewart,Paolo Banchero,CNC,Stewart (DET) briefly places and then removes his arms from Banchero's (ORL) side during the inbounds play. The contact on the play is marginal.,12.244898% Complete    00:11.6       To       00:05.5,gameId=0022200003,Magic(109) @ Pistons(113),"October 19, 2022",2022-10-23T19:55:28Z
Q4,00:10.1,Foul: Shooting,Isaiah Stewart,Terrence Ross,CNC,Stewart (DET) legally contests the perimeter jump shot attempt from Ross (ORL).,12.244898% Complete    00:11.6       To       00:05.5,gameId=0022200003,Magic(109) @ Pistons(113),"October 19, 2022",2022-10-23T19:55:28Z
Q4,00:05.5,Foul: Shooting,Saddiq Bey,Paolo Banchero,IC,Bey (DET) gets to ball height and cleanly dislodges the ball prior to incidental contact occurring with Banchero (ORL) on the follow through.,12.244898% Complete    00:11.6       To       00:05.5,gameId=0022200003,Magic(109) @ Pistons(113),"October 19, 2022",2022-10-23T19:55:28Z
Q4,00:04.8,Foul: Personal,Terrence Ross,Bojan Bogdanovic,CC,Ross (ORL) commits a take foul on Bogdanovic (DET). The transition take foul rule is not in effect with under two minutes to go in the fourth quarter.,1% Complete    00:05.5       To       00:04.6,gameId=0022200003,Magic(109) @ Pistons(113),"October 19, 2022",2022-10-23T19:55:28Z
Q4,00:03.2,Foul: Shooting,Isaiah Stewart,Franz Wagner,INC,Stewart's (DET) right hand makes contact with Wagner's (ORL) left arm during the offensive player's upward shooting motion.,8.163265% Complete    00:04.6       To       00:00.0,gameId=0022200003,Magic(109) @ Pistons(113),"October 19, 2022",2022-10-23T19:55:28Z
