period,time,call_type,committing,disadvantaged,decision,comments,stint,game_id,game_details,game_date,scrape_time
Q4,01:55.0,Foul: Personal,Kenrich Williams,LeBron James,CNC,Williams (OKC) moves alongside James' (LAL) path and marginal contact occurs during the drive.,18.367348% Complete    02:01.0       To       01:51.9,gameId=0022200821,Thunder(133) @ Lakers(130),"February 07, 2023",2023-02-10T21:22:00Z
Q4,01:53.3,Foul: Shooting,Kenrich Williams,LeBron James,CNC,Williams (OKC) legally contests James' (LAL) driving shot attempt.,18.367348% Complete    02:01.0       To       01:51.9,gameId=0022200821,Thunder(133) @ Lakers(130),"February 07, 2023",2023-02-10T21:22:00Z
Q4,01:53.3,Foul: Shooting,Shai Gilgeous-Alexander,LeBron James,CNC,Gilgeous-Alexander (OKC) legally contests James' (LAL) driving shot attempt at the basket.,18.367348% Complete    02:01.0       To       01:51.9,gameId=0022200821,Thunder(133) @ Lakers(130),"February 07, 2023",2023-02-10T21:22:00Z
Q4,01:39.4,Foul: Offensive,Jalen Williams,Troy Brown Jr.,CNC,Williams (OKC) establishes himself in Brown Jr.'s (LAL) path and does not deliver illegal contact when setting the pick.,42.857143% Complete    01:51.9       To       01:30.5,gameId=0022200821,Thunder(133) @ Lakers(130),"February 07, 2023",2023-02-10T21:22:00Z
Q4,01:33.2,Foul: Shooting,Russell Westbrook,Josh Giddey,CNC,Westbrook (LAL) legally contests Giddey's (OKC) perimeter jump shot attempt.,42.857143% Complete    01:51.9       To       01:30.5,gameId=0022200821,Thunder(133) @ Lakers(130),"February 07, 2023",2023-02-10T21:22:00Z
Q4,01:30.5,Foul: Loose Ball,Kenrich Williams,Anthony Davis,CNC,Williams (OKC) brushes Davis' (LAL) arm as he attempts to secure the rebound and the contact is marginal.,42.857143% Complete    01:51.9       To       01:30.5,gameId=0022200821,Thunder(133) @ Lakers(130),"February 07, 2023",2023-02-10T21:22:00Z
Q4,01:23.0,Foul: Personal,Shai Gilgeous-Alexander,Patrick Beverley,INC,Gilgeous-Alexander (OKC) reaches in and makes contact to Beverly's (LAL) arm and affects his ability to maintain control of the ball.,20.408163% Complete    01:30.5       To       01:19.8,gameId=0022200821,Thunder(133) @ Lakers(130),"February 07, 2023",2023-02-10T21:22:00Z
Q4,01:21.0,Foul: Shooting,Jaylin Williams,Russell Westbrook,CNC,Williams (OKC) avoids making contact with Westbrook (LAL) during his contest of the layup attempt at the basket.,20.408163% Complete    01:30.5       To       01:19.8,gameId=0022200821,Thunder(133) @ Lakers(130),"February 07, 2023",2023-02-10T21:22:00Z
Q4,01:09.0,Foul: Personal,Troy Brown Jr.,Shai Gilgeous-Alexander,CNC,Brown Jr. (LAL) moves to Gilgeous-Alexander's (OKC) space and marginal contact occurs prior to the pass.,28.571428% Complete    01:19.8       To       01:05.0,gameId=0022200821,Thunder(133) @ Lakers(130),"February 07, 2023",2023-02-10T21:22:00Z
Q4,01:06.3,Foul: Shooting,Anthony Davis,Jalen Williams,CNC,Davis (LAL) legally contests Williams' (OKC) perimeter shot attempt.,28.571428% Complete    01:19.8       To       01:05.0,gameId=0022200821,Thunder(133) @ Lakers(130),"February 07, 2023",2023-02-10T21:22:00Z
Q4,01:05.0,Foul: Loose Ball,Troy Brown Jr.,Jalen Williams,CNC,Williams (OKC) and Brown Jr. (LAL) simultaneously come into contact with the ball and incidental arm and body contact occurs.,28.571428% Complete    01:19.8       To       01:05.0,gameId=0022200821,Thunder(133) @ Lakers(130),"February 07, 2023",2023-02-10T21:22:00Z
Q4,00:59.2,Foul: Shooting,Shai Gilgeous-Alexander,Russell Westbrook,CNC,Gilgeous-Alexander (OKC) legally contests Westbrook's (LAL) layup attempt at the basket.,12.244898% Complete    01:05.0       To       00:58.1,gameId=0022200821,Thunder(133) @ Lakers(130),"February 07, 2023",2023-02-10T21:22:00Z
Q4,00:50.0,Foul: Offensive,Mike Muscala,Anthony Davis,CNC,Muscala (OKC) establishes himself in Davis' (LAL) path and marginal contact occurs as the players come together during the screen.,28.571428% Complete    00:58.1       To       00:43.3,gameId=0022200821,Thunder(133) @ Lakers(130),"February 07, 2023",2023-02-10T21:22:00Z
Q4,00:44.8,Foul: Personal,Anthony Davis,Josh Giddey,CNC,Davis (LAL) brings his arm around Giddey (OKC) and marginal arm contact occurs at the start of Giddey's drive.,28.571428% Complete    00:58.1       To       00:43.3,gameId=0022200821,Thunder(133) @ Lakers(130),"February 07, 2023",2023-02-10T21:22:00Z
Q4,00:43.3,Foul: Personal,Troy Brown Jr.,Josh Giddey,CNC,Brown Jr. (LAL) legally deflects Giddey's (OKC) pass after the release.,28.571428% Complete    00:58.1       To       00:43.3,gameId=0022200821,Thunder(133) @ Lakers(130),"February 07, 2023",2023-02-10T21:22:00Z
Q4,00:37.7,Foul: Shooting,Shai Gilgeous-Alexander,Russell Westbrook,CC,"Gilgeous-Alexander (OKC) extends his hand forward and initiates contact with Westbrook's (LAL) arm, which affects his driving shot attempt.",46.938774% Complete    00:43.3       To       00:20.3,gameId=0022200821,Thunder(133) @ Lakers(130),"February 07, 2023",2023-02-10T21:22:00Z
Q4,00:37.7,Foul: Loose Ball,Anthony Davis,Mike Muscala,CNC,Davis (LAL) briefly clamps Muscala's (OKC) arm and releases while rebounding.,46.938774% Complete    00:43.3       To       00:20.3,gameId=0022200821,Thunder(133) @ Lakers(130),"February 07, 2023",2023-02-10T21:22:00Z
Q4,00:37.6,Foul: Loose Ball,Troy Brown Jr.,Josh Giddey,CNC,Brown Jr. (LAL) and Giddey (OKC) bring their hands to the ball simultaneously and incidental contact occurs during the rebound.,46.938774% Complete    00:43.3       To       00:20.3,gameId=0022200821,Thunder(133) @ Lakers(130),"February 07, 2023",2023-02-10T21:22:00Z
Q4,00:37.4,Foul: Loose Ball,Russell Westbrook,Josh Giddey,CNC,"Westbrook (LAL) brings his hand to the ball and part of Giddey's (OKC) hand that is on the ball, which dislodges it during the rebounding opportunity. Giddey proceeds to lose his balance and fall to the floor after the dislodge.",46.938774% Complete    00:43.3       To       00:20.3,gameId=0022200821,Thunder(133) @ Lakers(130),"February 07, 2023",2023-02-10T21:22:00Z
Q4,00:36.0,Foul: Loose Ball,Russell Westbrook,Shai Gilgeous-Alexander,INC,"Westbrook (LAL) initiates arm contact with Gilgeous-Alexander (OKC), which affects his ability to secure the loose ball.",46.938774% Complete    00:43.3       To       00:20.3,gameId=0022200821,Thunder(133) @ Lakers(130),"February 07, 2023",2023-02-10T21:22:00Z
Q4,00:32.5,Foul: Personal,Isaiah Joe,Patrick Beverley,CNC,Joe (OKC) goes to the ground on his own accord and avoids making contact with Beverley (LAL).,46.938774% Complete    00:43.3       To       00:20.3,gameId=0022200821,Thunder(133) @ Lakers(130),"February 07, 2023",2023-02-10T21:22:00Z
Q4,00:29.8,Foul: Shooting,Josh Giddey,Dennis Schroder,CNC,Giddey (OKC) legally contests Schroder's (LAL) perimeter shot attempt.,46.938774% Complete    00:43.3       To       00:20.3,gameId=0022200821,Thunder(133) @ Lakers(130),"February 07, 2023",2023-02-10T21:22:00Z
Q4,00:26.2,Foul: Loose Ball,Patrick Beverley,Shai Gilgeous-Alexander,CNC,Replay review of the loose ball foul called on Beverley (LAL) pursuant to a coach's challenge was deemed successful. Beverley makes contact with the ball and cleanly dislodges it from Gilgeous-Alexander (OKC).,46.938774% Complete    00:43.3       To       00:20.3,gameId=0022200821,Thunder(133) @ Lakers(130),"February 07, 2023",2023-02-10T21:22:00Z
Q4,00:26.1,Stoppage: Inadvertent Whistle,Thunder,Lakers,IC,"OKC should have been awarded the ball following the successful challenge since Williams (OKC) had imminent possession at the point of interruption, which occurred after the ball was dislodged.",46.938774% Complete    00:43.3       To       00:20.3,gameId=0022200821,Thunder(133) @ Lakers(130),"February 07, 2023",2023-02-10T21:22:00Z
Q4,00:20.4,Foul: Shooting,Kenrich Williams,Russell Westbrook,CC,"Prior to any contact with the ball, Williams (OKC) jumps from point A to point B and initiates body contact with Westbrook (LAL) that affects his driving shot attempt.",46.938774% Complete    00:43.3       To       00:20.3,gameId=0022200821,Thunder(133) @ Lakers(130),"February 07, 2023",2023-02-10T21:22:00Z
Q4,00:19.0,Foul: Personal,Dennis Schroder,Shai Gilgeous-Alexander,CC,Schroder (LAL) commits a take foul on Gilgeous-Alexander (OKC).,4.0816326% Complete    00:20.3       To       00:17.8,gameId=0022200821,Thunder(133) @ Lakers(130),"February 07, 2023",2023-02-10T21:22:00Z
Q4,00:19.0,Foul: Personal,Troy Brown Jr.,Jalen Williams,CNC,Brown Jr. (LAL) and Williams (OKC) come together during the inbound and the contact is marginal.,4.0816326% Complete    00:20.3       To       00:17.8,gameId=0022200821,Thunder(133) @ Lakers(130),"February 07, 2023",2023-02-10T21:22:00Z
Q4,00:17.9,Foul: Personal,Patrick Beverley,Jalen Williams,CC,Beverley (LAL) commits a take foul on Williams (OKC). The transition take foul rule does not apply to the last two minutes of either the fourth quarter or overtime.,4.0816326% Complete    00:20.3       To       00:17.8,gameId=0022200821,Thunder(133) @ Lakers(130),"February 07, 2023",2023-02-10T21:22:00Z
Q4,00:17.9,Stoppage: Inadvertent Whistle,Russell Westbrook,Thunder,CNC,"Play is stopped due to a clock malfunction. After the correction, play resumes with Los Angeles retaining possession.",10.204082% Complete    00:17.8       To       00:12.6,gameId=0022200821,Thunder(133) @ Lakers(130),"February 07, 2023",2023-02-10T21:22:00Z
Q4,00:14.2,Turnover: Traveling,Russell Westbrook,Thunder,INC,Westbrook (LAL) gathers the ball on his right foot and takes more than two steps prior to releasing his shot attempt.,10.204082% Complete    00:17.8       To       00:12.6,gameId=0022200821,Thunder(133) @ Lakers(130),"February 07, 2023",2023-02-10T21:22:00Z
Q4,00:14.1,Foul: Shooting,Jalen Williams,Russell Westbrook,CNC,Williams (LAL) brings his arm to a legal vertical position and legally contests Westbrook's (OKC) driving shot attempt.,10.204082% Complete    00:17.8       To       00:12.6,gameId=0022200821,Thunder(133) @ Lakers(130),"February 07, 2023",2023-02-10T21:22:00Z
Q4,00:06.9,Foul: Shooting,Troy Brown Jr.,Kenrich Williams,CNC,Brown Jr. (LAL) brushes Williams' (OKC) arm and the contact during the dunk attempt at the basket is marginal.,12.244898% Complete    00:12.6       To       00:06.6,gameId=0022200821,Thunder(133) @ Lakers(130),"February 07, 2023",2023-02-10T21:22:00Z
Q4,00:02.9,Foul: Shooting,Jalen Williams,Patrick Beverley,CNC,Williams (OKC) legally contests Beverley's (LAL) perimeter shot attempt.,10.204082% Complete    00:06.6       To       00:01.4,gameId=0022200821,Thunder(133) @ Lakers(130),"February 07, 2023",2023-02-10T21:22:00Z
