period,time,call_type,committing,disadvantaged,decision,comments,stint,game_id,game_details,game_date,scrape_time
Q4,01:52.1,Foul: Shooting,Shake Milton,Reggie Jackson,CNC,Milton (PHI) legally contests Jackson's (LAC) jump shot attempt.,20.408163% Complete    02:00.7       To       01:50.1,gameId=0022200480,Clippers(114) @ 76ers(119),"December 23, 2022",2022-12-25T16:21:15Z
Q4,01:30.5,Foul: Shooting,Nicolas Batum,James Harden,CC,Batum (LAC) extends his right arm forward and is not in a legal guarding position when contact occurs with Harden's (PHI) front/left arm after Harden's gather.,38.77551% Complete    01:50.1       To       01:30.4,gameId=0022200480,Clippers(114) @ 76ers(119),"December 23, 2022",2022-12-25T16:21:15Z
Q4,01:23.4,Foul: Offensive,Marcus Morris Sr.,Tobias Harris,CNC,Morris Sr. (LAC) turns slightly as he firms up over his left foot and he absorbs the side-to-side contact with Harris (PHI) during the screen.,42.857143% Complete    01:30.4       To       01:08.6,gameId=0022200480,Clippers(114) @ 76ers(119),"December 23, 2022",2022-12-25T16:21:15Z
Q4,01:20,Foul: Personal,Tobias Harris,Kawhi Leonard,CNC,Harris (PHI) is moving alongside Leonard's (LAC) path and maintains a rested forearm on Leonard's front when marginal contact occurs at the end of the drive.,42.857143% Complete    01:30.4       To       01:08.6,gameId=0022200480,Clippers(114) @ 76ers(119),"December 23, 2022",2022-12-25T16:21:15Z
Q4,01:08.7,Foul: Personal,Joel Embiid,Marcus Morris Sr.,CC,"Embiid (PHI) extends his left hand forward and initiates contact with Morris Sr.'s (LAC) front, affecting Morris Sr.'s SQBR as he starts his dribble.",42.857143% Complete    01:30.4       To       01:08.6,gameId=0022200480,Clippers(114) @ 76ers(119),"December 23, 2022",2022-12-25T16:21:15Z
Q4,01:02,Foul: Personal,Paul George,Tobias Harris,CNC,George (LAC) jumps forward toward Harris (PHI) and marginal body contact occurs after Harris picks up his dribble in the backcourt. George then leans away from Harris prior to marginal contact occurring with Harris' front as he passes.,20.408163% Complete    01:08.6       To       00:58.4,gameId=0022200480,Clippers(114) @ 76ers(119),"December 23, 2022",2022-12-25T16:21:15Z
Q4,01:00,Foul: Personal,Reggie Jackson,De'Anthony Melton,CNC,Jackson (LAC) brings his right hand toward Melton's (PHI) left side and marginal contact occurs as Melton elevates to pass.,20.408163% Complete    01:08.6       To       00:58.4,gameId=0022200480,Clippers(114) @ 76ers(119),"December 23, 2022",2022-12-25T16:21:15Z
Q4,00:58.4,Foul: Offensive,Paul George,James Harden,CNC,George (LAC) and Harden (PHI) engage and disengage with one another after the expiration of the screen during the inbound.,1% Complete    00:58.4       To       00:57.9,gameId=0022200480,Clippers(114) @ 76ers(119),"December 23, 2022",2022-12-25T16:21:15Z
Q4,00:58.4,Stoppage: Inadvertent Whistle,null,null,CNC,Replay review of the foul called on Batum (LAC) pursuant to a coach's challenge was deemed successful. Batum makes clean contact with the ball and dislodges it away from Embiid (PHI) prior to incidental contact occurring.,20.408163% Complete    01:08.6       To       00:58.4,gameId=0022200480,Clippers(114) @ 76ers(119),"December 23, 2022",2022-12-25T16:21:15Z
Q4,00:56.7,Foul: Shooting,De'Anthony Melton,Paul George,CC,Replay review of the foul called on Melton (PHI) pursuant to a coach's challenge was deemed unsuccessful. Melton extends his right hand forward and initiates contact with George's (LAC) right elbow during his upward shooting motion.,1% Complete    00:58.4       To       00:57.9,gameId=0022200480,Clippers(114) @ 76ers(119),"December 23, 2022",2022-12-25T16:21:15Z
Q4,00:37.9,Foul: Personal,Kawhi Leonard,James Harden,CNC,Leonard (LAC) brushes Harden's (PHI) left wrist and marginal contact occurs as Harden crosses over.,48.97959% Complete    00:57.9       To       00:33.8,gameId=0022200480,Clippers(114) @ 76ers(119),"December 23, 2022",2022-12-25T16:21:15Z
Q4,00:37.3,Foul: Personal,Paul George,Joel Embiid,CNC,George (LAC) and Embiid (PHI) engage and disengage with one another off-ball.,48.97959% Complete    00:57.9       To       00:33.8,gameId=0022200480,Clippers(114) @ 76ers(119),"December 23, 2022",2022-12-25T16:21:15Z
Q4,00:36.0,Foul: Shooting,Kawhi Leonard,James Harden,CNC,Leonard (LAC) and George (LAC) each legally contest Harden's (PHI) driving shot attempt.,48.97959% Complete    00:57.9       To       00:33.8,gameId=0022200480,Clippers(114) @ 76ers(119),"December 23, 2022",2022-12-25T16:21:15Z
Q4,00:35.9,Foul: Loose Ball,Marcus Morris Sr.,Joel Embiid,CNC,Morris Sr. (LAC) brings his hands toward Embiid's (PHI) side and marginal contact occurs after the release of the shot attempt.,48.97959% Complete    00:57.9       To       00:33.8,gameId=0022200480,Clippers(114) @ 76ers(119),"December 23, 2022",2022-12-25T16:21:15Z
Q4,00:33.8,Foul: Loose Ball,Joel Embiid,Kawhi Leonard,CNC,"Embiid (PHI) brings his right arm forward as he pursues the rebound and marginal contact occurs with Leonard's (LAC) shoulder and head as he secures the ball. Contact to an opponent's head/face can be deemed marginal when the result of a natural basketball move, provided the contact is not disproportionate or uncontrolled.",48.97959% Complete    00:57.9       To       00:33.8,gameId=0022200480,Clippers(114) @ 76ers(119),"December 23, 2022",2022-12-25T16:21:15Z
Q4,00:25.4,Turnover: Traveling,Kawhi Leonard,76ers,CNC,Leonard (LAC) gathers the ball on his left foot and takes two steps before elevating for the shot attempt.,20.408163% Complete    00:33.8       To       00:23.6,gameId=0022200480,Clippers(114) @ 76ers(119),"December 23, 2022",2022-12-25T16:21:15Z
Q4,00:23.7,Foul: Shooting,Shake Milton,Kawhi Leonard,CC,"After making initial contact with the ball without dislodging it, Milton (PHI) initiates contact with Leonard's (LAC) right arm and affects his driving shot attempt.",20.408163% Complete    00:33.8       To       00:23.6,gameId=0022200480,Clippers(114) @ 76ers(119),"December 23, 2022",2022-12-25T16:21:15Z
Q4,00:11.1,Foul: Personal,Paul George,Joel Embiid,CC,George (LAC) commits a take foul on Embiid (PHI).,24.489796% Complete    00:23.6       To       00:11.1,gameId=0022200480,Clippers(114) @ 76ers(119),"December 23, 2022",2022-12-25T16:21:15Z
Q4,00:09.8,Foul: Personal,James Harden,Nicolas Batum,CNC,Harden (PHI) brings his left arm forward and marginal contact occurs with Batum's (LAC) left arm prior to the hand-off.,20.408163% Complete    00:11.1       To       00:00.9,gameId=0022200480,Clippers(114) @ 76ers(119),"December 23, 2022",2022-12-25T16:21:15Z
Q4,00:08.1,Foul: Shooting,James Harden,Paul George,CNC,Harden (PHI) legally contests George's (LAC) jump shot attempt.,20.408163% Complete    00:11.1       To       00:00.9,gameId=0022200480,Clippers(114) @ 76ers(119),"December 23, 2022",2022-12-25T16:21:15Z
Q4,00:04.6,Turnover: Traveling,Reggie Jackson,76ers,CNC,Jackson (LAC) maintains his left foot as his pivot along the baseline and his heel does not step out of bounds prior to when he releases the pass.,20.408163% Complete    00:11.1       To       00:00.9,gameId=0022200480,Clippers(114) @ 76ers(119),"December 23, 2022",2022-12-25T16:21:15Z
Q4,00:02.7,Foul: Shooting,Tobias Harris,Marcus Morris Sr.,CNC,Harris (PHI) legally contests Morris Sr.'s (LAC) jump shot attempt.,20.408163% Complete    00:11.1       To       00:00.9,gameId=0022200480,Clippers(114) @ 76ers(119),"December 23, 2022",2022-12-25T16:21:15Z
Q4,00:01.4,Foul: Loose Ball,James Harden,Paul George,CNC,Harden (PHI) releases his hands away from George's (LAC) back and marginal contact occurs as Harden pursues the rebound.,20.408163% Complete    00:11.1       To       00:00.9,gameId=0022200480,Clippers(114) @ 76ers(119),"December 23, 2022",2022-12-25T16:21:15Z
