period,time,call_type,committing,disadvantaged,decision,comments,stint,game_id,game_details,game_date,scrape_time
Q4,01:43.3,Foul: Personal,Pascal Siakam,Hassan Whiteside,CC,Siakam (TOR) makes contact to Whiteside's (SAC) body that dislodges him from his legally obtained position.,36.7346954% Complete    01:50.3       To       01:32.0,gameId=0022000292,Kings(126) @ Raptors(124),"January 29, 2021",2021-03-29T00:28:26Z
Q4,01:34.0,Foul: Defense 3 Second,Pascal Siakam,Kings,CNC,Siakam (TOR) is in the paint for less than three seconds when he is imminently actively guarding an opponent.,36.7346954% Complete    01:50.3       To       01:32.0,gameId=0022000292,Kings(126) @ Raptors(124),"January 29, 2021",2021-03-29T00:28:26Z
Q4,01:32.1,Foul: Shooting,Yuta Watanabe,Hassan Whiteside,CC,Watanabe (TOR) makes contact with Whiteside's (SAC) arm during his shooting motion that affects his shot near the rim. The play was reviewed for a Flagrant Foul and it was deemed that there was no unnecessary contact.,36.7346954% Complete    01:50.3       To       01:32.0,gameId=0022000292,Kings(126) @ Raptors(124),"January 29, 2021",2021-03-29T00:28:26Z
Q4,01:32.0,Foul: Loose Ball,De'Aaron Fox,DeAndre' Bembry,CNC,Bembry (TOR) makes incidental foot to foot contact with Fox (SAC) as he back pedals and the contact causes him to lose his balance.,36.7346954% Complete    01:50.3       To       01:32.0,gameId=0022000292,Kings(126) @ Raptors(124),"January 29, 2021",2021-03-29T00:28:26Z
Q4,01:32.0,Foul: Loose Ball,Pascal Siakam,Harrison Barnes,CNC,"During the rebound, Siakam (TOR) and Barnes (SAC) engage and disengage and the contact is marginal.",36.7346954% Complete    01:50.3       To       01:32.0,gameId=0022000292,Kings(126) @ Raptors(124),"January 29, 2021",2021-03-29T00:28:26Z
Q4,01:09.5,Foul: Shooting,Hassan Whiteside,Yuta Watanabe,CNC,Whiteside (SAC) legally contests Watanabe's (TOR) shot and marginal contact occurs after the release that does not affect his ability to follow-through naturally during the driving shot attempt.,46.9387741% Complete    01:32.0       To       01:08.7,gameId=0022000292,Kings(126) @ Raptors(124),"January 29, 2021",2021-03-29T00:28:26Z
Q4,00:53.8,Foul: Offensive,Harrison Barnes,Yuta Watanabe,CNC,Watanabe (TOR) maintains a legal guarding position on Barnes' (SAC) drive and after the pass he makes incidental foot to foot contact with his teammate Siakam (TOR).,48.97959% Complete    01:08.7       To       00:44.5,gameId=0022000292,Kings(126) @ Raptors(124),"January 29, 2021",2021-03-29T00:28:26Z
Q4,00:49.8,Foul: Shooting,Yuta Watanabe,Hassan Whiteside,CNC,Watanabe (TOR) maintains a legal guarding position during the driving shot attempt by Whiteside (SAC) and makes clean ball contact on his dislodge attempt.,48.97959% Complete    01:08.7       To       00:44.5,gameId=0022000292,Kings(126) @ Raptors(124),"January 29, 2021",2021-03-29T00:28:26Z
Q4,00:49.0,Foul: Loose Ball,Fred VanVleet,Hassan Whiteside,CNC,"During the rebound, VanVleet (TOR) makes clean ball contact as he tries to dislodge it from Whiteside (SAC).",48.97959% Complete    01:08.7       To       00:44.5,gameId=0022000292,Kings(126) @ Raptors(124),"January 29, 2021",2021-03-29T00:28:26Z
Q4,00:37.9,Foul: Loose Ball,De'Aaron Fox,Pascal Siakam,CC,Fox (SAC) extends his arms and delivers contact that dislodges Siakam (TOR) from his position during the rebound.,12.2448978% Complete    00:44.5       To       00:37.9,gameId=0022000292,Kings(126) @ Raptors(124),"January 29, 2021",2021-03-29T00:28:26Z
Q4,00:37.9,Turnover: Traveling,De'Aaron Fox,Raptors,CNC,Fox (SAC) fumbles the ball as he receives the pass and then legally starts his dribble.,38.77551% Complete    00:37.9       To       00:18.2,gameId=0022000292,Kings(126) @ Raptors(124),"January 29, 2021",2021-03-29T00:28:26Z
Q4,00:22,Foul: Personal,DeAndre' Bembry,De'Aaron Fox,CNC,"At the end of the drive, Bembry (TOR) maintains a legal guarding position on Fox (SAC) and makes clean ball contact to temporarily dislodge it.",38.77551% Complete    00:37.9       To       00:18.2,gameId=0022000292,Kings(126) @ Raptors(124),"January 29, 2021",2021-03-29T00:28:26Z
Q4,00:18.3,Foul: Shooting,DeAndre' Bembry,De'Aaron Fox,CC,Bembry (TOR) makes contact with Fox's (SAC) arm during his shooting motion that affects his shot near the rim.,38.77551% Complete    00:37.9       To       00:18.2,gameId=0022000292,Kings(126) @ Raptors(124),"January 29, 2021",2021-03-29T00:28:26Z
Q4,00:13,Foul: Offensive,Pascal Siakam,Harrison Barnes,CNC,"During the drive, Siakam (TOR) has an arm extended and marginal contact occurs with Barnes (SAC) when he disengages.",16.32653% Complete    00:18.2       To       00:09.3,gameId=0022000292,Kings(126) @ Raptors(124),"January 29, 2021",2021-03-29T00:28:26Z
Q4,00:12.9,Foul: Personal,Cory Joseph,Kyle Lowry,CNC,"During the screen, Joseph (SAC) and Lowry (TOR) engage and disengage and the contact is marginal.",16.32653% Complete    00:18.2       To       00:09.3,gameId=0022000292,Kings(126) @ Raptors(124),"January 29, 2021",2021-03-29T00:28:26Z
Q4,00:08.5,Foul: Personal,Yuta Watanabe,Harrison Barnes,CC,Watanabe (TOR) commits a take foul on Barnes (SAC).,2.04081631% Complete    00:09.3       To       00:07.5,gameId=0022000292,Kings(126) @ Raptors(124),"January 29, 2021",2021-03-29T00:28:26Z
Q4,00:07.6,Foul: Personal,Harrison Barnes,Pascal Siakam,CNC,Barnes (SAC) and Siakam (TOR) engage and disengage off ball in the post and Barnes' hand gets caught in his jersey.  The contact does not affect his FOM or ability to maintain his post position.,4.08163261% Complete    00:07.5       To       00:05.0,gameId=0022000292,Kings(126) @ Raptors(124),"January 29, 2021",2021-03-29T00:28:26Z
Q4,00:04.0,Foul: Technical,Kyle Lowry,Kings,CC,All Technical Fouls are reviewed by League Operations.,2.04081631% Complete    00:05.0       To       00:04.0,gameId=0022000292,Kings(126) @ Raptors(124),"January 29, 2021",2021-03-29T00:28:26Z
Q4,00:04.0,Foul: Personal,DeAndre' Bembry,De'Aaron Fox,CC,Bembry (TOR) commits a take foul on Fox (SAC).,2.04081631% Complete    00:05.0       To       00:04.0,gameId=0022000292,Kings(126) @ Raptors(124),"January 29, 2021",2021-03-29T00:28:26Z
