period,time,call_type,committing,disadvantaged,decision,comments,stint,game_id,game_details,game_date,scrape_time
Q4,01:52.0,Foul: Personal,Aaron Gordon,Otto Porter Jr.,CNC,Gordon (DEN) grasps and then quickly releases Porter Jr.'s (GSW) left arm off-ball.,36.734695% Complete    02:05.0       To       01:47.0,gameId=0042100164,Warriors(121) @ Nuggets(126),"April 24, 2022",2022-04-25T18:34:33Z
Q4,01:50.0,Foul: Personal,Nikola Jokic,Stephen Curry,CNC,Jokic (DEN) is turning alongside Curry's (GSW) path and marginal body contact occurs as Curry drives inside the perimeter.,36.734695% Complete    02:05.0       To       01:47.0,gameId=0042100164,Warriors(121) @ Nuggets(126),"April 24, 2022",2022-04-25T18:34:33Z
Q4,01:47.9,Foul: Shooting,Aaron Gordon,Stephen Curry,CC,The play originates outside the LDB. Gordon (DEN) is the secondary defender and does not establish a legal guarding position outside of the RA prior to body contact occurring with Curry (GSW) during the follow-through of his driving shot attempt.,36.734695% Complete    02:05.0       To       01:47.0,gameId=0042100164,Warriors(121) @ Nuggets(126),"April 24, 2022",2022-04-25T18:34:33Z
Q4,01:40.2,Foul: Offensive,Nikola Jokic,Jordan Poole,CNC,Jokic (DEN) establishes himself in a screening position in Poole's (GSW) path and gives Poole a step of distance to avoid the contact.,18.367348% Complete    01:47.0       To       01:37.2,gameId=0042100164,Warriors(121) @ Nuggets(126),"April 24, 2022",2022-04-25T18:34:33Z
Q4,01:38.5,Foul: Personal,Jordan Poole,Monte Morris,CNC,Poole (GSW) maintains a rested hand on Morris' (DEN) side and marginal contact occurs prior to Morris losing control of the ball as he attempts to pass.,18.367348% Complete    01:47.0       To       01:37.2,gameId=0042100164,Warriors(121) @ Nuggets(126),"April 24, 2022",2022-04-25T18:34:33Z
Q4,01:37.2,Turnover: Lost Ball Out of Bounds,Monte Morris,Andrew Wiggins,CC,Morris (DEN) touches the ball last before it goes out of bounds.,18.367348% Complete    01:47.0       To       01:37.2,gameId=0042100164,Warriors(121) @ Nuggets(126),"April 24, 2022",2022-04-25T18:34:33Z
Q4,01:24.5,Foul: Offensive,Stephen Curry,Nikola Jokic,CNC,Curry's (GSW) off-arm comes forward toward Jokic's (DEN) side and marginal contact occurs as Curry releases away toward the perimeter.,30.612246% Complete    01:37.2       To       01:22.1,gameId=0042100164,Warriors(121) @ Nuggets(126),"April 24, 2022",2022-04-25T18:34:33Z
Q4,01:23.8,Foul: Shooting,Aaron Gordon,Stephen Curry,CNC,Gordon (DEN) legally contests Curry's (GSW) jump shot attempt.,30.612246% Complete    01:37.2       To       01:22.1,gameId=0042100164,Warriors(121) @ Nuggets(126),"April 24, 2022",2022-04-25T18:34:33Z
Q4,01:15.2,Foul: Personal,Stephen Curry,Nikola Jokic,CNC,Curry (GSW) briefly has his left hand around Jokic's (DEN) left leg before correcting.,30.612246% Complete    01:22.1       To       01:06.5,gameId=0042100164,Warriors(121) @ Nuggets(126),"April 24, 2022",2022-04-25T18:34:33Z
Q4,01:15.2,Foul: Offensive,Nikola Jokic,Stephen Curry,CNC,Jokic (DEN) re-establishes slightly in Curry's (GSW) path and marginal contact occurs following the initial contact during the pick. Jokic then grasps and quickly releases Curry's left arm as Curry goes under.,30.612246% Complete    01:22.1       To       01:06.5,gameId=0042100164,Warriors(121) @ Nuggets(126),"April 24, 2022",2022-04-25T18:34:33Z
Q4,01:13.9,Foul: Offensive,Nikola Jokic,Stephen Curry,CNC,Jokic (DEN) firms up in his screening position in Curry's (GSW) path and absorbs the contact.,30.612246% Complete    01:22.1       To       01:06.5,gameId=0042100164,Warriors(121) @ Nuggets(126),"April 24, 2022",2022-04-25T18:34:33Z
Q4,01:08.9,Foul: Offensive,Nikola Jokic,Otto Porter Jr.,CNC,Jokic (DEN) and Porter Jr. (GSW) engage and disengage with one another as they each attempt to establish post positioning.,30.612246% Complete    01:22.1       To       01:06.5,gameId=0042100164,Warriors(121) @ Nuggets(126),"April 24, 2022",2022-04-25T18:34:33Z
Q4,01:07.2,Foul: Shooting,Otto Porter Jr.,Nikola Jokic,CNC,Porter Jr. (GSW) brings his hands toward Jokic's (DEN) back and marginal contact occurs as Jokic starts his upward shooting motion. Thompson (GSW) jumps toward Jokic to defend the layup attempt and marginal body contact occurs during Jokic's follow-through.,30.612246% Complete    01:22.1       To       01:06.5,gameId=0042100164,Warriors(121) @ Nuggets(126),"April 24, 2022",2022-04-25T18:34:33Z
Q4,00:55.5,Foul: Offensive,Otto Porter Jr.,Austin Rivers,CNC,Porter Jr. (GSW) establishes himself in a screening position in Rivers' (DEN) path and absorbs the contact.,48.97959% Complete    01:06.5       To       00:42.2,gameId=0042100164,Warriors(121) @ Nuggets(126),"April 24, 2022",2022-04-25T18:34:33Z
Q4,00:50.8,Turnover: Traveling,Stephen Curry,Nuggets,INC,Curry (GSW) slides his pivot foot at the start of his dribble.,48.97959% Complete    01:06.5       To       00:42.2,gameId=0042100164,Warriors(121) @ Nuggets(126),"April 24, 2022",2022-04-25T18:34:33Z
Q4,00:48.9,Foul: Personal,Austin Rivers,Stephen Curry,INC,Rivers (DEN) initiates contact across Curry's (GSW) right arm and affects Curry's SQBR as he crosses over.,48.97959% Complete    01:06.5       To       00:42.2,gameId=0042100164,Warriors(121) @ Nuggets(126),"April 24, 2022",2022-04-25T18:34:33Z
Q4,00:47.0,Foul: Shooting,Monte Morris,Klay Thompson,CNC,"Morris (DEN) legally contests Thompson's (GSW) jump shot attempt. Any ""high-five"" contact after the release is considered incidental.",48.97959% Complete    01:06.5       To       00:42.2,gameId=0042100164,Warriors(121) @ Nuggets(126),"April 24, 2022",2022-04-25T18:34:33Z
Q4,00:45.7,Foul: Loose Ball,Will Barton,Andrew Wiggins,CNC,Barton (DEN) brings his forearm toward Wiggins' (GSW) left side and marginal contact occurs as Wiggins elevates for the put-back attempt.,48.97959% Complete    01:06.5       To       00:42.2,gameId=0042100164,Warriors(121) @ Nuggets(126),"April 24, 2022",2022-04-25T18:34:33Z
Q4,00:42.3,Turnover: Lost Ball Out of Bounds,Otto Porter Jr.,Nuggets,IC,Morris' (DEN) right leg touches the ball last before it goes out of bounds.,48.97959% Complete    01:06.5       To       00:42.2,gameId=0042100164,Warriors(121) @ Nuggets(126),"April 24, 2022",2022-04-25T18:34:33Z
Q4,00:38.0,Foul: Personal,Kevon Looney,Nikola Jokic,CNC,Looney (GSW) and Jokic (DEN) engage and disengage with one another as Jokic moves to set the pick.,16.32653% Complete    00:42.2       To       00:33.5,gameId=0042100164,Warriors(121) @ Nuggets(126),"April 24, 2022",2022-04-25T18:34:33Z
Q4,00:34.8,Foul: Shooting,Jordan Poole,Monte Morris,CNC,Poole (GSW) legally contests Morris' (DEN) floater attempt.,16.32653% Complete    00:42.2       To       00:33.5,gameId=0042100164,Warriors(121) @ Nuggets(126),"April 24, 2022",2022-04-25T18:34:33Z
Q4,00:33.5,Foul: Personal,Austin Rivers,Andrew Wiggins,CNC,"As he disengages, Rivers (DEN) makes clean contact with the ball and dislodges it away from Wiggins (GSW).",16.32653% Complete    00:42.2       To       00:33.5,gameId=0042100164,Warriors(121) @ Nuggets(126),"April 24, 2022",2022-04-25T18:34:33Z
Q4,00:33.5,Foul: Offensive,Andrew Wiggins,Austin Rivers,CNC,Wiggins (GSW) and Rivers (DEN) engage and disengage with one another as the defensive switch occurs.,16.32653% Complete    00:42.2       To       00:33.5,gameId=0042100164,Warriors(121) @ Nuggets(126),"April 24, 2022",2022-04-25T18:34:33Z
Q4,00:22.3,Foul: Away from Play,Klay Thompson,Monte Morris,CNC,Thompson (GSW) and Morris (DEN) engage and disengage with one another during the inbound.,16.32653% Complete    00:42.2       To       00:33.5,gameId=0042100164,Warriors(121) @ Nuggets(126),"April 24, 2022",2022-04-25T18:34:33Z
Q4,00:13.3,Foul: Offensive,Nikola Jokic,Klay Thompson,CNC,Jokic (DEN) releases his hands away from Thompson's (GSW) side and marginal contact occurs as Jokic turns to roll.,16.32653% Complete    00:42.2       To       00:33.5,gameId=0042100164,Warriors(121) @ Nuggets(126),"April 24, 2022",2022-04-25T18:34:33Z
Q4,00:11.3,Turnover: Traveling,Nikola Jokic,Warriors,CNC,Jokic (DEN) gathers the ball on his left foot and takes two steps before releasing the pass.,16.32653% Complete    00:42.2       To       00:33.5,gameId=0042100164,Warriors(121) @ Nuggets(126),"April 24, 2022",2022-04-25T18:34:33Z
Q4,00:07.1,Foul: Shooting,Austin Rivers,Stephen Curry,CNC,Rivers (DEN) legally contests Curry's (GSW) jump shot attempt.,4.0816326% Complete    00:07.9       To       00:05.7,gameId=0042100164,Warriors(121) @ Nuggets(126),"April 24, 2022",2022-04-25T18:34:33Z
