period,time,call_type,committing,disadvantaged,decision,comments,stint,game_id,game_details,game_date,scrape_time
Q4,01:40.0,Foul: Shooting,Kyle Kuzma,Alec Burks,CC,Kuzma (WAS) makes contact with Burks' (NYK) body that affects his driving shot attempt.,28.571428% Complete    01:54.5       To       01:40.0,gameId=0022101050,Wizards(97) @ Knicks(100),"March 18, 2022",2022-03-21T14:10:55Z
Q4,01:27.1,Foul: Offensive,Kristaps Porzingis,Julius Randle,CNC,Porzingis (WAS) establishes himself in a screening position in the path of Randle (NYK) and absorbs the contact to his front.,30.612246% Complete    01:40.0       To       01:24.5,gameId=0022101050,Wizards(97) @ Knicks(100),"March 18, 2022",2022-03-21T14:10:55Z
Q4,00:32.0,Foul: Personal,Kentavious Caldwell-Pope,RJ Barrett,CNC,Caldwell-Pope (WAS) makes marginal contact to the body of Barrett (NYK) during the drive that does not affect his SQBR.,28.571428% Complete    00:42.0       To       00:27.8,gameId=0022101050,Wizards(97) @ Knicks(100),"March 18, 2022",2022-03-21T14:10:55Z
Q4,00:04.9,Foul: Personal,Kristaps Porzingis,RJ Barrett,CC,Porzingis (WAS) commits a take foul on Barrett (NYK).,2.0408163% Complete    00:06.0       To       00:04.9,gameId=0022101050,Wizards(97) @ Knicks(100),"March 18, 2022",2022-03-21T14:10:55Z
Q4,00:04.9,Foul: Offensive,Kristaps Porzingis,RJ Barrett,CNC,Porzingis (WAS) makes marginal contact to Barrett's (NYK) side during the screen and does not affect his ability to defend the play.,8.163265% Complete    00:04.9       To       00:00.0,gameId=0022101050,Wizards(97) @ Knicks(100),"March 18, 2022",2022-03-21T14:10:55Z
Q4,00:02.5,Foul: Shooting,RJ Barrett,Kentavious Caldwell-Pope,CNC,Barrett (NYK) legally contests Caldwell-Pope's (WAS) jump shot attempt.,8.163265% Complete    00:04.9       To       00:00.0,gameId=0022101050,Wizards(97) @ Knicks(100),"March 18, 2022",2022-03-21T14:10:55Z
