period,time,call_type,committing,disadvantaged,decision,comments,stint,game_id,game_details,game_date,scrape_time
Q4,01:54,Foul: Personal,Darius Garland,Mike Conley,CNC,Garland (CLE) maintains a legal guarding position and absorbs the contact from Conley (UTA) on the perimeter.,55.10204% Complete    02:09.3       To       01:42.2,gameId=0022100349,Jazz(109) @ Cavaliers(108),"December 05, 2021",2021-12-07T19:58:59Z
Q4,01:45.5,Foul: Loose Ball,Rudy Gobert,Jarrett Allen,CNC,Gobert (UTA) briefly grasps Allen's (CLE) arm and marginal contact occurs as he releases toward the rebound.,55.10204% Complete    02:09.3       To       01:42.2,gameId=0022100349,Jazz(109) @ Cavaliers(108),"December 05, 2021",2021-12-07T19:58:59Z
Q4,01:43.3,Foul: Shooting,Jarrett Allen,Rudy Gobert,CNC,"Allen (CLE) makes marginal contact with Gobert's (UTA) arm, which does not affect his made dunk.",55.10204% Complete    02:09.3       To       01:42.2,gameId=0022100349,Jazz(109) @ Cavaliers(108),"December 05, 2021",2021-12-07T19:58:59Z
Q4,01:31,Foul: Offensive,Darius Garland,Donovan Mitchell,CNC,"Garland (CLE) pivots on the perimeter and incidental foot to foot contact occurs with Mitchell (UTA), which causes him to lose his balance and stumble into the legal pick by Allen (CLE).",28.571428% Complete    01:42.2       To       01:27.5,gameId=0022100349,Jazz(109) @ Cavaliers(108),"December 05, 2021",2021-12-07T19:58:59Z
Q4,01:15.1,Foul: Offensive,Rudy Gobert,Darius Garland,CNC,Gobert (UTA) establishes himself in a screening position in Garland's (CLE) path and absorbs the contact on the pick.,38.77551% Complete    01:27.5       To       01:08.1,gameId=0022100349,Jazz(109) @ Cavaliers(108),"December 05, 2021",2021-12-07T19:58:59Z
Q4,01:13,Foul: Offensive,Mike Conley,Darius Garland,CNC,Conley (UTA) does not overtly or abruptly veer into Garland (CLE) and any contact is deemed marginal as they come together during the drive.,38.77551% Complete    01:27.5       To       01:08.1,gameId=0022100349,Jazz(109) @ Cavaliers(108),"December 05, 2021",2021-12-07T19:58:59Z
Q4,01:10.8,Stoppage: Out-of-Bounds,Jarrett Allen,Mike Conley,IC,"Allen (CLE) makes contact with Conley?s (UTA) arm, causing him to lose control of the ball when he tries to gather, and the ball goes out of bounds off of Conley. A defensive foul should have been called on Allen, but no foul was called and the play was incorrectly ruled out of bounds off of CLE.",38.77551% Complete    01:27.5       To       01:08.1,gameId=0022100349,Jazz(109) @ Cavaliers(108),"December 05, 2021",2021-12-07T19:58:59Z
Q4,01:10.7,Foul: Offensive,Rudy Gobert,Lauri Markkanen,CNC,Gobert (UTA) establishes himself in Markkanen's (CLE) path and has his arms slightly extended out when Markkanen initiates the marginal contact by grasping Gobert's arm as they disengage on the screen. The reaction by Markkanen is not commensurate with the level of contact.,38.77551% Complete    01:27.5       To       01:08.1,gameId=0022100349,Jazz(109) @ Cavaliers(108),"December 05, 2021",2021-12-07T19:58:59Z
Q4,00:53,Foul: Personal,Royce O'Neale,Darius Garland,CNC,O'Neale (UTA) maintains a legal guarding position on Garland (CLE) during the drive.,53.061226% Complete    01:08.1       To       00:42.1,gameId=0022100349,Jazz(109) @ Cavaliers(108),"December 05, 2021",2021-12-07T19:58:59Z
Q4,00:51.0,Foul: Shooting,Rudy Gobert,Darius Garland,CNC,Gobert (UTA) places a resting hand on Garland (CLE) and marginal contact occurs as he brushes his arm before cleanly blocking the driving shot attempt.,53.061226% Complete    01:08.1       To       00:42.1,gameId=0022100349,Jazz(109) @ Cavaliers(108),"December 05, 2021",2021-12-07T19:58:59Z
Q4,00:49.3,Stoppage: Out-of-Bounds,Donovan Mitchell,Darius Garland,INC,Mitchell's (UTA) foot comes down out of bounds prior to releasing his pass back in bounds.,53.061226% Complete    01:08.1       To       00:42.1,gameId=0022100349,Jazz(109) @ Cavaliers(108),"December 05, 2021",2021-12-07T19:58:59Z
Q4,00:42.1,Foul: Loose Ball,Jarrett Allen,Royce O'Neale,CNC,Allen (CLE) engages with O'Neale (UTA) during the rebound and the contact is marginal as it does not affect O'Neale's ability to secure the rebound.,53.061226% Complete    01:08.1       To       00:42.1,gameId=0022100349,Jazz(109) @ Cavaliers(108),"December 05, 2021",2021-12-07T19:58:59Z
Q4,00:24.1,Foul: Shooting,Darius Garland,Donovan Mitchell,INC,"Prior to the clean block by Mobley (CLE), Garland (CLE) extends his arm out and makes contact with Mitchell's (UTA) arm, which affects his driving shot attempt.",36.734695% Complete    00:42.1       To       00:23.7,gameId=0022100349,Jazz(109) @ Cavaliers(108),"December 05, 2021",2021-12-07T19:58:59Z
Q4,00:22.4,Foul: Personal,Mike Conley,Ricky Rubio,CNC,Conley (UTA) extends his arm out and marginal contact occurs as he brushes Rubio's (CLE) chest during his transition play up the court.,36.734695% Complete    00:42.1       To       00:23.7,gameId=0022100349,Jazz(109) @ Cavaliers(108),"December 05, 2021",2021-12-07T19:58:59Z
Q4,00:04.5,Foul: Defense 3 Second,Rudy Gobert,Cavaliers,CNC,Gobert (UTA) is in the paint and actively guarding an opponent within three seconds.,46.938774% Complete    00:23.7       To       00:00.0,gameId=0022100349,Jazz(109) @ Cavaliers(108),"December 05, 2021",2021-12-07T19:58:59Z
Q4,00:01.5,Foul: Loose Ball,Jarrett Allen,Rudy Gobert,CNC,"Allen (CLE) briefly grasps and immediately releases Gobert's (UTA) arm and marginal contact occurs, which does not affect his ability to pursue the rebound.",46.938774% Complete    00:23.7       To       00:00.0,gameId=0022100349,Jazz(109) @ Cavaliers(108),"December 05, 2021",2021-12-07T19:58:59Z
Q4,00:01.5,Foul: Loose Ball,Royce O'Neale,Evan Mobley,CNC,Mobley (CLE) never has control of the ball and incidental contact occurs with his arm as O'Neale (UTA) and Gobert (UTA) pursue the rebound.,46.938774% Complete    00:23.7       To       00:00.0,gameId=0022100349,Jazz(109) @ Cavaliers(108),"December 05, 2021",2021-12-07T19:58:59Z
